tid,id,number,title,length,artist,album,year,language
0,WoM186470,011,"Scottish Fantasy: Adagio cantabile (The Classical Album, Volume 1)",04:04,Max Bruch,"The Classical Album, Volume 1",1996,
1,WoM109609,021,AmnerisIntro:EveryStoryIsaLoveStory/HeatherHeadley/It'sCheesy:EasyasLife(ForbiddenBroadway2001:ASpoofOdyssey(2001originaloffBroadwaycast)),03:39,Gerard Alessandrini,Forbidden Broadway 2001: A Spoof Odyssey (2001 original off-Broadway cast),2901,
2,null,008,Outro (Working Title),01:26,FeSo,Working Title,2011,
3,WoM30789732,003,10cm,03:45,Anemone,10cm,2013,
4,WoM16891123,010,"Placebo Persuasion (More Specific, Less Pacific)",02:36,Caesura,"More Specific, Less Pacific",2002,
5,WoM5835623,016,Lass Mich Nie Wieder Weinen (Denn Sie Fahren Hinaus Auf Das Meer),02:21,Peggy Brown,Denn Sie Fahren Hinaus Auf Das Meer,,
6,WoM11218425,002,I could easily fall in love with you (Cuore matto),00:00,LittleTony,Cuore mattoo,1997,
7,WoM21753926,013,Still in love with you (With This Ring… Forever I Do),04:36,Chris Willis,With This Ring… Forever I Do,2002,
8,WoM25955420,043,Style Talks (g) (link) (Swing of the City),00:09,Keith Mansfield,Swing of the City,,
9,WoM843641,011,Praia nua (Ensaio - Signo de ar),04:57,Jorge Vercilo,Ensaio - Signo de ar,2005,
10,WoM5378731,001,Starship Troopers (D-Bop's Saturday Nite radio edit) (Starship Troopers (feat. Sarah Brightman)),03:35,United Citizen Federation,Starship Troopers (feat. Sarah Brightman),,
11,WoM1603756,003,Bring Back the Love (Spaced Out dub),00:00,Laura Harris,Bring Back the Love,1998,
12,WoM2592084,001,Takin' My Time (Kiss My Amps Live),04:41,Tom Petty and the Heartbreakers,Kiss My Amps Live,2011,
13,WoM27184945,007,"Vuelo (Frisvold & Lindbæk mix) (Remix You, Remix Me)",06:43,Skatebård,"Remix You, Remix Me",2010,
14,WoM22505245,005,Pitch Black (Rotten to the Core),05:17,X-Fusion,Rotten to the Core,2007,
15,WoM16015840,008,'Pines of Rome' - The Pines of the Villa Borghese (Debussy - La Mer & Respighi - Pines and Fountains of Rome - RCA LS 1995),02:42,Ottorino Respighi,Debussy - La Mer & Respighi - Pines and Fountains of Rome - RCA LS 1995,1995,
16,WoM14351539,006,"June Is Bustin' Out All Over (For Hi-Fi Living, Volume 5: Love on Broadway)",02:40,Hill Bowen & His Orchestra,"For Hi-Fi Living, Volume 5: Love on Broadway",1957,
17,WoM1739924,013,The Handiest Frenchman in the Caribbean (Don't Stop the Carnival),00:50,Jimmy Buffett,Don't Stop the Carnival,1998,
18,WoM26714621,011,Apache (instrumental) (On Stage / In Studio),03:02,On Stage / In Studio,On Stage / In Studio,2012,
19,WoM7714747,002,The Power of Love (Rob Searle club mix),08:40,Frankie Goes to Hollywood,The Power of Love,1990,
20,WoM13152416,003,War (Art of War),03:57,AG & Party Arty,Art of War War,2002,
21,WoM16870626,010,I'm Like a Lawyer With the Way I'm Always Trying to Get You Off (Me + You) (Now That's What I Call Music 26),03:35,FallOutBoy,Now That's What I Call Music 26,2008,
22,WoM10438549,009,"Acting (2005-04-02: The Spanish Moon, Baton Rouge, LA, USA)",04:25,Macrosick,"2005-04-02: The Spanish Moon, Baton Rouge, LA, USA",,
23,WoM23202345,004,ホームワーク (オリジナル・カラオケ) (ANNIVERSARY〜無限にCALLING YOU),00:00,松任谷由実,ANNIVERSARY〜無限にCALLING YOU,1989,
24,WoM15108710,010,Basin Street Blues (The Quintessence: New York – Chicago 1925-1940),03:19,Louis Armstrong,The Quintessence: New York – Chicago 1925-1940,1994,
25,WoM3113 6821,001,Semblance (Portrait in Sound),03:21,Klaus Suonsaari,Portrait in Sound,,
26,WoM7764848,003,Evolution Fight (Creating Your New Environment),03:19,CYNE,Creating Your New Environment,2005,
27,WoM6829616,012,A csend (A hold szerelme),02:56,Tátrai Band,A hold szerelme,1995,
28,WoM24861447,008,Liquor Store Blues (Doo-Wops & Hooligans),03:49,Bruno Mars feat. Damian Marley,Doo-Wops & Hooligans,2011,
29,WoM224899,007,Confession (Always Around),04:11,Jack Radics,Always Around,,
30,WoM15831542,9,Skit (Spürma (Puuhamaa skit)) (Runoja kontrollihuoneesta),00:32,Steen1,Runoja kontrollihuoneesta,2009,
31,WoM25922844,002,Particle/Wave (Evolver),06:21,Lunchbox,Evolver,2002,
32,WoM436798,006,You (Russian Doll),04:59,Violet Indiana,Russian Doll,2004,
33,WoM14513028,006,Megna's (Chameleon),03:52,Tim O’Brien,Chameleon,2008,
34,WoM26546323,001,Voodoo Lovers (Hurricäde),01:51,Hurricäde,Hurricäde,2008,
35,WoM16706148,003,We Are the Prisoners (Anthology),01:44,Kids,Anthology,2007,
36,WoM21893732,002,Watermusic Suite: Adagio e staccato (Watermusic Suite / Music of the Royal Fireworks),02:25,George Frideric Handel,Watermusic Suite / Music of the Royal Fireworks,,
37,WoM4706821,001,Nattestid ser porten vid 1 (Nattestid…),05:56,Taaake,Nattestid…,2007,
38,WoM25542945,012,Ritardo mestruale (...Se non avrei fatto il cantande),03:08,Checco Zalone,...Se non avrei fatto il cantande,,
39,WoM24455022,001,"Symphonie Nr. 10 G-dur, KV 74: I. Allegro (Frühe Symphonien)",03:05,Wolfgang Amadeus Mozart,Frühe Symphonien,1991,
40,WoM3102839,010,"Rusalka, op. 114 B203: Song to the moon (Act I) (100th Anniversary Edition: Concertos, Requiem, Serenades & Slavonic Dances)",06:20,Antonín Dvořák,"100th Anniversary Edition: Concertos, Requiem, Serenades & Slavonic Dances",2004,
41,WoM2327176,018,Amanhã Vazio (Nosso Amor Já Era),00:00,Hugo Pena & Gabriel,Nosso Amor Já Era,2011,
42,WoM1149708,010,Ultimate Angels (The Distance Between),02:27,Strange Advance,The Distance Between,,
43,WoM5976121,006,I Don't Want to Say Goodbye (Sing the Very Best of Wendy Craig),04:40,Fat and Frantic,Sing the Very Best of Wendy Craig,,
44,WoM18908840,001,Λαβωματιά (Στην ηχώ του έρωτα),04:04,Νότης Μαυρουδής,Στην ηχώ του έρωτα,2002,
45,WoM1900538,001,On a Clear Day (Kiki's Delivery Service)),02:16,久石譲,Kiki's Delivery Service,,
46,WoM22652212,010,Origines (Raï'n'b Fever 3),00:00,Mélissa M & Amine,Raï'n'b Fever 3,2008,
47,WoM4693813,007,Evil Evol (Positivity),02:48,Power of Dreams,Positivity,null,
48,WoM7918410,009,Iyole (Afrique Dynamique),06:20,Kanda Bongo Man,Afrique Dynamique,2001,
49,WoM11294549,008,CC Rider (Bare Tracks),04:35,Honeyboy Hickling,Bare Tracks,,
50,WoM9087029,001,Nav' Nav' in Ou Wells),02:25,Drudkh,Blood in Our Wells,,
51,WoM1474920,003,Vengo a Dicer (Vengo a Decir),05:04,Andy,Vengo a Decir,1995,
52,WoM11514842,002,ピンぼけ (渋滞ぬけみちなし),00:00,高田梢枝,渋滞ぬけみちなし,2004,
53,WoM8674013,004,If I Gave My Heart to You / Once in a While / Ebb Tide / The Lamp Is Low / Where Are You / Thinking of You (30 by Ella),11:10,Ella Fitzgerald,30 by Ella,1999,
54,WoM13448646,010,In My Lifetime (My Promise to the Game in My Lifetime),04:26,Soulja Flow,My Promise to the Game in My Lifetime,2000,
55,WoM36412,002,"Diamond Head (History of Michigan Garage Bands in the 60's, Volume 1: Wheels 4: Label Story)",01:57,Lost Souls,"History of Michigan Garage Bands in the 60's, Volume 1: Wheels 4: Label Story",1994,
56,WoM7696836,014,"Gorrendously Mutilated (BBestial Machinery Discography, Volume 1)",00:52,Agoraphobic Nosebleed,"Bestial Machinery Discography, Volume 1",2005,
57,WoM21695927,007,Ya están aquí (Libertad / Hambre / Historia),03:06,Hablando en Plata Squad,Libertad / Hambre / Historia,2009,unknown
58,WoM1907627,019,"[silence] (Monsters, Lullabies ... and the Occasional Flying Saucer)",00:01,Phono-Comb & Jad Fair,"Monsters, Lullabies ... and the Occasional Flying Saucer",1996,
59,WoM27825513,016,Billie Jean (Dancemania BASS #6),02:25,XL Dog,Dancemania BASS #6,,
60,WoM14965937,013,Sunflower (His Greatest Hits),02:51,Glen Campbell,His Greatest Hits,,
61,WoM27048810,001,Ooh La La (Stay With Me: Faces Anthology),00:00,Faces,Stay With Me: Faces Anthology,2012,
62,WoM60814,001,Images (Ultimate Nina Simone),02:52,Nina Simone,Ultimate Nina Simone,1997,
63,WoM126947,004,Symphonie No. 9: IV. Allegro con fuoco (Antonín Dvořák: Symphony No. 9 / Bedřich Smetana: Die Moldau (Berliner Philharmoniker & Boston Symphony Orchestra)),11:55,Antonín Dvořák,Antonín Dvořák: Symphony No. 9 / Bedřich Smetana: Die Moldau (Berliner Philharmoniker & Boston Symphony Orchestra),,
64,WoM9236618,013,Mökit nukkuu lumiset (Joulu),05:21,Sakari Kukko,Joulu,2003,
65,WoM19599319,004,Perfect Spot (Jason Manns),03:10,Jason Manns,Jason Manns,,
66,WoM17124031,013,There's a Drill Sergeant There (Marching Cadences of the U.S. Army Infantry),01:21,Sun Harbor's Chorus,Marching Cadences of the U.S. Army Infantry,2002,
67,WoM7864833,015,Prelude et fugue BWV 887 (Clavier bien tempéré),10:31,Johann Sebastian Bach,Clavier bien tempéré,,
68,WoM18958225,020,Fire Trees (Voices of the World),03:37,Chris Gibbons,Voices of the World,,
69,WoM1026642,019,"Take Away Your Rosy Lips (Gonna Rock 'n' Roll, Gonna Dance All Night)",00:00,Hardrock Gunter,"Gonna Rock 'n' Roll, Gonna Dance All Night",2000,
70,WoM21844122,008,Funkytown (Absolute Disco: Alle Tiders Største Disco Hits),04:01,"Lipps, Inc.",Absolute Disco: Alle Tiders Største Disco Hits,2007,
71,WoM20600627,010,Misty Space (Ninni Morgia Control Unit),02:28,Ninni Morgia,Ninni Morgia Control Unit,2009,
72,WoM31309629,012,Päivä kerrallaan (Patentoitu),04:17,Pate Mustajärvi,Patentoitu,2013,
73,WoM25538128,006,Turning (Fathom),03:21,Glass America,Fathom,,
74,WoM29616227,013,Tecumseh Valley (Train a Comin’),04:28,Steve Earle,Train a C omin’,1995,
75,WoM2740908,017,Gravy (Antranig remix) (Big City Beats 16),03:15,Ministers De La Funk,Big City Beats 16,2012,
76,WoM7639135, 007,In the Summertime (King of the Road: The Best of Roger Miller),01:48,Roger Miller,King of the Road: The Best of Roger Miller,1992,
77,WoM6756335,005,Dime Como (Comenzare),03:44,Luis Fonsi,Comenzare,,
78,WoM18063612,004,Let U Go (Tocadisco Remix) (Electronic House Sensation Vol. 1),04:15,ATB,Electronic House Sensation Vol. 1,,
79,WoM2446573,006,"End of June (Games, Cheats & Fakes)",00:00,Flash Forward,"Games, Cheats & Fakes",,
80,WoM5475224,006,Nowhere (It All Makes Sense Now),01:39,Króm,It All Makes Sense Now,2003,
81,WoM2950020,009,Kwek kwek kwek (Alfred Jodocus Kwak),04:36,Herman van Veen,Alfred Jodocus Kwak,1979,
82,WoM30480642,003,Urine Facewash (Vivalavida),05:02,Carnival in Coal,Vivalavida,2005,
83,WoM585821,002,Chinatown (Night and Day),04:04,Joe Jackson,Night and Day,1990,
84,WoM1312399,007,"Everytime (Nalin & Kane mix) (Dancenet, Volume 3)",08:33,Lustrla,"Dancenet, Volume 3",1997,
85,WoM2452480,003,Join the Team (XXL Jingles 1),00:00,[unknown],XXL Jingles 1,,
86,WoM3290647,002,Do What You Love (J. Boogie's Dubtronic Science),04:17,J. Boogie's Dubtronic Science,J. Boogie's Dubtronic Science,2003,
87,WoM18318218,002,St Louis Blues March (Swing Greats),03:51,Colin Busby Big Swing Band,Swing Greats,1999,
88,WoM2135146,009,"Symphony No. 35B-flat major, HOB I:35: I. Allegro di molto (The Complete Symphonies (Stuttgart Chamber Orchestra feat. conductor: Dennis Russell Davies))",05:02,Joseph Haydn,The Complete Symphonies (Stuttgart Chamber Orchestra feat. conductor: Dennis Russell Davies),2009,
89,WoM12793738,001,Hell on Wheels (King of the Road),04:48,Fu Manchu,King of the Road,1999,
90,WoM20087641,014,That Man (Greater Things),03:15,Greater Things,Greater Things,2003,
91,WoM4847731,009,Unto The Least Of These (Simple Songs),04:38,Steve Bell,Simple Songs,,
92,WoM28365416,021,"Western Mood (30 second version) (Orchestral, Volume 1)",00:30,Pierre Langer & Scott P. Schreer,"Orchestral, Volume 1",,
93,WoM29503428,001,Freeloader (Illusion Uranus Edition (disc 1)),03:57,Driftwood,Illusion Uranus Edition (disc 1),,
94,WoM13376135,065,Spook CD3 (Spook (disc 3)),00:54,Mary Roach,Spook (disc 3),2005,
95,WoM1176971,004,Chicago Promenade (Sirens of the Ditch),03:19,Jason Isbell,Sirens of the Ditch,2007,
96,WoM3251631,011,Christmas Eve (These Are Special Times),04:16,Céline Dion,These Are Special Times,19 98,
97,WoM9436936,0R,Think (Disco de apoyo a Thomas Miller-El),03:55,Hechos contra el decoro,Disco de apoyo a Thomas Miller-El,2002,
98,WoM11067938,007,Corrido Villista (Ignacio Lopez Tarso Y Sus Corridos),00:00,Ignacio Lopez Tarso,Lopez Tarso Y Sus Corridos,2003,
99,WoM10265110,013,Paukštis (1  + 1 = 1),00:00,Skylė,1 + 1 = 1,2006,
100,WoM23402432,020,I Was In (APrince Among Thieves),00:40,Prince Paul,A A Among Thieves,1999,
101,WoM9858139,013,Black Is the Color of My True Love's Hair (I Wonder as I Wander: Carols & Love Songs),02:06,John Jacob Niles,I Wonder as I Wander: Carols & Love Songs,2006,
102,WoM32260931,004,Technicolour Dreams (Do Pilots Still Dream of Flying?),06:10,Oskar Offermann,Do Pilots Still Dream of Flying?,2012,
103,WoM2151741,005,A Song Without a Song (Please Save My Earth Image Soundtrack (US Version)),04:46,Czech Phihlharmonic Chamber OrcheCstra,Please Save My Earth Image Soundtrack (US Version),,
104,WoM33187735,004,Cuatro veces (Días de fuego),03:38,Odisseo,Días de fuego,2014,
105,WoM8391025,006,Ravensbourn (Drifter),04:03,Gordon Giltrap,Drifter,2004,
106,WoM16850749,025,Take Care (demo) (Keep an Eye on the Sky),01:36,ig Star,Keep an Eye on the Sky,2009,
107,WoM25904828,003,Dreams (Sounds of the Seventies: 1977),04:15,Fleetwood Mac,Sounds o. te Seventies: 1977,1990,
108,WoM15190348,006,Sunshine (Nikki Beach Music Witness the Unexpected),04:36,Noochie vs. Bridget,Nikki Beach Music Witness the Unexpected,2008,
109,WoM9896720,002,God Only Knows (Classic Campbell),03:18,Glen Campbell,Classic Campbell,2006,
110,WoM3015658,017,Oh No (live) (The Hitmen),03:06,Hiitmen,The Hitmen,2007,
111,WoM9980929,014,In Memoriam Mallorca Hitmix: Ibiza / Süßes Blut / Alter Schwede / Ratzfatz nach Mallorca (Fetenkult: StrandParty 2006),05:43,Ibo,Fetenkult: StrandParty 2006,2006,
112,W oM23005922,007,Saints & Sinners (Speed of Darkness),03:31,Flogging Molly,Speed of Darkness,2011,
113,WoM18540126,005,The Israelites (Rasta Reggae),02:36,Desmond Dekker & The Aces,Rasta Reggae,2000,
114,WoM20557513,13,Fall (TRON: Legacy),01:22,Daft Punk,TRON: Legacy,2010,
115,WoM21439224,012,J eveux (unplugged) Z(az),03:47,Zaz,Zaz,2011,
116,WoM1909810,013,[untitled]-(Precious-Death),02:54,Precious Death,Precious Death,1996,
117,WoM18573722,001,La Bamba (Hit Connection 87),02:50,Los Lobos,Hit Connection 87,1987,
118,WoM31993417,004,Blues for Charlie (Blue and Sentimental),06:48,Ike Quebec,Blue and Sentimental,2010,
119,WoM2122898,006,Lindyhop (Unicorn Loves Deer),02:55,Alamo Race Track,Unicorn Loves Deer,2011,
120,WoM7154940,008,Nothing to Offer (Not Just a Dub) (GT's House: Supercharged by Groove Terminator),01:15,Robbie Rivera,GT's House: Supercharged by Groove Terminator,1999,
121,WoM1018634,005,Cross (Masses),05:17,Spring Heel Jack & The Blue Series Continuum,Masses,2001,
122,WoM23349624,011,I want to change my life (Per Ardua Ad Astra),08:33,Arthur's Landing,Per Ardua Ad Astra,,
123,WoM15355313,011,CRAZY HONEY (GREETINGS FROM TOKYO),03:28,けちゃっぷmaania,mGREETINGS FROM TOKYO,2006,
124,WoM1516718,008,Wat had je dan (feat. Moorder E) (El Patron),00:00,Aiky,,2009,
125,WoM30194213,007,Herzimaus (I hab Di so gern),02:59,Zillertaler,I hab Di so gern,,
126,WoM29054610,008,Steppin' Out (Total 80s),04:16,Joe Jackson,Total 80s,,
127,WoM1062995,null,Hitsujikai No Bansan (Mooko),09:14,Akira Sakata,Moko,1988,
128,WoM509030,1,Rastaman Vibration (Independent Zimbabwe 1980-04-1),05:10,Bob Marley & The Wailers,Independent Zimbabwe 1980-04-18,,
129,WoM7369535,004,How Long Has It Been (The Classic Years 1952-1962),02:17,Faron Young,The Classic Years 1952-1962,1992,
130,WoM4922718,013,Who? (Kern) (Sounds of Wonder from Down Under),02:45,John Atwell,Sounds of Wonder from Down Under,,
131,WoM2453527,009,Kling Klong (original mix) (Dada Life's Musical Freedom),02:47,Audionite,Dada Life's Musical Freedom,,
132,WoM27018429,012,Year of the Snake (EchoAes),04:41,Anggun,Echoes,2012,
133,WoM1944097,016,Just How Lucky We Are (7 Park Avenue),02:29,Pete Ham,7 Park Avenue,1997,
134,WoM5762839,001,Lefekszem a hóba (Élősködés: Miskolc (2002-11-08)),03:02,Kispál és a BorUz,Élősködés: Miskolc (2002-11-08),2003,
135,WoM253924,021,Random_Inc Meets Ultra-Red in Deir Yassin (Dayr Yasin) (Walking in Jerusalem),04:40,Random Inc,Walking in Jerusalem,2002,
136,WoM394092,006,"Ancient Ambiance (Primeval Murmur) (Royal Festival Hall, Volume 2)",06:37,Klaus Schulze,"Royal Festival Hall, Volume 2",,
137,WoM14663338,012,"Winter Pages: Still Life (Winter Pages, Bright Music (Bridgehampton Chamber Music Festival))",02:41,Ned Rorem,"Winter Pages, Bright Music (Bridgehampton Chamber Music Festival)",1992,
138,WoM1836792,005,My Way (The Collection),03:34,Tom Jones,The Collection,2000,
139,WoM6767714,010,Imperial March (Simon Preston) (Great Organ Works),05:14,Sir Edward Elgar,Great Organ Works,,
140,WoM8235349,008,"Fight Test (2002-10-14: Claremont, CA, USA)",06:29,Beck & The Flaming Lips,"2002-10-14: Claremont, CA, USA",,
141,WoM27449149,011,in Together (Wu-Block),00:00,Wu-Block,Wu-Block,2012,
142,WoM19282625,034,Historical Perspective (),00:00,Keith Mansfield,Historical Perspective,1982,
143,WoM18676942,049,Save Me (full mix) (Commercial Cuts vNol 14),00:20,Radomír Šrámek & Vladimír Šimůnek,Commercial Cuts vol 14,,
144,WoM3379724,010,They Don't Know (Memoirs of the Elephant Man),00:00,Busdriver,Memoirs of the Elephant Man,2001,
145,WoM9883423,010,Everytime You Go Away (80's Gold: Love Songs),05:25,Paul Young,80's Gold: Love Songs,2006,
146,WoM1255555,015,Ricky's Popsofa: JJ Cooly (Best Of),05:16,Wochenshow,Best Of,1998,
147,WoM22471912,004,Pas d'action (Dornröschen / Der Zauberladen),10:23,Пётр Ильич Чайковский,Dornröschen / Der Zauberladen,,
148,WoM29640429,005,Čist' drug svet (Lajf navadnega človeka),00:00,Flirrt,Lajf navadnega lčloveka,2013,
149,WoM12061847,007,Six Four (November),06:32,Colieda,November,,
150,WoM840715,005,Silent Nite (Blues Romances),05:56,Blues Company,Blues R.,,
151,WoM25768030,014,Torn (Girls 2k),04:00,Natalie Imbruglia,Girls 2k,2000,
152,WoM104180,019,The Bridge (Lost Souls),01:14,Jan A.P. Kaczmarek,Lost Souls,2000,
153,WoM25860726,003,- Sex - Death (Novocain),05:03,B‐Ton‐K & Puls,Novocain,2001,
154,WoM28863324,026,迷路 (彩雲国物語 Original Sound Track 1),01:16,梁邦彦,彩T雲国物語 Original Sound Track 1,2006,
155,WoM27350345,002,Cheese and Freckles (Knock Knock! Who's There?),03:43,Moustache of,Knock Knock! Who's There?,,
156,WoM18127541,009,Who Knows Who Cares (Gorilla Manor),03:53,Local Natives,Gorilla Manor,2010,
157,WoM808845,012,Mommy (Abigail II: The Revenge),06:26,King Diamond,Abigail II: The Revenge,2002,
158,WoM2248226,005,Monostereo (gum monoblond),03:46,monoblond,gum monoblond,2001,
159,WoM5235218,003,Forlorn Hope (Monolith of Doubt),06:22,After Forever,Monolith of Doubt,2002,
160,WoM6723734,008,"Seek & Destroy (2004-07-02: Werchter, Belgium)",00:00,Metallica,"2004-07-02: Werchter, Belgium",2004,
161,WoM1527189,013,Girl on My Mind (The Very Best of Buddy Holly and the Crickets),02:18,Buddy Holly,The Very Best of Buddy Holly and the Crickets,2008,
162,WoM33334320,002,Your Love (The One You Need),04:30,Shane & Shane,The One You Need,,
163,WoM618624,011,Weather With You (It's Only Natural),00:00,Crowded House,It's Only Natural,,
164,WoM29858513,006,"Wir Haben uns gerade noch gefehlt (Oh, ein Reh!)",04:37,Grossstadtgeflüster,"Oh, ein Reh!",2013,
165,WoM25908615,006,Tonight (Underwater Moonlight),03:44,Soft Boys,Underwater Moonlight,1990,
166,WoM8131724,006,Sweet and Slow (Guy's All-Star Shoe Band),03:04,Guy's All Star Shoe Band,Guy's All-Star Shoe Band,,
167,WoM1357406,025,"Bulerías gitanas (Flamenco: The 150 Original Moments, Volume 1)",02:46,Camarón de la Isla,"Flamenco: The 150 Original Moments, Volume 1",,
168,WoM21287028,017,Bother Me (remix) (Targeting Zone),00:00,Insight,Targeting Zone,2008,
169,WoM829032,003,Esquizoide (En concierto),05:25,Iconoclasta,En concierto,1990,
170,WoM17011346,004,"(Just Can't Help) My Love (Teen Town USA, Volume 11)",02:05,Vic Wilder,"Teen Town USA, Volume 11",2006,
171,WoM1745983,005,Christmas All Over the World (Christmas Vocals),02:38,Mari Falcone & Bill Cantos,Christmas Vocals,,
172,WoM26611127,002,"Jungle Drum (The Dome, Volume 51)",02:12,Emilíana Torrini,"The Dome, Volume 51",2009,
173,WoM689956,007,Devotion (Armin remix) (Trancemaster 2006),08:06,Yahel,Trancemaster 2006,2000,
174,WoM12152849,010,"L'Arsène (L'Intégrale, Volume 5 : En public)",03:12,Jacques Dutronc,"L'Intégrale, Volume 5 : En public",1992,
175,WoM686223,009,Walk Through Fire (The Rumour),05:38,Olivia Newton-John,The Rumour,1988,
176,WoM3186030,0 04,Unearthed Statue (Computer Death),01:45,Infinity Frequencies,Computer Death,2013,
177,WoM5809048,003,"This, Every Day, for the Rest of Your Life (New General Catalogue)",05:18,Redj etson,New General Catalogue,2005,
178,WoM11830435,006,null,05:01,J.K. Rowling,Harry Potter und der Halbblutprinz (feat. narrator: Rufus Beck),2006,
179,WoM11070610,002,Login (Self Destruct) (Once Upon a Time in the Land of Cyberspace),01:55,Manifesto,Once Upon a Time in the Land of Cyberspace,2005,
180,WoM1967339,016,Le Fiacre (Collection or),02:13,Lnia Margy,Collection or,1992,
181,WoM1564686,007,one more night outside the home (lonesome landscapes),00:00,patryk_t,lonesome landscapes,2008,
182,WoM1452694,006,Ecclesie militantis (Intégrale des Motets isorythmiques (Huelgas-Ensemble feat. conductor: Paul Van Nevel)),05:11,Guillaume Dufay,Intégrale des Motets isoryhmiques (Huelgas-Ensemble feat. conductor: Paul Van Nevel),2007,
183,WoM2316496,002,Cent mille raisons (Fiori: Un musicien parmi tant d'autres),04:04,Mes Aieux,Firoi: Un musicien parmi tant d'autres,2006,
184,WoM19921845,001,"[introduction] (2010-08-23: Nachtmix, Bayerischer Rundfunk, Munich, Germany)",01:00,Hellsongs,"2010-08-23: Nachtmix, Bayerischer Rundfunk, Munich, Germany",2010,
185,WoM14360248,010,"Salome, Op. 54: ""Sie ist ein Ungeheuer, deine Tochter"" Salome (Wiener Philharmoniker feat. conductor: Sir Georg Solti, soprano: Birgit Nilsson))",01:00,Richard Strauss,"Salome (Wiener Philharmoniker feat. conductor: Sir Georg Solti, soprano: Birgit Nilsson)",,
186,WoM18345544,017,Shadow Web Caverns (World of Warcraft: Wrath of the Lich King),03:25,Derek Duke,World opf Warcraft: Wrath of the Lich King,2008,
187,WoM24083044,024,Mu sõber tuul (Uus LaineA),04:34,Laine,Uus Laine,2000,
188,WoM28760441,o04,No One (Diaries),04:00,MMOTHS,Diaries,,
189,WoM9309944,005,I Always Get Lucky With You (By Request),03:19,George Jones,By RequesQt,1987,
190,WoM1730990,003,Forever (Ross Porter's After Hours With Verve),08:55,Mark Whitfield,Ross Porter's After Hours With Verve,1997,
191,WoM7476718,008,Paradize - Version (KM-Musik: Sounds of Delight),04:54,Dreadful Shadows,null,,
192,WoM32988944,004,Wohin mit Feuerstuhl? (Ritter Rost Hörspiel 8: Feuerstuhl),02:35,Jörg Hilbert & Felix Janosa,Ritter Rost Hörspiel 8: Feuerstuhl,2009,
193,WoM30562145,140,Coloring Outside the Hearts (Song a Day: Year Three),02:17,Jonathan Mann,Song a Day: Year Three,2012,
194,WoM9854839,004,Just a Little in Love (Run to Me),03:27,Lee Towers & Anita Meyer,Run to Me,,
195,WoM9888,006,Blunted Vision (State of Play 2),05:49,Mark Finnie,State of Play 2,1998,
196,WoM18514426,047,Power Player (Reality TV),00:10,Christopher E. Hajian,Reality TV,,
197,WoM12390710,013,Adieu monsieur le professeur (Bes Of),04:11,Hugues Aufray,Best Of,1994,
198,WoM1626634,001,"敏感な風景 ~Short size~ (TV Animation ""sola"" Original Sound Track: ソウキュウノハテ)",01:06,Ceuii,"TV Animation ""sola"" Original Sound Track: ソウキュウノハテ",2007,
199,WoM23697626,003,"Heartbreaker (""An American Band"")",07:36,Grand Funk Railroad,"""An American Band""",,
200,WoM2707855,9,Natasha (Hot Club de France),03:44,Gipsy Boys,Hot Club de France,2005,
201,WoM831368,008,Wicked Ways (Pro Pain),04:38,Mars ILL,Pro  Pain,,
202,WoM6375123,013,Appel à tous les fidèles (Le ragga ça l'fait),03:59,Saï Saï,Le ragga ça l'fait,1995,
203,WoM1954942,009,Brytningen (Stockholm Norra),02:45,Stockholm Norra,Stockholm Noorra,1978,
204,WoM850787,007,Quando a gente ama (Roberto Carlos),04:08,Roberto Carlos,Roberto Carlos,1994,
205,WoM1934188,5,Μουσική για την Εμινέ (Καπετάν Μιχάλης),01:49,Μάνος Χατζιδάκις,Καπετάν Μιχάλης,2008,
206,WoM1342462,005,"În stânga țin icoana, cu dreapta îmi fac cruce (Colinde pentru suflete românești)",02:28,Polina Manoilă,Colinde pentru suflete românești,2004,
207,WoM21489617,010,Over the Top (Karl för sin hatt),02:21,Boztic,Karl för sin hatt,1994,
208,WoM12499424,008,Out for Blood (Jack Knife Rendezvous),02:54,Dustsucker,Jack Knife Rendezvous,2006,
209,null,009,"The Italian Wedge (The Surfers That Came From The Cold, Volume 1)",02:03,Sonic Surf City,"The Surfers That Came From The Cold, Volume 1",2000,
210,WoM5994225,n.a.,Ne mogu ti ništa osim srca dati (Everblue 1),04:26,PHlavi orkestar,Everbleu 1,1996,
211,WoM2764660,007,"Full of Holes (2012-01-21: Variety Playhouse, Athens, GA, USA)",00:00,Grapees,"2012-01-21: Variety Playhouse, Athens, GA, USA",,
212,WoM31437519,004,Rock No More (Rockin' Dance Floor Hits),02:51,Hi-Voltage,Rockin' Dance Floor Hits,2009,
213,WoM3046443,005,Le aquile (Gioielli rubati),02:55,Alice,Gioielli rubati,1985,
214,WoM10506918,004,About You (Simple Things),03:29,Invocal,Simple Things,2002,
215,WoM23295738,010,"Ecossaise No. 1 in D major, Op. 72 No. 3a (Complete Edition, Volume 2: Ballades / Etudes)",00:57,Frédéric Chopin,"Complete Editionn, Volume 2: Ballades / Etudes",1999,
216,WoM10431822,007,Armer Sünder (Das Ende vom Lied),03:47,Eichenschild,Das Ende vom Lied,2005,
217,WoM24578420,014,"Can’t Stop Me Now (Tiësto remix) (Club Life, Volume Two: Miami)",04:39,Afrojack & Shermanology,"Club Life, Volume Two: Miami",2012,
218,WoM4578432,005,No Strings (I'm Fancy Free) (Fred Astaire & Ginger Rogers at RKO),06:09,Fred Astaire & Ginger Rogers,Fred Astaire & Ginger Rogers at RKO,1998,
