tid,id,number,title,length,artist,album,year,language
902,WoM1426534,016,Chicago Flyer (The Ultimate Jazz Archive),03:59,Meade Lux Lewis,The Ultimate Jazz Archive,2005,
903,WoM4030847,23,Yours (Tenth Anniversary Collection),02:58,Bing Crosby,Tenth Anniversary Collection,1987,
904,WoM1635493,008,Apply Directly to the Forehead (Wal*Mart-Approved Music),01:41,Hathaway Family Plot,Wal*Mart-Approved Music,2009,
905,WoM15503712,015,One Last Time (Razorblade Romance),05:08,HIM,Razorblade Romance,2000,
906,WoM2711633,009,Somewhere in the Woods (Kukeri),07:57,Svarrogh,Kukeri,2006,
907,WoM21159516,003,Belalım (Yıkılmadım),04:23,Mahsun Kırmızıgül,Yıkılmadım,,
908,WoM9828121,010,Made Love (Platinum & Gold Collection),O3:35,Alabama,Platinum_&_Gold_Collection,,
909,WoM3069611,024,The Vibes (Ill Communication),03:06,Beastie Boys,Ill Communication,1994,
910,WoM1103297,006,Monk's Bread (Latin Soul),03:31,Latin Jazz Quintet,Latin Soul,unknown,
911,WoM19371647,009,"So Long, It's Been Good to Know Yuh (This Land Is Your Land)",02:33,Woody & Arlo Guthrie,This LLand Is Your Land,2002,
912,WoM2940162,014,Cold (Revenge mix) (Remixes),04:10,Shakespears Sister,Remixes,2012,
913,WoM15098137,001,"Re-Rewind (Wild Gold, Volume 3)",04:00,Artful Dodger,"Wild Gold, Volume 3",2004,
914,WoM10375947,015,Where Were You When I Needed You (Det bedste af dansk musik 1963-70),03:06,Hitmakers,Det bedste af dansk musik 1963-70,1998,
915,WoM29515012,001,Call the Coroner (Everyone's Entitled to My Opinion),02:20,St Pierre Snake Invasion,Everyone's Enittled to My Opinion,2013,
916,WoM2623380,005,Of Glorious Remains pt. I - The Poisoned (Tears and Ashes),05:34,Worth Dying For,Tears and Ashes,2011,
917,WoM27980231,002,"Konzert für Gitarre, Streicher und Continuo C-Dur, RV425: Allegro (Hightech Konzert)",02:43,Antonio Vivaldi,Hightech Konzert,1989,
918,WoM24651041,001,Where Do I Go From Here (The Bird and the Bee Sides / The Nashville Tennis EP),02:15,Relient K,The Bird and the Bee Sides / The Nashville Tennis EP,1998,
919,WoM12666624,007,Shake a Tail Feather (Rev Up!! The Best of Mitch Ryder & The Detroit Wheels),02:31,Mitch Ryder & The Detroit Wheels,Rev Up!! The Best of Mitch Ryder & The Detroit Wheels,2007,
920,WoM2501433,18,"La Traviata: Di Madride noi siam mattadori (Masters of Classical Music, Volume 10)",03:19,Giuseppe Verdi,"Masters of Classical Music, Volume 10",,
921,WoM31438648,003,Calling of Setnacht: Twofold Triunity (Thaumiel),06:32,Ofermod,Thaumiel,2012,
922,WoM7717245,6,"Mechanical Advantage (Unique, Just Like Everyone Else)",04:19,Deepspace 5,"Unique, Just Like Everyone Else",2005,
923,WoM30939448,006,Fading Away (We All Fall Down),03:54,Prozak,We All Fall Down,2013,
924,WoM21165241,002,Crusin' (Rock 'n' Roll Party: Honoring Les Paul),02:13,Jeff Beck feat. Darrel Higham,Rock 'n'R oll HonKoring Party: Les Paul,2011,
925,WoM7584526,002,Chile (Re-Loaded),04:04,Neil Biggin,R-eLoaded,1996,
926,WoM2322740,008,I Only Have Eyes for You (Magician & Gershwin & Kern),05:06,Erroll Garner,Magician & Gershwin & Kern,,
927,WoM30612249,009,Lokorowe lato (Bemibek / Bemibem),00:00,Bemibek,Bermibek / Bemibem,2004,
928,WoM13950044,003,Magoo (Daytrotte rSession),01:47,Blakes,Daytrotter Session,2008,
929,WoM1912012,005,Wonderful Dream (Holidays Are Coming) (radio version) (Bravo Hits 36),03:52,Melanie Thornton,Bravvo Hits 36,2004,
930,WoM11839241,005,This Love of Mine (Latin Shadows),03:25,Shirley Scott,Latin Shadows,1966,
931,WoM12084314,005,Cold Winter Night (Morning Glory),04:01,Lacksley Castell,Morning Glory,2006,
932,WoM13153047,34,La Guinée wodi (Authenticité  -The Syliphone Years),03:20,Orchestre de Kindia,Authenticité - The Syiphone Years,2007,
933,WoM32865613,004,His Friends Are More Than Fond of Robin (No Secrets),03:01,Carly Simon,No Secrets,,
934,WoM10201831,005,Send for You (The Army of Freshmen),03:22,Army of Freshmen,The Army of Freshmen,2003,
935,WoM14177536,009,United We Stand (True Seventies),02:49,Brotherhood of Man,True Seventies,2006,
936,WoM16734242,013,I'm Gonna Get There (Shout! Live (featuring the McCrary Sisters)),08:01,Mike Farris & the Roseland Rhythm Revuew,Shout! Live (featuring the McCrary Sisters),,
937,WoM14323436,001,Iucundare iugiter (Piae Cantiones - Early Finnish Vocal Music),01:43,Finnish Radio Chamber Choir,Piae Cantiones - Early Finnish Vocal Music,1998,
938,WoM6917327,022,Happy Trumpeter (Instrumental Favorites),02:40,Bert Kaempfert,Instrumental Favrites,1996,
939,WoM19699123,002,Honky Tonk Women (Unplugged (Unplugged in Fléda),04:35,Dan Gladiš and Bangladesh,Unplugged in Fléda,2003,
940,WoM3896546,001,Vostok,51:36,Craig Padilla,Vostok,2002,
941,WoM4049047,029,Lo nuestro termino (balada) (Historia Musical Romántica),02:00,Grupo Bryndis,Historia Musical Romántica,,
942,WoM28697020,003,"Symphony no. 6 in D minor, op. 104: III. Poco vivace  (Symphonies 4 & 6)",04:04,Jean Sibelius,Symphonies 4 & 6,1996,
943,WoM10663638,005,Reel: Reilly of the White Hill (Celtic Dances: Jigs & Reels From Ireland),01:51,Billy McComiskey & Andy O'Brien,Celtic Dances: Jigs & Reels From Ireland,1998,
944,WoM1668417,001,Même si tu revenais (Remix 90's),04:03,Claude François,Remix 90's,1990,
945,WoM21872914,003,Danny Boy (Somebody's Darling),05:31,CCarol Noonan,Somebody's Darling,2004,
946,WoM22681443,014,Andantino Lento (Guitar Quintets (Complete)),03:11,Luigi Boccherini,Guitar Quintets (Complete),2o06,
947,WoM6492632,004,Ten Million Teardrops (Honky Tonk Sonatas),03:15,Jason McCoy,Honky Tonk Sonatas,2001,
948,WoM10156721,001,Asturias (The Ultimate Guitar Collection),06:04,Isaac Albéniz,The Ultimate Guitar Collection,2005,
949,WoM32883923,009,Burn Baby Burn (Welcome to the New),03:51,MercyMe,Welcome to the New,2014,
950,WoM2529606,0A2,A Wing and a Prayer (Children),03:41,Mission,Children,1988,
951,WoM21643435,009,Shaped Images of Disincarnate Spirits,04:38,Loudblast,Disiincarnate,1991,
952,WoM2035230,008,Second Skin (Drum),03:16,Hugo Largo,Drum,1999,
953,WoM17444520,039,Beyond the Net (Secrets of the 20th Century),01:50,John Cameron,Secrets of the 20th Century,,
954,WoM3255410,008,Day of the  Dead (Thrones),03:14,Alaya,Thrones,2014,
955,WoM6987537,008,I Can't Wait Anymore (easy order mix) (groove remixes),05:29,露崎春女,groove remixes,1999,
956,WoM981306,003,Milonga ska (Mugre),03:53,Los Calzones,Mugre,1999,
957,WoM31696236,002,I Fall to Pieces (Golden Greats),02:45,Patsy Cline,Golden Greats,1991,
958,WoM2116198,005,"Cyclops (1995-11-05: Electric Factory, Philadelphia, PA, USA)",03:07,Marilyn Manson,"1995-11-05: Electric Factory, Philadelphia, PA, USA",,
959,WoM25922949,005,Theme to the Last Puma (Transatlantik Lounging),05:35,Ian Simmonds,Transatlantik Lounging,1999,
960,28019540,001,Erwt (Live) (Drs. P Compilé Complé),03:10,Amsterdams Philharmonisch Trio & Drs. P,Drs. P Compilé Complé,2013,
961,WoM1681021,003,Kentucky Lament (Tol & Tol),03:49,Tol & Tol,Tol & Tol,,
962,WoM27113926,00A,Trouble (Trouble / Madness),06:14,Robert Manos,Trouble / Madness,2011,
963,WoM17396343,001,O Holy Night (The Magic of Christmas),02:41,Milton Smith,The Magic of Christmas,1999,
964,WoM113747,,"Prelude And Fugue In A Minor, BWV 894: Prelude (The Complete Keyboard Works Of J.S. Bach On Concord Concerto, Volume 15: Fantasias, Preludes, Fugues and Fughettas (Joao Carlos Martins))",05:32,Johann Sebastian Bach,"The Complete Keyboard Works Of J.S. Bach On Concord Concerto, Volume 15: Fantasias, Preludes, Fugues and Fughettas (Joao Carlos Martins)",,
965,WoM16367334,012,Sands Of Time (Code of Ethics),06:16,Code of Ethics,Code of Ethics,1993,
966,WoM32489940,067,Summertime (101 Best of Jazz),04:57,Ella Fitzgerald and Her Savoy Eight,101 Best of Jazz,,
967,WoM6364540,016,The Pond at Woodburn Hill (The Waters and the Wild),02:25,l Petteway,The Waters and the Wild,,
968,WoM18728716,016,Why Walk When You Can Fly?,03:04,Angel City Chorale,Why Walk When You Can Fly?,1999,
969,WoM16017528,004,"The Visible Hand (Faster Now, Slower Later)",02:44,Tre Orsi,"Faster Now, Slower Later",2008,
970,WoM15909349,010,Time for Pepper (The Impossibility of Silence),01:38,Black Sun Productions,The Impossibility of Silence,2006,
971,WoM25372437,008,D01.08-25 (Dirk Pitt 7: Deep Six),04:21,Clive Cussler,Dirk Pitt 7: Deep Six,1984,
972,WoM2727361,003,I’m Dreaming (Brief.Pastiche remix),05:30,Sinine,I’ Dreaming,2012,
973,WoM5412343,005,Uplift (545: Five Songs for Five Bucks),null,Andrew Eigel,545: Five Songs for Five Bucks,,
974,WoM32218112,012,"Missa ""Assumpta est Maria"", H.11: Simphonie (Te Deum H.146 / Litanies de la Vierge / Missa 'Assumpta est Maria')",01:54,"Marc-Antoine Charpentier; Les Arts Florissants, William Christie",Te Deum H.146 / Litanies de la Vierge / Missa 'Assumpta est Maria',,
975,WoM683264,003,Deuda de Amor (Maldito Callo),03:02,El Gran Combo de Puerto Rico,Maldito Callo,1967,
976,WoM26174930,004,"Slow, Loud nd Bangin' (S.L.A.B.ed) (Slow, Loud and Bangin', Volume 4)",05:37,"Trae, Jay'Ton, Lil' B, Lil Boss, Billy Cook, Big Bee, Billy, Kepoe & Lil' T","Slow, Loud and Bangin', Volume 4",2004,
977,WoM6431522,7,How Sweet It Is (to Be Loved by You) (Gold: Greatest Hits),02:56,Marvin Gaye,Gold: Greatest Hits,Gold: Greatest Hits,
978,WoM1216798,007,Welcome.Home.R2 (Freaquenseize),07:32,Kosmik Kommando,Freaquenseize,1993,
979,WoM9165831,016,Käptn Coma (Mit Leib und Seele),03:30,Schandmal,Mit Leib und Seele,2006,
980,WoM14949746,013,What a Wonderful World (Remembering the '60s),02:20,Louis Armstrong,Remembering the '60s,1987,
981,WoM31865849,014,I Threw It All Away (The Oxford American - Southern Music CD #15 (feat. The Music of Tennessee)),00:00,Bob Dylan,The Oxford American - Southern Music CD #15 (feat. The Music of Tennessee),2013,
982,WoM166380,001,Mother Says I'm Pretty (feat. Silent Bob) (Electric Eclectic),00:00,City INSECT,Electric Eclectic,,
983,WoM26226044, 001,Πρόλογος (Φωνή βοώντος),00:00,Χρήστος Δάντης,Φωνή βοώντος,1996,
984,WoM2248173,013,Aloha-land (Kilima Herinneringen),00:00,De Kilima Hawaiians,Kilima Herinneringen,,
985,WoM5005636,4,Still a Fool (BBC Radio One Live in Concert),17:06,Groundhogs,BBC Radio One Live in Concert,,
986,WoM104328,015,(ʻUlalena),03:46,ʻUlalena,ʻUlalena,1999,
987,WoM11795124,015,"Тома (Хочешь, tно молчишь!..)",04:03,"Кабаре-дуэт ""Академия""","Хочешь, но молчишь!..",,
988,WoM20459210,01 0,Adriano in Siria - Aria: Tutti nemici e rei (Caldara in Vienna: Forgotten Castrato Arias),04:53,Antonio Caldara,Caldara in Vienna: Forgotten Castrato Arias,2010,
989,WoM17058319,006,Secret Spy (TV Time),01:03,John Hill DeFaria,TV Time,,
990,WoM163997,012,Dissonance (A Soldier's Story),02:44,Danny Breaks,A Soldier's Story,1000,
991,WoM20476745,019,Mooncats Roock (100% Electro),04:50,International Swingers,100% Electro,2010,
992,WoM5892824,008,I Must Have Done Something Bad (50 Years of Hits),03:19,George Jones,50 Years ofHits,2004,
993,WoM2861525,012,Nursehellamentary (Second Coming),02:48,Nursehella,Secon Coming,2012,
994,WoM24998729,001,American Saturday Night,04:34,Brad Paisley,American Saturday Night,2009,
995,WoM1757361,004,Shotput (Psycho-Acoustic),00:49,Elliott Sharp & Zeena Parkins,Psych-Acoustic,1994,
996,WoM2851471,009,Outro (Mass Sufferings of a Human Being),00:24,Sagrdo,Mass Sufferings of a Human Being,2012,
997,WoM32619911,001,Triumphant Storm (The Labyrinth Spell),07:11,Labyrinth Spell,The Labyrinth Spell,,
998,WoM28459218,004,Gloria (Electric Comic Book),06:04,Blues Magoos,Electric Comic Book,2011,
999,WoM3143821,013,C'est chouette d'être un monsieur (Best Of),02:43,Jean Gabin,Best Of,,
1000,WoM27137418,,A Chance Of Rain (Light The Horizon),04:14,Bedouin Soundclash,Light The Horizon,2010,
1001,WoM1719701,005,Soudain il est trop tard (Le lundi au soleil),03:15,Claude François,Le lundi au soleil,1998,
1002,WoM2445443,008,"Pedindo amor (Leandro & Leonardo, Volume 11)",04:22,Leandro & LeonarCdo,"Leandro & Leonardo, Volume 11",1997,
1003,WoM1498633,001,Intro (Spanks for the Memories),00:24,Asylum Street Spankers,Spanks for the Memories,1996,
1004,WoM161489,003,Ahead of the Pack (Restless and Wild),03:24,Accept,Restless and Wild,1982,
1005,WoM2862878,014,Time Ran Out (live) (We’re Taking Over),02:22,Deadline,We’re Takng Over,2008,
1006,WoM1340541,010,L Train (The Space Between),02:45,Chiara Civello,TThe_Space_Between,2007,
1007,WoM11222416,014,Partir (Never Cage),00:00,LAREINE,Never Cage,2004,
1008,WoM11080739,019,Warlord (The Best of the Shadows),02:17,Shadows,The Best of the Shadows,1992,
1009,WoM5902524,004,Clandestine From Humanity (Bloodgasm),03:50,Bloodgasm,B.,2003,
1010,WoM20371442,012,Άνοιξαν οι ουρανοί (Υπάρχει λόγος),03:51,Έλενα Παπαρίζου,Υπάρχει λόγος,2006,
1011,WoM15098913,007,vulnerable (ex sententia - a journey through thorough thoughts),02:44,destoephobia,ex sententia - a journey through thorough thoughts,2006,
1012,WoM903183,007,Be Nice to Me (Todd Rundgren),03:25,Todd Rundgren,Todd Rundgren,,
1013,WoM22553618,012,"Auf, schicke dich recht feierlich, Wq 249: Recitativ ""Wohin mein Auge blickt"" (Tenor) (Edition Bach Carl Philipp Emanuel)",01:03,Carl Philipp Emanuel Bach,Edition Bach Carl Philipp Emanuel,2004,
1014,WoM18442210,025,"Raspberries, Strawberries (The Guard Years)",02:03,Kingston Trio,The Guard Years,2002,
1015,WoM18768833,109,Infomotion (background) (Issue Box),01:33,Joseph Saba & Stewart Winter,Issue Box,,
1016,WoM17018834,003,"Destroy (Only DJ Noisekick Will Survive) (This Is Terror, Volume 5)",04:57,Noisekick,"This Is Terror, Volume 5",2005,
1017,WoM20958413,005,Glass Web (Chapel EP),00:00,mirdaor,Chapel EP,2010,
1018,WoM20970122,003,Dzieci (Prawda Naga cd. 2),03:23,Waldemar Kasta,Prawda Naga cd. 2,,
1019,WoM33622,009,Exalted Above Thrones (Vittra),06:16,Naglfar,Vittra,1995,
1020,WoM25358726,unk.,All I Want (Twist),03:46,Wild Strawberries,Twist,2000,
1021,WoM 4980227,008,The Black (4:17 am),null,Before the Dawwn,4:17 am,2004,
1022,WoM32213941,002,Act III: Comfort Me (Room V),06:49,Shadow Gaallery,Room V,2006,
1023,WoM2359530,022,Ein Lied für Bielefeld (Stenkelfeld: Alle Originale),03:24,Harald Wehmeier & Detlev Gröning,Stenkelfeld: Alle Originale,2010,
1024,WoM33054618,0C7,Aqua Dementia (Live at Brixton),03:51,Mastodon,Live at Brixton,2014,
1025,WoM30348025,006,Overflowing Ashtrays (Music Is Painting in the Air),01:13,Sensations' Fix,Music Is Painting in the Air,2012,
1026,WoM26179136,008,I’ll Be Damned (ANX),00:00,Dark Time Sunshine feat. Poeina Suddarth,ANX,,
1027,WoM2380249,010,"Lohengrin: Act III. ""Oh prodi guerrieri,"" (Lohengrin (Orchestra Sinfonica e Coro di Milano della RAI, feat. conductor: Ferdinand Leitner, singers: Dari, Kónya, Pobbe, Protti, Didier))",05:16,RichardWagner,"Lohengrin (Orchestra Sinfonica e Coro di Milano della RAI, feat. conductor: Ferdinand Leitner, singers: Dari, Kónya, Pobbe, Protti, Didier)",2009,
1028,WoM13078124,001,Rakkautta huhtikuussa (April love) (Kuolemattomat levytykset),02:36,Hannu Hovi,Kuolemattomat levytykset,2007,
1029,WoM13174814,004,Kollegium (Dishes !),00:00,Sweet 'n Candy,Dishes !,2004,
1030,WoM1003388,007,La Playa (Captain Zorx Stimmungsattacke),05:13,Captain Zorx Stimmungsattacke,Captain Zorx Stimmungsattacke,2006,
1031,WoM28239,001,"The Magick Bird of Chomo-Lung-Ma (Land of Baboon, Volume 2: The Return of the Illclectic)",06:40,Obsolete vs. Delete,"Land of Baboon, Volume 2: The Return of the Illclectic",1997,
1032,WoM21289710,001,Embargo! (club edit),06:48,Embargo!,Embargo!,1999,
1033,WoM2637287,010,Us (Let's Talk About Love),05:46,Céline Dion,Let's Talk About Love,1997,
1034,WoM22451314,001,Spider in the Snow (Live in Japan 2011),03:47,Dismemberment Plan,Live in Japan 2011,2011,
1035,WoM8357310,002,La nuit n'en finit plus (C'est ma chanson),02:59,PetulaClark,C'est ma chanson,1988,
1036,WoM29167627,001,Didascalico bis (...Senza er),00:49,Piotta,...Senza er,2013,
1037,WoM19442239,3,Greatest Story (The Greatest Story),04:28,Kim Taylor,The Greatest Story,2008,
1038,WoM2936434,004,Hoy (Serie Cristal: Greatest Hits),Serie Cristal: Greatest Hits,Tony Vega,Serie Cristal: Greatest Hits,1997,
1039,WoM670955,011,Build Your Love (With a Twist),04:32,Alison Limerick,With a Twist,1994,
1040,WoM9918,001,Astronomy Domine (The Piper at the Gates of Dawn),04:12,Pink Floyd,The Piper atthe Gates of Dawn,1987,
1041,WoM29466113,001,Preserved Roses (TRAILER MOVIE),01:55,T.M.Revolution×水樹奈々,Preserved Roses,2013,
1042,WoM25792614,030,"Jamaica Farewell (World's Best Kids Songs, Volume 2)",02:18,ABC For Kids,"World's Best Kids Songs, Volume 2",2008,
1043,WoM19837911,006,Patrick (The Stiff Years),null,Kirsty MacColl,The Stiff Years,2005,
1044,WoM10663514,002,"Peruvian Plains (Missing Links, Volume 3: Time and Tide)",01:06,Anthony Phillips & Joji Hirota,"Missing Links, Volume 3: Time and Tide",,
1045,WoM16717539,011,Powerslave (Memoirs of a Broken Man),07:01,Futures End,Memoirs of a Broken Man,2009,
1046,WoM18294344,001,Slow Descent (Torn from Black Space),06:54, Cu be K,unknown,2009,
1047,WoM15613211,009,Verdi / I vespri siciliani (Vive 2),04:28,Maria Callas,Vive 2,1996,
1048,WoM14052439,001,"Distinction ~ Acceptance (Relationships: Love, Intimacy & Freedom)",05:04,Landmark Education,"Relationships: Love, Intimacy & Freedom",,
1049,WoM26520547,010,27 Different Ways (Not So Rich and Famous),00:00,Kemo the Blaxican,Not So Rich and Famous,null,
1050,WoM6966131,009,La Cumbia Del Pepino (D. Jack - J. Gonzalez) (His Thinking Congas),06:11,,His Thinking Congas,1998,
1051,WoM24027246,016,"Spirit of Death (Two Steps From Hell, Volume One)",01:15,Nick Phoenix & Thomas J. Bergersen,"Two Steps From Hell, Volume One",2006,
1052,WoM7100121,O11,Valmis (Etsijät),03:57,Kauko Röyhkä,Etsijät,2002,
1053,WoM19645249,003,First Flight (Cloud OST),03:58,Vincent Diamannte,Cloud OST,2005,
1054,WoM11476915,003,"The Well-Tempered Clavier, Book II: Prelude & Fugue No. 15 in G major, BWV 884 (The Well-Tempered Clavier, Books I & II (feat. organ: Louis Thiry))",03:23,Johann Sebastian Bach,"The Well-Tempered Clavier, Books I & II (feat. organ: Louis Thiry)",1973,
1055,WoM12780024,012,Voy a apostar por tí (Histeria),03:35,Tino Casal,Histeria,,
1056,WoM28336031,006,ProgRo_5 (InsectS) (ZolloZkunstStoFF),00:00,ZolloZ,ZolloZkunstStoFF,2013,
1057,WoM3110029,007,"All This Is That (Carl and the Passions: ""So Tough"")",04:04,Beach Boys,"Carl and the Passions: ""So Tough""",1991,
1058,WoM14445938,001,Funeral March (original),05:59,Kosh,Funeral March,2006,
1059,WoM3155249,011,City Lights (Tribute to Tradition),02:43,Rick Treviño,Tribute to Tradition,1998,
1060,WoM2748571,019,Stupid Hoe (Pink Friday: Roman Reloaded: The Re-Up),03:16,Nicki Minaj,Pink Friday: Roman Reloaded: The Re-Up,2012,
1061,WoM10462538,006,Turning Point (As the Moon Draws Water),03:34,Inch-time,As the Moon Draws Water,2006,
1062,WoM1009106,016,"Better Man (1994-04-12: Orpheum Theater, Boston, MA, USA)",00:00,Pearl Jam,"1994-04-12: Orpheum Theater, Boston, MA, USA",,
1063,WoM7550714,O08,Der Freund von Lüül (Rock’n’Roll 13),01:17,17 Hippies,RoZck’n’Roll 13,2010,
1064,WoM1979819,008,Shyam Kalyan (Snakes and Ladders),06:28,Australian Bebop Ragas,Snakes and Ladders,,
1065,WoM23755422,005,"Symphony No. 40 in G minor, K. 550: I. Molto allegro (The Great Symphonies, Volume 1)",07:31,Wolfgang Amadeus Mozart,"The Great Smphonies, Volume 1",,
1066,WoM18788316,032,"Belle Vie (full mix) (Solo Strings, Small Ensemble)",02:35,Paul Mottram,null,2002,
1067,WoM6618712,005,Hernandos Hideaway (The Bachelor),02:20,Billy May's Rico Mambo Orchestra,The Bachelor,1999,
1068,WoM28832210,008,I See You (AriannAntinoir),03:27,"Arianna_Antinori,_Jean_Charles_Carbone,_Marco_Fasolo,_Ernesttico,_Marco_Pandolfi,_Luca_Moresco_&_Davide_Pezzin",AriannAntinori,2012,
1069,WoM14858431,009,Serenade (Haydn) (Light Classics for Listening & Relaxation),02:39,"London Promenade Orchestra, Eric Hammerstein",Light Classics for Listening & Relaxation,1995,
1070,WoM3119969,001,Travel (live) (amparo fugaz),03:22,Guts Pie Earshot,amparo fugaz,,
1071,WoM32670736,004,Feels Like the First Time (Another EP),00:00,WannaBees,Another EP,1993,
1072,WoM11871842,005,A Fair Affair (Je T'aime) (More Music 2),04:47,Misty Oldland,More Music 2,,
1073,WoM6907844,003,Dreamlet (White Earth),00:00,Room Noir,White Earth,,
1074,WoM2708308,001,Bonanza (Multiplicitty),null,Anthony Lomas,Multiplicitty,2012,
1075,WoM14656147,013,Dance of Solitude (Temporal),04:07,Shadrane,Tempral,2008,
1076,WoM11992730,020,So What the Fuss (Number 1's),05:05,Stevie Wonder,Number 1's,2007,
1077,WoM1726672,015,"Empty Pocket Blues (b) (Music Through the Ages, Part Two: 1900 to 1940)",00:10,Richard Myhill,"Music Through the Ages, Part Two: 1900 to 1940",,
1078,unk.,010,Anima Mundi (original) (Globetronica 2),00:00,Last Atlant,Globetronica 2,20 09,
1079,WoM13478128,00 7,Santa Virgen Maria (300),03:13,Eisenfunk,300,2009,
1080,WoM9551544,007,Ela mia nikita (20 Popular Melodies From Greece and Cyprus),03:41,Savvas Paphiti,20 Popular Melodies From Greece and Cyprus,1994,
1081,WoM2234004,005,My World Is Empty Without You (Peace & Harmony: The Trojan Anthology),02:44,Heptones,Peace & Harmony: The Trojan Anthology,2004,
1082,WoM14197334,008,Die Katze unter den Bäumen 08 (Das magische Messer (feat. narrator: Rufus Beck)),04:19,Philip sPullman,Das magische Messer (feat. narrator: Rufus Beck),2008,
1083,WoM15328517,001,[Vaka] (In a Frozen Sea: A Year with Sigur Rós),06:38,Sigur Rós,In a Frozen Sea: A Year with Sigur Rós,2007,
1084,WoM3196768,004,"O Mother Mary Teri Sharn Me Jo Aaye, Jeevan Safal Ho Jaye (Bheegi Palkein)",00:00,Sushree Sangeeta,Bheegi Palkein,1982,
1085,WoM27646323,013,"Humanoid (2010-06-10: A State of Trance #460: Sodo Showbox, Seattle, U.S.A.)",03:56,Jochen Miller,"2010-06-10: A State of Trance #460: Sodo Showbox, Seattle, U.S.A.",,
1086,WoM22614949,012,Ice Flowers (Silent Star),03:14,Bernward Koch,Silent Star,2011,
1087,WoM1132129,006,Casablanca (Classic Music Guropean B),04:39,maXdion,ClassicMusic Guropean B,,
1088,WoM12371643,002,Baby I'm Yours (Cass Elliot),02:29,Cass Elliot,Cass Elliot,1972,
1089,WoM1528483,010,I Miss You Baby (The Very Best of Taj Mahal),03:30,Taj Mahal,The Very BesSt of Taj Mahal,1998,
1090,WoM17270820,028,Plague (d) (Dark History ),00:08,Robert J. Foster,Dark History 1,,
1091,WoM352491 0,015,Little Miss Can't Be Wrong (The Rolling Stone Collection: 1986-1992),03:52,Spin Doctors,The Rolling Stone Collection: 1986-1992,1993,
1092,WoM17734,004,Nothing to Lose Lose,04:57,Dimitri From Paris,Sacrebleu,1998,
1093,WoM21249131,014,Chica Bomb (NRJ Summer Hits Only 2010),03:31,Dan Bălan,n.a.,2010,
1094,WoM26841228,002,雨帰り (いえろ～ぜぶら ふぃな～れBOX),03:56,いえろ～ぜぶら,いえろ～ぜぶら ふぃな～れBOX,2011,
1095,WoM26649824,001,"In the Golden Light (One Tail, One Head)",03:27,"One Tail, One Head","One Tail, One Head",2011,
1096,WoM2517313,004,Meluzyna (Akademia Pana Kleksa),02:41,Teatr Muzyczny ROMA,Akademia Pana Kleksa,2007,
1097,WoM23065045,,Outra Vida (Bar Lounge Classics: Winter Edition),07:17,Gammas,Bar Lounge Classics: Winter Edition,2996,
1098,WoM6294734,007,Halloween (Bozo),02:42,Lida Husik,Bozo,1991,
1099,WoM14746817,013,Cruel Little Number (Absolute Music 2),04:38,Jeff Healey Band,Absolute Music 2,1993,
1100,WoM2566807,027,"Can You Explain It (Windy City Doo Wop to Soul, Volume 2)",02:56,Devotionss,"Windy City Doo Wop to Soul, Volume 2",2005,
1101,WoM23979736,005,Kabátky děravý (ěTžko říct),04:14,Psí vojáci,Těžko říct,2003,
1102,WoM23330915,010,Κάθε πρωί (Της εξορίας...),00:00,Μίκης Θεοδωράκης & Βασίλης Παπακωνσταντίνου,Της εξορίας...,1976,
1103,WoM8228917,002,"Crazy in Love (BBC live version) (Cosmosonica: Tom Middleton Presents Crazy Covers, Volume 1)",03:07,Snow Patrol,"Cosmosonica: Tom Middleton Presents Crazy Covers, Volume 1",2005,
1104,WoM788147,001,Devil's Roof (Hunkpapa),03:39,Throwing Muses,Hunkpapa,1989,
1105,WoM3906131,005,Yo Quiero Bailar (Tra Tra),02:40,Ivy Queen,Tra Tra,,
1106,WoM31326514,0A1,[untitled] (Treibstoff),00:00,Carsten Fietz,Treibstof,1999,
1107,WoM21852513,001,Blurred and Muted (Deadstar AsSsembly),00:48,Deadstar Assembly,Deadstar Assembly,2006,
1108,WoM3679113,005,Cold Hearts (Strangely Beautiful),02:54,Club 8,Strangely Beautiful,2003,
1109,WoM18684840,006,Prefiero sufrir (Grabaciones originales: 1952-1954),02:43,Los AlegEres de Terán,Grabaciones originales: 1952-1954,2004,
1110,WoM9965738,013,Quero Te Ver Feliz (Ao Vivo),03:28,Os Travessos,Ao Vivo,2004,
1111,WoM28735628,006,Klaviersonate N°2 A-Dur op. 2: II. Largo Appassionato (Die Klaviersonaten),07:02,LudwigvanBeethoven,Klaviersonaten,,
1112,WoM24638942,016,Gimme Dat (remix) (RYEot powRR),04:23,Rye Rye,RYEot powRR,2011,
1113,WoM9113538,004,Flyt (Svarta fotspår),03:03,Elektrubadur,Svarta fotspår,2003,
1114,WoM139199,006,Wabash Cannonball (King of Skiffle),02:01,Lonnie Donegan,King of Skiffle,,
1115,WoM596947,007,Rock the Shack (Get Ready),04:12,New,Get Ready,2001,
1116,WoM212871,008,"A Groovy Kind of Love (Gold & Platinum, Volume 6)",03:30,Phil Collins,"Gold & Platinum, Volum e6",1989,
1117,WoM11587722,009,Your Own Fault (Gory Gory Halleluja!),01:55,S.M.E.S.,Gory Gory Halleluja!,2006,
1118,WoM2115486,014,Erottamattomat (Salainen paikka),00:00,Köpi Koski & Projekti,Salainen paikka,2007,
1119,WoM15361649,003,Hello My Little Fish (The First Artefacts),03:16,Me and My Droid,The First Artefacts,2006,
1120,WoM12170011,002,I'm Free (Pleasure),03:59,Soup Dragons,Pleasure,1992,
1121,WoM6871512,001,"Inside the Dream Syndicate, Volume I: Day of Naigara (1965)",null,"John Cale, Tony Conrad, Angus MacLise, La Monte Young and Marian Zazeela","Inside the Dream Syndicate, Volume I: Day of Niagara (1965)",2000,
1122,WoM7612439,010,"Tonight, Twice (There's a Song in There)",05:18,Mark Dufrresne,There's a Song in There,,
1123,WoM10047011,0A5,Rapist (Stark Raving Mad),01:05,Stark Raving Mad,Stark Raving Mad,1984,
