tid,id,number,title,length,artist,album,year,language
2910,WoM14880621,010,"Groovin' High (Complete Edition, Volume 7-8: 1946)",04:46,Dizzy Gillespie,"Complete Edition, Volume 7-8: 1946",1998,
2911,WoM32863338,012,SICK (DECADE),00:00,DEATHGAZE,DECADE,2013,
2912,WoM28560718,022,Meen Time (FabricLive 65: DJ Hazard),01:25,DJ Hazard,FabricLive 65: DJ Hazard,null,
2913,WoM505570,005,San Francisco Bay (Retro),02:57,Syd Dale,Retro,,
2914,WoM3775132,002,Telegrafo de Amor (El Bandolero),02:33,Rogelio Martinez,El Bandolero,,
2915,WoM28375728,011,10 Zomers Lang (Feesten in Stijl),03:25,,Feesten in Stijl,,
2916,WoM9062323,002,"Pay to Cum VIP (Amen, Punk)",02:45,Aaron Spectre,"Amen, Punk",200 5,
2917,WoM7385321,005,狂想世界 (永遠的第一天),04:57,王力宏,永遠的第天,2000,
2918,WoM21358629,060,[silence] (Milkyway),00:08,Lucie Vacarme,Milkyway,1992,
2919,WoM13025014,002,I Can't Get Started (Autumn in New York: Vernon Duke's Broadway),03:34,Klea Blackhurst,Autumn in New York: Vernon Duke's Broadway,2005,
2920,WoM6216730,004,親愛なるあなたへ...（Instrumental）,00:00,ロードオオブメジャー,親愛なるあなたへ...,2005,
2921,WoM3204355,010,The Beat Goes On (Room Service 2),03:24,Sonny & Cher,RomService2,2002,
2922,WoM383154,004,Red Chips (The Working Model (Reverse)),05:30,Boytronic,The Working Model (Reverse),2003,
2923,WoM23071849,006,One Prayer Away (Reprise) (By His Grace),01:10,Maurette Brown Clark,By His Gxrace,2002,
2924,WoM25000823,004,Story of My Life (Leaves From the Family Tree),04:06,Polly Paulusma,Leaves From the Family Tree,2012,
2925,WoM7043648,001,Fui un extraño (Alianza),04:02,Alianza,Alianza,1997,
2926,WoM23840522,010,Human Bones Soap (28 Minutes of Silence for All Innocent Victims… And Boneses),00:00,Negligent Collateral Collapse,28 Minutes of Silence for All Innocent Victims… And Boneses,2010,
2927,WoM8916723,003,Here I Am (Nevins Dirtyrock club mix) (re-edit),07:31,Sertab Erener,Here I Am,2003,
2928,WoM26262140,008,Vida (El Solitario: El Diario de un Borracho),04:02,Alfredo Gutierrez,El Solitario: El Diario de un Borracho,,
2929,WoM1559424,001,COLORS,04:03,宇多田ヒカル,COLORS,2003,
2930,WoM6284,007,Rangac (Traditional Gypsy Music From The Balkans),03:53,Zoltan and His Gypsy Ensemble,Traditional Gypsy Music From The Balkans,,
2931,WoM7933619,004,I Take a Lot of Pride in What I Am (Steve Austin's Stone Cold Country),02:49,Merle Haggard,Steve Austin's Stone Cold Country,1999,
2932,WoM16416133,003,In The House (Play The Game),02:31,Torpeedoh,Play The Game,,
2933,WoM25062238,0D1,Lounging Around (In the Light),06:00,Shazz,In the Light,2001,
2934,WoM3168946,1,Fuld Af Forundring (Sjælland),04:48,C.V. Jørgensen,Sjælland,1994,
2935,WoM28761338,006,"""Adios Amigo"" / Jailberak (Lonely Are the Brave)",02:22,Jerry Goldsmith,Lonely Are the Brave,1995,
2936,WoM16679445,011,サンデーモーニング (Tower of Music Lover),04:01,くるり,Tower of Music Lover,2008,
2937,WoM9502314,002,Tu n'as plus (Les Petits Matins),03:12,Charles Aznavour,Les Petits Matins,1960,
2938,WoM16093611,011,New Year’s Eve in a Haunted House (The Zeitgeist Beckons),02:21,Vagabonkd Opera,The Zei tgeist Beckons,2009,
2939,WoM9408614,011,Train Song Yeah  Yeah Yeah (...Gay!),02:48,Boris the Sprinkler,...Gay!,2000,
2940,WoM13885936,006,Run to You (10),04:34,Sharon Kips,10,2007,
2941,WoM19620327,010,El último café (Goyeneche con Baffa / Berlingeri),00:00,"Roberto Goyeneche, Ernesto Baffa & Osvaldo Berlingeri",Goyeneche con Baffa / Berlingeri,1968,
2942,WoM2825022,001,"La Mer: De l'aube a midi sur la mer (The Great Composers, Volume 42: La Mer / Nocturnes)",08:24,Claude Debussy,"The Great Composers, Volume 42: La Mer / Nocturnes",,
2943,WoM2809529,011,生死恨：夫妻们分别十载 (中国戏曲名家名段：罗惠兰唱腔专辑),03:32,罗惠兰,中国戏曲名家名段：罗惠兰唱腔专辑,2006,
2944,WoM2619182,0a7,Every Time (The Box Tops Greatest Hits),02:27,Box Tops,The Box Tops Greatest Hits,,
2945,WoM32624733,004,Lasijauholaivakeikka (Laulajan testamentti),04:38,Jukka Poika ja Mutakuoppa-orkesteri,Laulajan testamentti,2008,
2946,WoM1025364,22,Diamonds in the Mine (Greatest Hits),04:00,Leonard Cohen,Greatest Hits,1981,
2947,WoM24272043,002,Dealer (Between the Town & The City),03:30,Underwear Brothers,Between the Town & The City,2005,
2948,WoM12417319,002,Quintess (Grayscale),00:00,Another Electronic Musician,Grayscale,2000,
2949,WoM10639737,005,"Concerto pour piano et orchestre No. 5 en Fa mineur, BWV 1056: II. Largo (Concertos pour piano et orchestre No. 4, 5 et 7)",02:56,Johann Sebastian Bach,"Concertos pour piano et orchestre No. 4, 5 et 7",,
2950,WoM14376546,018,Chandelier Of Stars (The Platinum Collection),03:13,John Williamson,The Platinum Collection,2006,
2951,WoM9805223,017,Soldier Boy (The Heart of Rock 'n' Roll: Slow Dancing Classics),02:42,Shirelles,The Heart of Rock 'n' Roll: Slow Dancing Classics,,
2952,WoM17175834,029,Night Stalker (New Age Atmospheres 2),00:59,Steven John,New Age Atmospheres 2,,
2953,WoM18640842,038,White Bear (alternate) (Indie Dance),00:29,Boom & Peak,Indie Dance,,
2954,WoM23336126,012,Обернитесь (Пенсне),00:00,Григорий Лепс,Пенсне,2011,
2955,WoM15597035,015,Dancing in the Moonlight (100% Bittersweet Melodies),03:43,Toploader,100% Bittersweet Melodies,2008,
2956,WoM1855240,026,(Aqmerica's,00:22,Neil Hamburger,n.a.,1996,
2957,WoM10624533,002,En Noche Buena (Navidad Criolla),03:13,Sonora Ponceña,Navidad Criolla,2000,
2958,WoM24639633,005,Gangster Tripping (Go),05:19,Fatboy Slim,Go,1999,
2959,WoM22309819,010,Deep Purple (The Ultimate Jazz Archive),03:14,Artie Shaw,The Ultimate Jazz Archive,2005,
2960,WoM19127539,311,HomelyFeel(Promos7:ChatShow/Lifestyles),00:05,Robin Webb,Promos 7: Chat Show/Lifestyles,,
2961,WoM15627827,010,Go Crazy (Freak city),03:37,SStarch,Freak city,,
2962,WoM29020740,005,Give Me a Chance (Dap Dippin' With Sharon Jones and the Dap-Kings),03:10,Sharon Jones and the Dap-Kings,Dap Dippin' With Sharon Jones and the Dap-Kings,2002,
2963,WoM25513740,00B,Allure of the Earth (Cello version) (feat. Sebastian Simpson & Chris Doig),06:16,Woods of Ypres,Allure of the Earth,2009,
2964,WoM3113931,34,Concerto a Cinque in B-flat major: I. Allegro moderato (Barocke (Barocke,02:03,Tomaso Giovanni Albinoni,Barocke Kostbarkeiten,1990,
2965,WoM6343241,002,Rock 'n' Roll Man (Live in the Roar),03:10,Tygers of Pan Tang,Live in the Roar,,
2966,WoM19004342,25,O wärst Du mein! (remix by Das Ich) (... und wenn das Herz auch bricht!),04:41,Bacio Di Tosca,... und wenn das Herz auch bricht!,2008,
2967,WoM1031948,004,Dieses Mädchen (Eine kleine Frage (... an die Grossen dieser Welt)),00:00,MarceUl,Eine kleine Frage (... an die Grossen dieser Welt),2006,
2968,WoM21204910,183,SMOOTH-CHOCOLATE-(GIRL-GIRLS-GIRLS),00:31,Andy Whitmore & Nat Augustin,Girl Girls Girls,2010,
2969,WoM16376848,001,Quase Nada (The Latin Lounge Session),04:44,Mo' Horizons,The Latin Lounge Session,2006,
2970,WoM13618743,020,Guess Who (The Heart of Rock 'n' Roll: 1958-1959),02:52,Jesse Belvin,The Heart of Rock 'n' Roll: 1958-1959,1996,
2971,WoM1135245,003,"Symphony No. 3 in E-flat major, Op. 55 ""Sinfonia eroica"": III. Scherzo: Allegro vivace (The Symphonies)",05:47,Ludwig van Beethoven,The Symphonies,2000,
2972,WoM23516415,008,Bling (J. Acquaviva's Electro Funk dub) (Dirty Electro),06:22,John Acquaviva & Madox,Dirty Electro,2005,
2973,WoM31797123,022,I Met Fearless in Vegas (Part Three) (Fuck Me USA Anthology),06:41,Fuck Me USA,Fuck Me USA Anthology,2012,
2974,WoM153562,005,"Kantate, BWV 4 ""Christ lag in Todesbanden"": V. Coro Versus IV ""Es war ein wunderlicher Krieg"" (Edition Bachakademie, Volume 2: Cantatas BWV 4-6 (Bach-Collegium Stuttgart feat. conductor: Helmuth Rilling))",02:37,Johann Sebastian Bach,"Bachakademie, Volume 2: Cantatas BWV 4-6 (Bach-Collegium Stuttgart feat. conductor: Helmuth Rilling)",,
2975,WoM10619135,017,Sail on Sailor (Soft Rock Ballads),03:20,Beach Boys,Soft RockB allads,2006,
2976,WoM1113616,013,A COUPLE OF SONG AND DANCE MEN (GOLDEN GREATS),02:17,Fred Astaire,Golden Greats,2002,
2977,WoM15385816,009,Mir träumte (Bestheller 1967-2007),04:19,André Heller,Bestheller 1967-2007,,
2978,WoM10903321,002,Ponta De Areia (Ultimo Trem),05:58,Milton Nascimento,Ultimo Trem,,
2979,WoM31919523,009,Sonnet (The Renaissance Guitar),01:02,Enriquez De Valderrabano,The Renaissance Guitra,,
2980,WoM1880901,047,Echoes From the Deep (stinger)(Atmospheric Grooves),00:14,Devine-King,Atmospheric Grooves,2005,
2981,WoM9691740,,Biz O Yollardan Geçeli (Zaman),03:50,Bendeniz,Zaman,2001,
2982,WoM2914727,22,My Edge of the Razor (All of a Sudden),04:21,John Hiatt,All of a Sudden,1997,
2983,WoM17358440,073,The Light Side :30 (Classic Comedy),00:30,Dick Walter,Classic Comedy,,
2984,WoM1122606,011,I've Never Been to Me (Hits of the 80s: The Ultimate Collection),04:00,Chrlene,Hits of the 80s: The Ultimate Collection,2006,
2985,WoM3289581,006,The Roaming (Odz Manouk),04:54,Odz Manouk,Odz Manouk,,
2986,WoM13934324,017,"24 Préludes, Op. 28 No. 17 in A-flat major (Chopin)",03:27,Frédéric Chopin,Chopin,2001,
2987,WoM9640317,007,Take it from Me (Scene Two),04:09,Art of Fact,Scene Two,,
2988,WoM252717,007,Solar Girl (Status),04:31,Elk City,S.,2000,
2989,WoM651825,002,Brivido felino (Mina Celentano),03:44,Mina & Adriano Celentano,Mina Celentano,1998,
2990,WoM2734719,007,Concerto in G: I. Allegro ma non troppo (Italian Flute Concertos),05:11,Antonio Piacentino Romano,Italian Flute Concertos,1993,
2991,WoM17252720,003,"Embers, Then Ashes (Flexible Response)",10:27,Dusk of Hope,Flexible Response,2005,
2992,WoM3225555,012,"Préludes, op. 28: No. 11 in B (Great Pianists of the 20th Century, Volume 10: Jorge Bolet I)",00:41,Fryderyk Chopin,"Great Pianists of the 20th Century, Volume 10: Jorge Bolet I",1998,
2993,WoM27641419,001,"[unknown] (2009-08-15 Face/Off: Garage-A-Trois, 40 Watt Club, Athens, GA, USA)",00:00,Garbage-A-Trois,2009,,
2994,WoM7439935,004,Life Is the Song We Sing (Friendship),06:23,Lee Ritenour,Friendship,1992,
2995,WoM3201131,001,Let Us Burn (Hydra),05:31,Within Temptaation,Hydra,2014,
2996,WoM458616,009,Death by Whips (Disco Destroyer),03:31,Tankard,iDsco Destroyer,1989,
2997,WoM18059530,010,Two Questions for Each Answer (Sweet Kicking and Screaming),02:47,Married to Music,Sweet Kicking and Screaming,,
2998,WoM8247625,007,Passion (Passion radio mix) (Hi-Nrg Summer Edition),04:12,A-Man,,,
2999,WoM8778240,011,Do the Dog (Hot! Hot! Hot! Dance Songs),01:33,Sesame Street,Hot! Hot! Hot! Dance Songs,1997,
3000,WoM1493040,009,Milord (How Do You Keep The Music Playing),04:48,Nicole,How Do You Keep The Music Playing,1999,
3001,WoM18167944,3,特別な涙 (夢の渚　〜The Silent Service〜),04:38,笠原弘子,夢の渚　〜The Silent Service〜,,
3002,WoM15113736,002,Just Another Girl (Fire),03:37,Wild Orchdi,Fier,2001,
3003,WoM4792744,007,Funkin' for Jamaica (Nothin' but a Funk Thang),00:00,Tom Browne,Nothin' but a Funk Thang,2004,
3004,WoM2459617,003,"It's a Man's, Man's, Man's World (Gold)",08:54,James Brown,Gold,,
3005,WoM28248845,008,Geese,03:39,Rough Fields,Edge of the Firelight,2012,
3006,WoM24416213,013,Do Your Thing (Masterplan),02:27,Stefanie Heinzmann,Masterplan,2008,
3007,WoM335853,008,Oh Women (No Parlez),03:34,Paul Young,No Parlez,2094,
3008,WoM24067518,004,על הקצה (נשאר רק לרוץ),03:50,נקמת הטרקטור,נשאר רק לרוץ,2011,
3009,WoM13517240,001,EndlessC oming Into Life (Ashes),32:29,Black Boned Angel,Ashes,2006,
3010,WoM33113326,076,[silence] (Ultima II Massage),00:04,Tobacco,Ultima II Massage,2014,
3011,WoM13850910,002,Power in the Blood (Transfusion),08:26,Alabama 3,ransfusion,,
3012,Twins,001,可愛不可愛 (妍語版) (桐話妍語),03:13,WoM13041744,桐話妍語,2008,
3013,WoM12770015,009,Cheating Heats (We Start Fires),unknown,We Start Fires,We Start Fires,2007,
3014,WoM10313426,005,Empty Words (By Blood Undone),03:37,Dark Day Dungeon,By Blood Undone,,
3015,WoM15554426,029,Majestic Vampire (Vampire Knight Original Soundtrack),02:23,羽毛田丈史,Vampire Knight Original Soundtrack,2008,
3016,WoM871295,010,Моргалы~аналы (Zbornikъ),01:06,Uratsakidogi,Zbornikъ,2000,
3017,WoM29130211,012,Kiitävän hetken hurma (Tähtisarja: 30 suosikkia),03:00,Eini,Tähtisarja: 30 suosikkia,2005,
3018,WoM21343634,001,Crabbit Shona Set (Red Houuse - Heritage of the Scottish Fiddle),04:50,Chris Duncan & Catherine Strutt,Red House - Heritage of the Scottish Fiddle,2006,
3019,WoM1765907,003,Der Wandler (Other Places),08:21,Cosmic Couriers,Other Places,1996,
3020,WoM828831,009,Jera (...and the story goes...),05:06,Agnes MoLnica,...and the story goes...,2003,
3021,WoM2240723,009,"Sayonara,",03:39,Poledouris Basli,RoboCop 3,1993,
3022,WoM25200123,00B,No Deeper Than Dredge Boats in Flood Waters (Fuck Diablo),00:00,Cavity,Fuck Diablo,1997,
3023,WoM2031627,002,Say A-Ha (Tepr remix),00:00,Santigold,n.a.,2008,
3024,WoM1142401, 018,"She's a Light / Iowa (Little Darla Has a Treat for You, Volume 23)",04:33,Magic Arrows,"Little Darla Has a Treat for You, Volume 23",2005,
3025,WoM2198497,009,"Just Like Tom Thumb's Blues (live) (Blues Women Anthology, Volume 7)",07:42,Wendy Saddington,"Bleus  Anthlogy, Volume 7",1007,
3026,WoM1908855,32,Droplet (Silent Steppes),02:11,Stéphane Guillaume & Marc Buronfosse & Olivier Louvel & David Patrois & Antoine Banville,Silent Steppes,,
3027,WoM4041342,007,Sweets for My Sweet (20 UK No.1's from the 60's),02:32,Searhers,20 UK No.1's from the 60's,,
3028,WoM14724048,008,Erziehungsdramen (Hirn ist aus),0 6:29,Urban Priol,Hirn ist aus,2008,
3029,WoM590335,001,Enter the Arena (Mayday: Rave Olympia),03:10,Members of Mayday,Mayday: Rave Olympia,1994,
3030,WoM33106921,016,逝去的諾言 (今天的愛人是誰),00:00,陳慧嫻,今天的愛人是誰,1994,
3031,WoM2934522,009,"Quelconque 56 avec A4 (2 pianos plus) =3EM21= (Music from “EVANGELION 3.0"" YOU CAN (NOT) REDO)",03:23,鷺巣詩郎,"Music from “EVANGELION 3.0"" YOU CAN (NOT) REDO",2012,
3032,WoM14856819,006,Monster Man (Live From Russia),03:09,U.D.O.,Live From Russia,2001,
3033,WoM10544616,007,A Mountaintop for Me (Silver Dollar City: Southern Gospel Gold),03:44,Crabb Family,Southern,2001,
3034,WoM20644938,010,Abismo (Colisão),00:00,Skore,Colisão,,
3035,WoM16269238,003,Killem (interlude) (Gemischtwaren),01:40,Deftype,Gemischtwaren,2094,
3036,WoM2301932,006,Bobby Brown (Fetenhits: The Real Classics),02:50,Frank Zappa,Fetenhits: The Real Classics,1995,
3037,WoM1424329,008,Church of Sacrifice (The Bloody Path of God),03:31,Mystic Circle,The Bloody Path of God,2007,
3038,WoM3365239,018,"Sweet Pea (Ultra-Lounge: Wild, Cool & Swingin': The Artist Collection, Volume 3)",unknown,Mrs. Miller,"Ultra-Lounge: Wild, Cool & Swingin': The Artist Collection, Volume 3",1999,
3039,WoM2470681,026,"Take It Easy (Super Eurobeat, Volume 210 - Anniversary Hits 150 Tracks)",01:44,Derreck Simons,"Super Eurobeat, Volume 210 - Anniversary Hits 150 Tracks",2010,
3040,WoM10681543,002,"Hungry Heart #2 (Lost Masters VI: Travel in Fear (Unreleased River Masters, Volume II))",03:36,Bruce Springsteen,"Lost Masters VI: Travel in Fear (Unreleased River Masters, Volume II)",,
3041,WoM9834127,005,Rush (Jake Mathews),03:30,Jake Mathews,Jake Mathews,,
3042,WoM512623,017,I Started a Joke (King for a Day… Fool for a Lifetime),03:05,Faith No More,King for a Day… Fool for a Lifetime,,
3043,WoM32737027,001,ホーミーの音（ホーミー） (モンゴルのホーミー～ガンボルド、ヤヴガーン),00:00,[unknown],モンゴルのホーミー～ガンボルド、ヤヴガーン,2008,
3044,WoM3307512,001,"String Quartet in A Minor, Op. 51, No. 2 - Allegro non troppo (Music & the Arts: Volume 2, Number 1)",12:30,Johannes Brahms,"Music & the Arts: Volume 2, Number 1",,
3045,WoM12817939,009,Running Away (BuzzCuts),03:00,Hoobastank,BuzzCuts,2007,
3046,WoM8386412,001,Flithy McNasty (Doin' the Thing: Live at the Village Gate),11:25,Horace Silver Quintet,Doin' the Thing: Live Live the Village Gate,1988,
3047,WoM6378346,011,A mí sólo me gusta el rock (Los dioses han llegado),02:40,Gigatrón,Los dioses han llegado,1998,
3048,WoM14974129,011,"Ça devient chaud (Street français, Volume 2: French HipHop)",04:03,Alibi Montana & LIM,"Street français, Volume 2: French HipHop",2006,
3049,WoM27317037,011,Everyday (Nick McCarthy & Sugar Rongs Franz Ferdinand Nightmare remix) (Everyday (Remixes)),03:21,Killa Kela,Everyday (Remixes),2010,
3050,WoM3158838,0B4,n.a.,00:00,Harry James,I’ve Heard That Song Before,,
3051,WoM8606338,006,Doorsteps (Hi-Fi High Lights DownLow),03:47,Lodger,Hi-Fi High Lights Down Low,2005,
3052,WoM29379529,014,"Remember We (2009-10-24: DJ Spinbad Live in Japan: Club Asia, Tokyo, Japan)",00:21,Da Bush Babees,"2009-10-24: DJ Spinbad Live in Japan: Club Asia, Tokyo, Japan",2009,
3053,WoM28693726,005,Caballo Loco (Progreso),00:00,Inordem,Progreso,2006,
3054,WoM3308490,003,"Symphony №1 in C minor, op. 11: III. Menuetto & Trio, Allegro di Molto (The Complete Symphonies)",05:23,Felix Mendelssohn,The Complete Symphonies,2010,
3055,WoM2130035,007,Eurostar (On High),03:20,Soundpool,On Hihg,2006,
3056,WoM868541,006,Retox (Halfway Between the Gutter and the Stars (clean edit)),05:17,Fatboy Slim,Halfway Between the Gutter and the Stars (clean edit),2000,
3057,WoM18249941,010,Q-Nexionz (Revolution),02:49,Qult,Revolution,2008,
3058,WoM21400038,006,Sleeping Wewelsburg (Palace of Toxicology),05:44,Bashed Nursling,Palace of Toxicology,2011,n.a.
3059,WoM27736631,007,The Coldest Rap (Dr. Dre 2002),06:39,Ice‐T,Dr. Dre 2002,2000,
3060,WoM2237652,006,Desde que vivo con otro (¿Quién te crees tú?),00:00,aFlete,¿Quién te crees tú?,2008,
3061,WoM18666112,004,Satellites (Lander),03:27,Lide,Lander,2010,
3062,WoM370712,001,We 'a' Rockers,03:23,Inner Circle,Rockers,1995,
3063,WoM14573014,003,"Magic Melody (original club mix edit) (Octan, Volume 5)",03:56,Groove Solution,"Octan, Volume 5",1996,
3064,WoM4717242,009,Nothing Rihgt (rEVOLVEr),03:47,Haunted,rEVOLVEr,2006,
3065,WoM17941515,001,Festlåt 3 (Förlåt att skivsläppet gick åt helvete EP),05:22,Dom Viktiga Skorna,Förlåt att skivsläppet gick åt helvete EP,2007,
3066,WoM15086629,002,Love or Hype (Burnin' at 20 Below),04:38,Antoinette,Burnin' at 20 Belo,1990,
3067,WoM13350411,004,Traces of Paganea (Peace and Love),00:00,Furious,Peace and Love,,
3068,WoM20898349,002,Early Daze (Classic Rock & Pop),02:33,Christian Marsac,Classic Rock & Pop,2009,
3069,WoM10010829,001,"At My Window Sad and Lonely (2006-03-05: Memorial Hall, University of North Carolina, Chapel Hill, NC, USA)",04:13,Willco,"2006-03-05: Memorial Hall, University of North Carolina, Chapel Hill, NC, USA",,
3070,WoM3204027,013,Sowas von (Joplin) (Mini Disco Hits),03:56,Grünschnabel,Mini Disco Hits,2014,
3071,WoM6790743,005,Ta mig tillbaka (Simplistico),03:43,Magnus Johansson,Simplistico,1998,
3072,WoM31094931,011,Voit pois jo mennä... (Lauluja),02:10,Marita Antsola,Lauluj,2013,
3073,WoM23344814,007,Drinker of Worlds (ArbIrynth),09:15,Arbrynth,Arbrynth,2011,
3074,WoM14708217,002,Ball And Chain (LP Version) (The Solo Years (1970-81)),03:32,Tommy James,The Solo Years (1970-81),1991,
3075,WoM2111179,002,"Partita 1 in B-flat major, BWV 825: II. Allemande (6 Partitas (harpsichord: Scott Ross))",04:49,Johann Sebastian Bach,6 Paartitas (harpsichord: Scott Ross),1999,
3076,WoM1171607,003,Feel the Silence (Let Love In: Live and Intimate),00:00,Goo Goo Dolls,Let Love In: Live and Intimate,2007,
3077,WoM8864232,033,[unknownv] (The Singles Collection),00:04,GUT,The Singles Collection,2000,
3078,WoM19944549,001,Mädchen in Weiss (Umsonst Ohne Risiko),00:00,Gorilla Aktiv,Umsonst Ohne Risiko,2005,
3079,WoM13499745,009,Daughtera (Pancake Day),02:46,Victor DeLorenzo,Pancake Day,1996,
3080,WoM2537728,007,Streaming (Solitudes: Stream of Dreams),07:04,Dan Gibson,Solitude: Stream of Dreams,,
3081,WoM10620715,007,[untitled]_(Der_Tod_Ist_Ein_Treuer_Kamerad),04:02,Testament_de_la_Lumière,Der_Tod_Ist_Ein_Treuer_Kamerad,2003,
3082,WoM2228710,015,"SINGLE JACK HAMMER, AMBIENCE, CONSTRUCTION (6011 Construction 1)",00:37,Sound Ideas,6011 Construction 1,,
3083,WoM24972641,010,Presentimento (Marechiaro),03:55,Antonello Rondi,Marechiaro,,
3084,WoM31131424,010,Herders ik boodschap blij van stem (Kerstfeest met de Mastreechter Staar),02:06,Mastreechter Staar,Kerstfeest met de Mastreechter Staar,,
3085,WoM15127610,008,"Helicopters (Who Dat, Mon?)",04:48,Trio Rio,"Who Dat, Mon?",1990,
3086,WoM23205343,004,Cantar del regresu (Como tú yes),04:15,Nuberu,Como tú yes,,
3087,WoM12719436,003,Oblivion Beckons,03:54,Byzantine,Oblivion Beckons,2008,
3088,WoM23588724,001,"Twelve Variations on ""Ah, vous dirai-je, Maman"", K.265 (Arens and Schmidt)",null,Wolfgang Amadeus Mozart,Arens,,
3089,WoM10499415,010,Oveer & Over (Central Services),04:08,Central Services,Central Services,2006,
3090,WoM6334116,008,Walkin' on the Sun (Freestyle Session 3),03:25,Smash Mouth,Freestyle Session 3,,
3091,WoM7351745,003,Crazy Girls (Come On Home),03:28,Bethany Joy Lenz,Come On Home,,
3092,WoM10372013,017,Float Over Oregon (Everything Wants to Be Used for What It Was Made For),03:00,Single Frame,Everything Wants to Be Used for What It Was Made For,2006,
3093,WoM15689425,001,LALALA (feat. 若旦那 (湘南乃風)) (TOKYO STAR),07:20,加藤ミリヤ,TOKYO STAR,2008,
3094,WoM26012821,001,Is This Something (Summer Riot),08:08,Coat of Arms,Summer Riot,2011,
3095,WoM19935029,6,It's All Going To End (Siskiyou),01:51,Siskiyou,Siskiyou,2010,
3096,WoM4068946,010,"Journey of 1,000 Years (Psycho Circus)",04:52,KISS,Psycho Circus,,
3097,WoM15835517,004,Nobody Understands Me but My Guitar (Knockout),05:10,Bad News Blues Band,Knockout,,
3098,WoM5076113,043,Stop Violence! -B.L.T. Re Production- (beatmania 7th Mix Original Soundtrack),01:30,Togo Project,beatmania 7th Mix Original Soundtrack,2002,
3099,WoM4271441,008,She Was the Color of Love (Leavin' and Sayin' Gooodbye),00:00,Faron Young,Leavin' and Sayin' Gooodbye,1971,
3100,WoM11370716,010,A Lost Boy (The 13th Warrior),01:10,Jerry Goldsmith,The 13th Warrior,,
3101,WoM625210,004,Snow (A Winter Garden: Five Songs for the Season),05:04,Loreena McKennitt,A Winter Garden: Five Songs for the Season,2007,
3102,WoM2795202,001,"Cantata, BWV 60 ""O Ewigkeit, du Donnerwort II"": I. Aria (Tenore) e Choral (Alto) ""O Ewigkeit, du Donnerwort"" S. Bach: Complete Edition)",03:55, Johanqn Sebastian Bach,J. S. Bach: Complete Edition,2010,
3103,WoM3791039,007,"Girls, Girls, Girls (Decade of Decadence '81-'91)",04:28,Mötley,Decade of Decadence '81-'91,,
3104,WoM29380344,009,Liście (Shadow Places),06:06,Proof,Shadow Plces,,
3105,WoM19186137,017,"Stavin' Chain (Boogie Uproar, Texas Blues and R&B (1947-54))",02:33,Zuzu Bollin,"Boogie Uproar, Texas Blues and R&B (1947-54)",2006,
3106,WoM291021,008,Amazing Grace (Going for the One),02:36,Yes,Going for theG One,2003,
3107,WoM8602817,003,Hellfire Choir (Son of a Preacher Man) (From Filth Comes Grace),02:16,Papercut Homicide,From Filth Comes Grace,,
3108,WoM21919418,008,It's a Hup Ho QWorld (Vitamin Enhanced),06:43,Ozric Tentacles,Vitamin Enhanced,1993,
3109,WoM2464761,004,Mellow (Sleet),03:49,Kubbi,Sleet,,
3110,WoM23558230,008,Don't Be Cruel (Rock'n'Roll Jukebox),0203,Elvis Presley,Rock'n'Roll Jukebox,2008,
3111,WoM2053980,012,Misty Mountains 2 (Film Series: Epic and Heroic),01:04,Bryan E. Miller,Film Series: Epic and Heroic,,
3112,WoM22796439,005,"Outta Space like a G6 (Dirty Bit) (Mashup-Germany, Volume 5: Mash Mob)",04:40,Mashup-Germany,"Mashup-Germany, Volume 5: Mash Mob",2011,
3113,WoM18726210,008,Electric Shock (Hallucination Cramps),01:33,Schizo,Hallucination Cramps,2010,
3114,WoM8219934,040,Chem 2: No Volume (Audio Osmosis),01:00,Jordan & Jon,Audio Osmosis,,
3115,WoM2658730,004,Green Gravel (Tracks from the Vaults),03:24,Horslips,Tracks from the Vaults,1978,
3116,WoM3254780,002,Assassin (Royalty Free Music For Film & Documentary Vol. 6: Dark Matter),03:32,Simon Wilkinson,Royalty Free Music For Film & Documentary Vol. 6: Dark Matter,2011,
3117,WoM23496012,010,Harbor Rats (Fresh Kills Vol. 1),02:02,Night Birds,Fresh Kills Vol. 1,2011,
3118,WoM29425144,011,madhyalaya gat en tritâl (Ragâ Yaman / Misra Pahari / Ragâ Sampurn Malkauns),05:32,Shivu Taralagatti,Ragâ Yaman / Misra Pahari / Ragâ Sampurn Malkauns,,
3119,WoM26170035,013,L'orniere (Coll AGE),05:47,Collection d'Arnell~Andréa,Coll AGE,1998,
3120,WoM27326327,002,Deuce (Icon),03:05,KISS,Icon,2010,
3121,WoM1126443,014,Chicken Strut (Blues Story),02:43,Meters,Blues Story,2001,
3122,WoM13407823,017,"Suite in sol minore BWV 995 - Gigue (Bach, J.S.: Works for Lute, Volume 2)",02:34,Paul Beier,"Bach, J.S.: Works for Lute, Volume 2",2000,
3123,WoM14400442,022,Det var dans bort i vägen  (Gamla fina låtar 3),03:32,Sven-Ingvars,Gamla fina låtar 3,1991,
3124,WoM15401522,017,"Everything Thermals (Livoe [at the Echoplex - December 7th, 2007])",01:26,Thermals,"Live [at the Echoplex - December 7th, 2007]",2007,
3125,WoM25067939,0A4,Et (Les Garçons Bouchers),01:55,Garçons Bouchers,Les Garçons Bouchers,1987,
3126,WoM24975337,010,You Won't Get Any Blood From Me (May Day),01:54,Matt Pryor,May Day,,
3127,WoM27875636,014,Held Him First (Nu Jazz Anthology),05:09,Deyampert feat. Clover,Nu Jazz Anthology,2007,
3128,WoM29708632,010,Remedy (Numan remix),05:12,Crookers feat. Miike Snow,Remedy,2010,
3129,WoM29360938,009,"Decks'n'Mics (Juice, Volume 6)",03:31,Felix XL,"Juice, Volume 6",2001,
3130,WoM13580146,008,Impious War By A Dark Side (United by the Black Flag),05:35,Infernal Kingdom,United by the Black Flag,2008,
3131,WoM873240,012,Old Blackie Blues (Die Qualtinger-Songs),02:37,Helmut Qualtinger,Die Qualtinger-Songs,,
3132,WoM1244681,002,Femmerne: Bremsen og fluen / Helmisbruden / Femspring / Stettelil / Agnete og havmanden (Vildesten brag),04:16,NordenFra,Vildesten brag,2006,
3133,WoM6594846,005,Prelude V (Six Preludes),04:52,Ryan Teague,Six Preludes,2005,
