tid,title
32156,CERMIN KACA BULAT KECIL / KACA DANDAN RIAS MOTIF KARTUN LUCU / CERMIN MINI
32157,SALE !! ASLI YA MUKENA AZZURA BORDIR 3D TIMBUL / MUKENA MURAH / MUKENA LIMITED
32158,Hanasui Intense Treatment Serum - Premium Serum
32159,ID. SELIMUT KINTAKUN DLUXE terbaru 160x200cm motif Ss Star
32160,Regency ZDLX Kipas Angin Besi Tornado (6 Inch)
32161,Bunny Hat Dance Lampu bisa menyala / Telinga bisa bergerak / Topi Anak Kawai / Rabbit Hat
32162,(PROMO)TRETINOMI HYDROQUINONE MAXI PEEL 3 Anti-Acne [HIJAU]
32163,JBS New York Makeup Brush Brush Egg Pad / Pembersih Kuas Makeup / Brush Cleaner
32164,jaman now Hijab anak LED bisa Nyala Rempel Kids LED jersay airis hijab kids / grosir jilbab anak
32165,PLASTIK STANDING POUCH 12X20/KEMASAN PLASTIK SNACK ZIPLOCK KLIP BERDIRI
32166,Masker kain murah berkualitas TALI SAMBUNG PUTUS/HIJAB DAN KARET GRATIS PLASTIK SATUAN
32167,"[FREE ONGKIR - COD] Charger VOOC 4A 2output for oppo , xiaomi , vivo , samsung, oneeka"
32168,Miyako mixer com SM 625 /hand stand mixer mangkok putar
32169,Penyangga Punggung Shoulder Back Support Belt Posture Corrector Korset
32170,The Face Shop Auto Drawing Pensil Alis Eyebrow Pencil
32171,MEIMEISHOP DOMPET PVC LIPAT DOMPET SOUVENIR PERNIKAHAN DOMPET TRANSPARANT TEMPAT SIMPAN MASKER
32172,MOUSE VOTRE USB
32173,Kaos Tshirt Cotton Combed 30s Distro Baju PUMA
32174,Keripik kaca 50gram
32175,Terjemah Fathul Izar
32176,Jogger from zunior (size S - 26)
32177,PROMO ADIDAS SLIP ON PRIA CASUAL ADIDAS PRIA ELEGAN TERLARIS ADIDAS PLAT
32178,"SMARTWATCH ANAK ANTI HILANG, Jam tangan hp , jam tangan anti air"
32179,Al Quran Al Mumayyaz BESAR A4 - Terjemahan & Tajwid per Kata - Warna
32180,Tissue NICE 180 sheets 2 ply
32181,MIE KOREA ARIRANG SPICY BIMBIM RAMYUN FRIED NOODLE
32182,Bandana Remaja Korea Terkini
32183,MS Black - MS GLOW BEAUTY
32184,(2KG) SHENAR RAK BUKU 3D 1X5 SUSUN ZAMAN NOW
32185,Guess Jam Tangan Pria - W1108G6 - Grey
32186,PROMO CUCI GUDANG CELANA PANJANG WANITA JUMBO
32187,[IMPORT] - Tetes Mata/ Obat Tetes Cairan Softles A + 10ML
32188,SANDAL TEPLEK TRANSPARAN
32189,Meja Sudut Coffee Table Kopi Nakas Pinggir Dekor Majalah Aksesoris Box
32190,SYITA TUNIC
32191,Kepala Shower Filter Aerator 4in1 Mineral Ion Pressure Hand Shower Head SPA Shower Hemat Air
32192,BULGOGI PAN BBQ Korea 32cm (ontv0132)
32193,Perangkap Tikus / Jebakan Tikus
32194,Uang Mahar Replika / Uang Kertas Mainan
32195,"b""QURAN APPLE / APPLE QUR'AN UNTUK BELAJAR ANAK"""
32196,Sandal Swallow
32197,Korset Penyangga Kehamilan / Stagen Hamil / Maternity Support Belt Sorex 4427
32198,COD !!! SEPATU PRIA VANS AUTHETIC MURAH
32199,Dira set
32200,SELSUN Yellow Double Impact 100ml / Shampoo
32201,STELAN MUSLIM ANAK AIDA KIDS
32202,GNC| OPPO A33 A53 A52 A92 A31 A91 A5 A9 A1K F11 Pro A5s A7 A12 F9 A3s A57 F7 F5 Youth Reno 4F 3 4 A39 A37 A37F A71 Reno4 Realme C2 VIVO Y17 Y15 Y12 Y95 Y93 Y91 Floral Case
32203,CELANA BAHAN WANITA PANJANG 96cm MODEL PENSIL XXXL NO.37-38-39
32204,Makanan Kucing Kaleng Life Cat Can Kitten Adult 400gr Tuna / Salmon Basah / Wet food Bukan Profelin
32205,Singlet Agree Balita Kaos Dalam Anak TK SD
32206,Kaos Kaki Ankle Low Cut Motif Garis Bahan Katun
32207,LAVOI Jam Tangan Jelly STRAWBERRY QQ 005 Jam Tangan Wanita Karakter Lucu Analog Import Batam
32208,Matrix obat bonding 500ml
32209,Glue Gun Warna Lem Tembak On-Off DGHL 20W
32210,Adem Sari Ching Ku Lemon Botol 350 ml
32211,Kacamata Safety Glass GOGGLE Sport Pelindung Mata/Anti virus/Anti Debu
32212,"( NEW ) PERLAK PREMIUM WATERPROF BOLAK - BALIK SNI KAYANA, ALAS OMPOL"
32213,Paket MURAH Alat olahraga Pelangsing tubuh Magnetic Trimmer Jogging Body Plate + Tummy Trimmer
32214,pt.yangguangtrading - blueray168 - 1set alat makan + kotak wadah J-01 model serat gandum
32215,ALAT TERAPI PIJAT KESEHATAN 3D MASSAGER / ALAT PIJAT DAN URUT TERAPI / ALAT PENGENCANG OTOT WAJAH
32216,ODOL NASA-PASTA GIGI NASA
32217,Dtree. piyama cp 3 in1 karakter.baju tidur piyama dewasa 3in1 doraemon.bear love.keroppi.mickey
32218,SENKA PERFECT WHITE CLAY 50GR + 120GR
32219,Moisturizer Clear Lip Gloss Transparent Liquid Lipstick Winter Protect Lips Plumper Makeup Lipgloss
32220,ATMOSFER Celana Jeans Sobek Pria
32221,Rock Zircon Powerful SUPER BASS - IEM / Earphone with Mic - Hitam
32222,[TERSEDIA!!!]Stang Riser Sepeda Gunung Bahan Logam Campuran Aluminium  720x31.8mm
32223,Corong Lipat Portable Air Minyak Flexible Colorful Silikon Silicone CRL
32224,Khimar Naura M
32225,Jean.edutoys Maze prewriting magic line | motorik halus | montessori | mainan paud tk | menulis
32226,"Ace Hardware Matras Yoga Berwyn. Grey, Pink, Blue & Tosca / Yoga Mat"
32227,hordeng pintu karakter
32228,Rx Fashion Rainbowy Tee Bahan Spandex Ukuran All Size Fit L 1R
32229,TAS KOSMETIK / POUCH MAKE UP BESAR
32230,SAMSUNG GALAXY A50s/A30s/A50 Soft ANTI CRACK Case Bumper Cover Silicon
32231,STEKER T ARDE UTICON + SAKLAR SC-382
32232,IKAT RAMBUT SPIRAL IMPORT / IKAT RAMBUT WANITA
32233,Madu Zestmag Madu Zetsmag Madu Zestmaag Madu Zestmagh Madu Zesmag Madu Zetmag Madu Asam Lambung
32234,TIK TOK NADA | TIKTOK | BAJU TIK TOK | KAOS TIK TOK TSHIRT TUMBLR TEE BERSHKA
32235,SELANG AIR AJAIB // MAGIC HOSE 30m/100ft
32236,(STOK READY) ALAT PERASAN LEMON/JERUK
32237,POT KRIM PP 3GR TUTUP SOLID
32238,Larutan Penyegar Cap Badak 200 ml
32239,"Be Calm, Be Strong, Be grateful - Wirda Mansur"
32240,Jaring Ikan Hexagonal 8 Hole Fishing Net Trap Cage
32241,"Cetakan Adonan Roti Bahan Silikon, Warna Acak"
32242,Paking + han
32243,[ORI] MASKER MATA  Bioaqua 80 LEMBAR GOLDEN OSMANTHUS Menyembuhkan Kantong Mata Eye Mask
32244,jam tangan pria seven friday kualitas premi 1 04
32245,"Bumbu Rujak Manis ""CAK MIMIN"""
32246,Deli Pulpen Ball Pen Capable Halus - Warna Hitam Biru [0.5 mm] EQ02420 EQ02430
32247,Dancow FortiGro Susu Bubuk Cokelat Usia Sekolah Box 800gr
32248,ZERNII WATER FILTER ALAT LENGKAP
32249,SEPATU ADIDAS QUESTERIDE FULL BLACK
32250,Molto Pelembut Dan Pewangi Pakaian Flower Shower 820Ml
32251,09891 Korset Pelangsing Peramping Perut Sehabis Melahirkan
32252,Hordeng / Gorden Blackout Polos Gorden Minimalis Super Blackout Blackout Premium
32253,AVOSKIN (PHTE) PERFECT HYDRATING TREATMENT ESSENCE 30 ML
32254,(100 LBR) SARUNG TANGAN PLASTIK MULTI FUNGSI SEKALI PAKAI / SARUNG TANGAN HIGIENIS ANTI CORONA
32255,Spons Cuci Piring Spon Polytex
32256,Bumbu gule instan bamboe
32257,Celery Stick Import READY STOCK BARU - seledri stik impor (per kg)
32258,3M Scotch Brite Sikat Lantai Scrub Pad ID-40
32259,"b""Jobel Boy's Underwear - Robot / Shark / Classic Edition CherrybabykidsShop"""
32260,THE KING BEDAH TUNTAS SOAL DAN MATERI TPS  (UTBK 2021)
32261,Makaroni Spiral 500 gram / Spiral / Uril
32262,Haverjoy Havermout Instant Australian Oats 1 Kg
32263,[MAMONDE] Creamy Tint Color Balm Intense 2.5g  (#1 ~ #33)
32264,Theraskin Day Cream AHA ( Suncare With AHA )
32265,Daster Manohara/Pilih motif/Dress Adem/Daster Hamil/
32266,Bagus Double Lock Zipper Bag 17 x 15 cm
32267,JILBAB KHIMAR AURORA NON PET / HIJAB KHIMAR AURORA / JILBAB KHIMAR INSTAN / KHIMAR SIMPEL NON PET
32268,Sabun Cream Ekonomi 900K
32269,Satuan Lunox Beauty Glowing 15x Lebih Ampuh Menglowingkan
32270,LCD Xiaomi REDMI 4X / 4 X Fullset Touchscreen
32271,Jaket Racing Hell Motor Balap Hoodie Sweater Racing hell line star Pria wanita Bahan Tebel nyaman
32272,COD Bintang Glow in the Dark - Bintang Terang - Bintang Hiasan - Bintang Dekorasi
32273,TaffSPORT TREK Botol Minum Olahraga Sepeda 750ml - 30A12
32274,Baju Handuk Motif  karakter
32275,Sarung Tangan Mandi Multifungsi
32276,TGB Tempat Bumbu 6 In 1 (1 set isi 6 botol bumbu & 1 holder botol)
32277,TEMPAT RAK BUMBU 6 IN 1 - SEASONING SET
32278,"BERAS BASMATI +  BUMBU NASI KEBULI , BRIYANI , MANDHI , BUKHORI, KABSAH MERK ALMADINA KHAS ARAB"
32279,Baju koko pria gus azmi syubbanul muslimin kombinasi hadroh azzahir hilwa baju koko sc adam
32280,Pensil Alis Implora Eyebrow Pencil Implora Pensil Implora Pensil Halis
32281,BRAKET TV 55 50 49 43 40 32 INCH WATER PASS FLEKSIBEL IMPORT
32282,OMGENDUT Jumping PIrate Game Pirates Roulette Family Game No.YF555
32283,KOREK KUPING SENTER LED NYALA EARPICK FLASH LIGHT LAMPU ANAK SOUVENIR
32284,Sedotan Stainless (1 Paket isi 4 Pcs + Pouch) Sikat Pembersih Sedotan Stainless stell
32285,Sisi Dress | Outfit Kondangan | Gamis Brukat Import Sisy
32286,FOCALLURE FOUNDATION CAIR FA30
32287,NEW Jilbab Voal Motif Art Premium Square Lasercut Kerudung Segi empat Motif Hijab Grosir Murah !
32288,Dodo Soother S 050 with Holder
32289,Morinaga Chil School Soya 300gr
32290,Dompet Kulit Pria Levis Ukuran Pendek 100% Kulit Asli(TAHAN BAKAR)
32291,"b""PIGEON COTTON SWAB 100'S SMALL TIP"""
32292,Sleek Baby Laundry Detergent 450ml /Sleek Sabun Pencuci Baju Refill
32293,Vitamer 350ML Portable Juicer/Blender 100% ORIGINAL
32294,BOLA VOLLY / VOLLY / VOLLY/ VOLI MIKASA MG Mv 210
32295,Damis 05 (daster misbee)
32296,CITRA TONE UP PEARLY WHITE BODY LOTION 180ML
32297,headset samsung original indonesia / handsfree samsung j1ace ori
32298,Morinaga Chil School Gold Strawberry 400gr
32299,MS GLOW NIGHT CREAM
32300,blackmond sudah terjual ribuan biji ladang lima
32301,PHILIPS HAIR DRYER HP 8108 / HP8108 ORIGINAL & GARANSI RESMI
32302,Vitalis Fragranced Deodorant 40ml
32303,JAM TANGAN G-SHOCK CASIO GWG 1000 JAM TANGAN TALI RUBBER  BEST SELLER BANGET HITAM  GOLD READY
32304,\xe2\x9d\xa4 Stok sedia ada \xe2\x9d\xa4 Children Girls Linen Small Square Flower Decoration Exquisite Hasp Chain Bag
32305,ISTANATOYS.COM CROCODILE DENTIST GAME / MAINAN GIGI BUAYA - GIGIT BUAYA
32306,AXE Pomade Clean Cut Look Water Based 75G
32307,Ringer Tee We Are The Bears / Ringer Tee Free Bears / Kaos Lengan Pendek Wanita Murah Motif Bears
32308,Ever E 250 (Botol isi 30)
32309,Sarung Tangan Plastik Tebukuro Bahan HDPE Tebal Food Grade
32310,24Pcs/Pak Kuku Palsu Matte Frosted Print Snoopy+Warna Polos
32311,320 Pouch bag / tas serbaguna untuk tempat HP dna uang
32312,PULPEN KIPAS KARAKTER CUTE ANIMAL GIRL CARTOON BUAH TOUCH ME - BALLPOINT BOLPEN PENA LUCU
32313,Sabun Cuci Piring Serbu Serbuu Serbuuu Kualitas Sunlight Mama Lemon
32314,24pcs Matte Ballerina False Nail Tips Press On Coffin Fake Fingernail
32315,TAS SEPEDA LIPAT   TAS SELI   TAS STANG SEPEDA LIPAT
32316,CERMIN LED MINI FAN kipas karakter / Kipas Mini Portabel Cermin led
32317,HEADSET BLUETOOTH SANGAT REKOMENDED BASS MANTUL
32318,LCD TOUCHSCREEN OPPO F1S A59 FULLSET LCD OPPO F1S
32319,Pipiltin Cocoa Chocolate Bar Aceh 73% 80gr
32320,PARFUM WANITA MURAH MISS DIOR BLOOMING BOUQUET 100ML
32321,timbangan duduk mangkok 5 kg digital
32322,Jokowi jumbo / serut JUMBO jokowi hijab instan
32323,EARPICK LED KARAKTER / PEMBERSIH TELINGA LED MOTIF OWL & FISH
32324,toys Peek A Boo Elephant Gajah Peek-A-Boo Gajah Gerak Telinga Boneka Gajah mainan anak bisa nyayi
32325,IZZI Fine Fragrance FF Mist 100 ML / IZZI PARFUM
32326,AVENT Natural Botol 125ml & 260ml | Bottle Susu 125 ml & 260 ml | Philips Baby Bayi BPA Free
32327,Topi bucket polos bolak balik 2 warna / topi bucket hat/bucket polos premium
32328,Primacat 30 ml Obat anti diare kucing
32329,[xijing-cod] 30Pcs / Set Stiker Tato Sementara Motif Geometri Warna Warni Gaya Korea Trendi
32330,Hot Shapers Slim Waist
32331,Mujigae Jajangmyeon / Jjajangmyun / Jjajangmen / Jjajang- Mie Saus Kedelai Hitam khas Korea
32332,Lensa Antiradiasi Supersin / CRMC 1.56
32333,Antena Radio Mobil Universal Model Sirip Hiu
32334,Kipas duduk miyako 6inch KAD06
32335,"Rak Sudut Siku Plastik, Rak Holder Kamar Mandi WC, Rak Dapur"
32336,[ORIGINAL] Kojie san dreamwhite anti aging facial toner with collagen 60 dan 100 ml
32337,3 in 1 Micro USB HUB Male to Female & Double USB 2.0 Host OTG Adapter Cable
32338,"Termurah, VAS POT BUNGA GUCI ROTAN ALAMI KLASIK (REAL PICT)"
32339,STELLA M17  PLATFORM sepatu wanita kets piramid
32340,kunci gembok piringan cakram ori honda ahm
32341,Zara pants
32342,SoftCase Carbon SAMSUNG A01
32343,CREAM KLT HIJAU
32344,Flydigi 2Pcs Sarung Tangan fingersleeve Profesional Anti Keringat untuk Layar Sentuh
32345,ISI Staples GUN TACKER JOYKO 13/8
32346,DETERGENT SLEEK BABY LAUNDRY KEMASAN BOTOL 1200ML
32347,( READY STOCK ) PASHMINA CERUTY  BABY DOLL HEAVY CHIFON Premium Import
32348,SOMEBYMI - [STARTER KIT] Snail Truecica Miracle Repair 4pcs Starter Kit #
32349,REALME 7 / Narzo 20 Pro / Oppo RENO 4F / RENO 4 / RENO 4 PRO / A53 / C11 C12 C15 CASE Slim Black
32350,Freeman CLEARING Sweet Tea + Lemon Peel Off Clay Mask
32351,Holder HP Jepit AC Mobil Holder AC Car Mount the Ventilation
32352,Sabun safron/ sabun saffron original/ sabun acne
32353,3Pcs / Set Jarum Ekstraktor Komedo / Jerawat
32354,Baygon Aerosol Flower Garden 200 ml
32355,Evangeline Zodiac 50ml Eau De Parfum
32356,Promo Dompet Wanita Lucu Elegan Bahan Taiga Ukuran 10x12 Warna Ungu Tosca Biru Hitam Fanta Murah
32357,POLIGRAB ANTI CORONA #notouch tool
32358,GROSIR HIJABKU CADAR NIQAB  MODEL PINGUIN BAHAN JERSEY ( NIQAB)
32359,Jam Tangan Fashion Tahan Air Wanita JULIUS JA-864
32360,Permen Asam (Tamarind Candy)
32361,Sepatu Sneakers Breathable Anti Slip Motif Kartun untuk Laki-Laki / Perempuan
32362,LIPTINT SASIMI LINE S-745
32363,Najibah couple set moscrepe premium / baju pasangan terhits
32364,Cetakan Lontong Alumunium 15 cm isi 12 pcs (lusinan)
32365,BIORE Pore Pack Black | Cherry Blossom | Batik (isi 4lbr Pembersih Komedo)
32366,Cluth pandan sulam kecil kombi gliter RANDOM/TIDAK PILIH WARNA
32367,READY STOCK JERSEY TIMNAS INDONESIA MILLS PLAYER ISSUE OFFICIAL HOME 2020 MILLS 100% ORIGINAL
32368,Sendok garpu korea 2 in 1 / salad noodle spoon / sendok garpu spaghetti / sendok buah dessert spoon
32369,Serum Ampoule Whitening Gold Serum Korean Pemutih 24K Goldzan OriginalL
32370,Prim-A Botol 330 ml x 24 (1 Case)
32371,KAOS BUSHIDO TIGER DRAGON / 15 / KAOS PRIA / KAOS DISTRO
32372,BELLE CARDY AGATHA NAOMI CARDY OUTER KARDIGAN LINE RAJUT TEBAL
32373,SOS Hand Sanitizer Antiseptic Botol Refill 1 Liter
32374,Serokan pasir sendok pasir kucing anjing hamster
32375,Riyadhus Shalihin dan Penjelasannya - Ummul Qura
32376,Potentate Sketchbook A5 Hard Cover
32377,Sandal jepit Eagle Zeus 38 - 43
32378,Alat Kesehatan Pen Akupuntur Tanpa Jarum Meridian Energy Pen Lengkap Dengan 2 Mata Tanpa Box
32379,{ UKIR NAMA atau FOTO } Boneka mickey atau minnie jumbo (T85cm)
32380,COD Pembersih Pori Pori Wajah Spons Scrubbing Cuci Muka Lucu Bentuk Ubur-ubur/Brush Alat pembersihan
32381,TONER BADAN SH COSMETICS TONER WHITENING  100ml
32382,Strip Easy Touch Gula Darah / Glucose
32383,READY STOCK - PARFUM THAILAND 35ML
32384,Mie Shirataki Kering/ Dry Shirataki [10pcs] 250GR - H119M
32385,Sasa Bumbu Ungkep Ayam Kuning
32386,Indonesia Dalam Rekayasa Kehidupan Komjen Pol. Drs. Dharma Pongrekun M
32387,Tenda anak 200 x 200cm
32388,GAMIS SYARI TERBARU/ MAIRA SYARI bun
32389,SOUVENIR PERNIKAHAN SUMPIT STENLIS KEMAS MIKA MOTIF
32390,(READY STOCK /BISA COD) SOMEBYMI YUJA NIACIN BRIGHTENING MOISTURE GEL CREAM 100ml / CREAM FLEK WAJAH
32391,Nissin Wallen Soes Blueberry 100 gr
32392,[1KG=80PCS] JOLIECOLLECTIONS PENUTUP MATA KARAKTER PANDA / PENUTUP MATA SLEEPING
32393,Sirup Trieste Premium Syrup 650 ml
32394,SEPATU REEBOK BATIK R3 LOGO BELAKANG 38-43
32395,TERMURAH!!! [ COD BAYAR DI TEMPAT ] WALLPAPER BORDER LIST NEW UKURAN 10cm*10m
32396,EXTRA DUS / BOX COKLAT TEBAL untuk tambahan packing agar lebih aman
32397,{Lav - K376} (N - Z) Kalung Huruf Stainless / Fashion Style / Set Perhiasan Wanita
32398,Gendongan Bayi Hipseat Depan Ransel Snobby
32399,"Bella Square ""Part 2"""
32400,Softlens KOKO BLACK 14.5MM
32401,Tango Long Wafer 130 gr
32402,SHANNEN LIPSTICK ORIGINAL - Shannen Creamy Lip paint shannen lip matte shannen lip cream
32403,Huwai Sarung Tangan Half Finger Sepeda Gym
32404,"b""TISSUE LIVI ECO FACIAL 600'S REFILL PACK"""
32405,DRESS MANOHARA  /DASTER BALI PANJANG
32406,Sendal / Sandal Daily Unisex GC WEBBING
32407,MULTI STAND HP TABLET UNIVERSAL DUDUKAN KURSI  HOLDER HANDPHONE
32408,NEOGEN Bio Peel Gauze Peeling [sachet]
32409,AUDY MAXY - Audi Maxi | Gamis Maxy Audy Moscrepe | Dress Muslim Termurah - JOPYNA
32410,\xe2\x98\x85UM02 USB Omni-directional Condenser Microphone Mic for Meeting Business Conference Computer Desktop
32411,Headset ROBOT RE701 - BLACK - handsfree headset
32412,391 [ B BUKA DEPAN ] Cover Mesin Cuci BAHAN PEVA 1 Tabung B
32413,Blood Lancet 28G isi 100
32414,Ready OTP Kartu Perdana Axis Tinggal Pakai alias Sudah Registrasi
32415,Realme 5i hp 4GB 64GB 3GB 32GB Qualcomm Snapdragon 665 AIE 12MP AI Quad Camera Garansi resmi
32416,"b""Tropicana Slim Santan 5's"""
32417,Cat air akrilik / Cat Acrylic 12 warna Faber Castell
32418,Ragi Instant Fermipan 4*11gram
32419,LCD OPPO A37 / NEO 9 FULLSET TOUCHSCREEN
32420,Adapter Charger Baterai Quick Charge Universal dengan 4 Slot Output untuk AA / AAA
32421,Kaos Kaki Bayi Bahan Katun Tebal dan Hangat Anti-Slip Gambar Kartun untuk Unisex
32422,Sapu Mini Set Dengan Serok Cikrak Ukuran Kecil
32423,Bolognaise Sauce ( 021052 ) 500 gr
32424,Kostum mermaid baju duyung new produk mermaid sisik
32425,Minuman Sachet Kopi PIKOPI KOPI 3 in 1 mix murah meriahmeriah
32426,Klinskin Original Ber BPOM Sabun Pemutih Badan Beli 2 GRATIS 1
32427,Omura Panna Cotta Coklat 87gr
32428,untuk Realme 7i C17 7 X7 Pro C15 C11 Narzo X3 SuperZoom 6 Pro 5i 5 XT X2 Pro Realme C2 Case Hybrid Armor Magnetik dengan Ring Stand Holder
32429,Fasoion Kacamata\xef\xbc\x9aBingkai Besar Anti Sinar Biru Radiasi Komputer Kacamata Membaca Eyeglasses
32430,"Kabel data vivan android Micro USB fast charging samsung , xiaomi, oppo, vivo, dan merk lainnya"
32431,Mr. Muscle Glass Liquid Blue Pouch 440 ml
32432,BERAS BMW SUPER PANDAN WANGI AAA LAMINATING ORIGINAL 100% READY 5KG/10KG
32433,Kabel Data ROBOT RDM100s 2 Ampere 1 Meter (Micro USB) ORIGINAL - Garansi Resmi 1 Tahun
32434,Calista Shiga Piring Set isi 6pcs
32435,YOU THE GOLD ONE Dream Skin Perfect BB Cushion High Coverage / Brightening Effect / Oil Control
32436,Songkok ATLAS Premium AC Tinggi 9
32437,Chino Pendek Premium Terlaris AQA17
32438,Baterai ABC Alkaline AAA / A3 isi 6 Baterai Kecil
32439,Processor Intel Core I5 9400F 4.3GHz Cache 9MB LGA 1151 9th Gen CoffeeLake I5-9400F
32440,EMPING MELINJO MENTAH ORIGINAL ASLI KHAS LIMPUNG TIPIS BERSIH HALUS RAPIH 1/2 KG
32441,Pelindung pengaman sudut siku meja kaca silikon oval transparan
32442,Bola Duri Magnet Besar / Bola Terapi Kesehatan
32443,Topi Jepang Masker Samping I Topi Mancing I Topi berkebun I Topi Tani I Anti Panas
32444,GLUTAX 2000gs recombined white cairan kuning exp 2023
32445,Mooi Kaos Anak Tshirt Pocket Tee Set
32446,[RYID] Sarung Tangan Microwave Insulated Bahan Polyester+Katun Multiwarna untuk Perlengkapan Dapur
32447,CAVIPLEK PER STRIP
32448,Kabel HDMI Extension Extender HDMI Perpanjang Male To Female 30cm
32449,BUPENA (BK. PENILAIAN) 4D/K13N / 0023713140
32450,Intex 3-D Bop Bags. Mainan Samsak Tinjuan Anak
32451,Masker Kain 2 Ply 3 Ply Katun Polos
32452,Obat Pembersih Jamur Kaca Mobil Penghilang Kerak Serbaguna Multi
32453,Dzikir pagi dan petang dan setelah sholat Fardhu
32454,Pulpen Stylus / Ballpoint Pen Medium
32455,TAS SELEMPANG & STRAP PUSH LOCK SHOULDER BAG Tas Selempang Behel/Tas Kantor
32456,Joyko Memo Stick MMS-1 | Post It Joyko MMS-1
32457,HIJAB DEENAY LEKHA BLACK
32458,Keju Mozarella Perfetto 250gr / Keju Leleh / Keju Lumer / Keju Pizza
32459,Softex Daun Sirih Wing Pembalut [36 cm/ 12 +1 Pads]
32460,Soft Case Desain We Bare Bears PopSocket untuk iPhone 11 Pro Max iPhone 6s 6 7 8 Plus X XS Max X iPhone 12 Pro Max
32461,[TU] Sticky Notes Planet Square - ST0449
32462,Baby Safe Training Cup Soft Spout 6m+ 125ml Botol Susu AP005
32463,[KHUSUS GOSEND PERBOX] Kertas PAPERONE A4 70 Gram Office Paper Print
32464,MIAO adapter micro usb to usb 3.1 type c - otg type c - konverter - android
32465,SEPATU MAK SNEAKERS REEBOK SOL BULAT
32466,[CH88] STAND HANGER BERDIRI - STAND HANGER MULTIFUNGSI - RAK GANTUNGAN BERDIRI - RAK BERDIRI
32467,[BPOM] MEDIHEAL  H.D.P Pore-Stamping Black Mask EX
32468,"b""L'Oreal Paris Fall Resist 3x Shampoo Hair Care - 450 ml (Perawatan Untuk Rambut Mudah Rontok)"""
32469,{Lav - K480 (N - Z) Kalung Huruf Love Kecil Stainless / Fashion Style / Set Perhiasan Wanita}
32470,Pop Socket Polos Warna Hitam Dan Putih PopSocket Pengganti Holder HP
32471,LONGTime379 BISA COD BELI KAOS PRIA ST.FUTURA KAOS CASUAL LENGAN PANJANG / PAKAIAN PRIA 3 WARNA
32472,KERTAS A4 100 GRAM PAPER ONE
32473,Tudung saji penahan panas ada rangka/tulang EXTRA LARGE
32474,Flo Swim Cuddle Me Flo Swim Cuddle Me Baju Renang Anak
32475,Topi Pantai Lebar Import Topi Fashion Anyaman Polos Pita Besar
32476,TAMACILLIN obat serbuk tabur luka terbuka Kucing
32477,Pesanan live shopee 2kg
32478,Proclipper Happy King HK-900 / Alat Cukur Rambut / Mesin Cukur
32479,Chocolate Monggo Tablet Dark 100% of Cocoa 80gr
32480,MAXIM TOOLS MTSHARP KNIFE SHARPENER RED Ter MUrah di Surabaya
32481,Parfum mobil Pengharum Pewangi mobil ruangan ACK SCENT 1 botol gantung ORIGINAL ACK
32482,Espresso Blend Best Seller > Cremaa Espresso 500 gr Kopi Otten Coffee ReadyStock!
32483,"b""You've (You have) BH Bra Pakaian Dalam Wanita Eritsa B1391"""
32484,DASTER PIYAMA KATUN JEPANG(TIDAK BISA PILIH MOTIF & WARNA)
32485,SYB Forte Red Jelly Glow Serum
32486,TINTED LIPBALM BY TROPICAL SENSATIANS
32487,Hw Tablet Effervescent Pembersih Pakaian Untuk Mesin Cuci
32488,Headset ROBOT RE101S headset earphone handsfree ROBOT ORIGINAL
32489,Kolago Obat Nyeri Sendi Dan Nutrisi Tulang 100% Original
32490,Madame Gie Total Cover BB Cushion - Make Up Foundation Dewy
32491,DOMPET PENDEK WANITA D09 FOREVER YOUNG #MURAH
32492,FA23 FOCALLURE Eyebrow Cream waterproof eyebrow gel
32493,Kispray Pouch Refill Segeris 300 ml
32494,Kitoderm Paket Double Glowing Cream Lightening Series - krim pencerah / pemutih flek sedang
32495,"ALKOHOL 70% 1 LITER. CAIRAN PEMBERSIH ANTISEPTIK ETHANOL 1L, ETHYL ALCOHOL 1 L"
32496,Celana Dalam Wanita Underwear Cewek Polos / Underwear Wanita Polos Variasi Renda / Pakaian Dalam
32497,"b""Sprei Kintakun D'luxe King Size Embosed Edition UK. 180X200"""
32498,DERMOVATE HIJAU CREAM ORIGINAL ARAB SAUDI ASLI 100% GLAXO
32499,1 - 5 TAHUN SETELAN ANAK / SETELAN ANAK PEREMPUAN / SETELAN ANAK LAKI LAKI / SETELAN ANAK COWOK
32500,"Knalpot Serigala/Gukguk truck canter,dina,isuzu giga,engkel,ragasa,elf dll"
32501,Rak Sepatu Portable 4 Susun / Rak Serbaguna Portable / Kotak Sepatu 4 Susun
32502,Masker Kain 3 PLY Katun Polos
32503,Gom 8ml - Obat Sariawan
32504,kamper kg  putih
32505,Bluetooth Receiver  usb jack audio
32506,Hook Serba Guna - kaitan serbaguna - gantungan baju - gantung handuk
32507,DASTER ARAB MODEL LOWO SUZZAN KAFTAN |SANTUNG TEBAL ORIGINAL|\xe2\x80\xa2\xe2\x80\xa2\xe2\x80\xa2
32508,Fantech MPR800 Firefly - Gaming Mousepad
32509,jam tangan imoo imo tahan air termurah charger magnet & box keras
32510,BPOM  Nacific  Daily Mood Lip Cream
32511,Nyonya Meneer Minyak Telon 60ml
32512,(1kg=7pc) NEW....MEIRA CARDY Outwear
32513,BBBC Wallpaper dinding Foam 3D Bata Batu Polos Motif Kayu 77x70cm WOOD FOAM KAYU FOAM MURAH
32514,Raw Almond ( Almond Mentah ) 1Kg
32515,Chil Mil Reguler 800gr
32516,Konicare Natural  Powder \xe2\x80\x93 125 gr
32517,Polyflex PVC Korea khusus Meteran
32518,Buble Wrap
32519,Botol Mancur
32520,FRINGE OUTER JUMPUT
32521,"b""Riyadhus Shalihin - Darul Haq - Tahqiq Takhrij Ta'liq"""
32522,Laneige Water Bank Hydro Essence 10 ml
32523,Cosrx Clear Fit Master Patch (18 pcs)
32524,(12VOLT) T10-24 LED JELI STROBO
32525,Golden Raisin Simin Manis Organik / Kismis Emas 250 Gram
32526,Ventela Public Low Dark Green - Sepatu Ventela Public Low Green - Sepatu Vantela
32527,Kain polymikro mikrotex
32528,FITRI DRESS
32529,Red Rose Petals / Kelopak Bunga Merah Mawar Artifisial / Hiasan tabur
32530,Sticker Kompor 2 Tungku MASTER CHEF
32531,Cetaphil Gentle Skin Cleanser 500ml
32532,MYLENA DRESS MAXY / HOMEY DRESS MAXY
32533,Keju Prochiz Gold Cheddar 170g
32534,KEMEJA STRIPES - DIJAMIN BAGUS KEMEJA SALUR PRIA LENGAN PENDEK KEMEJA STRIPE
32535,"DR PURE PAKET SET (day cream, night cream, sabun)"
32536,"Beras lele spesial 5kg,10kg dan 20kg"
32537,SUSU DANCOW 1 RASA MADU/VANILA 200GR
32538,COD Gamis Couple Sarimbit Suami Istri Murah Terbaru Pasangan Muslim Busana Hagia Shopia
32539,Coklat Planet Lagie 1kg
32540,KUKE Smart Hula Hoop / Hula Hoop Ring / Hula Hoop
32541,WPS043 BLACK WOOD URAT KAYU HITAM
32542,Theoni.lie Mainan Ikan Pancing Putar Isi 12pcs Magnet Ikan Fishing Game TL-177
32543,MASKER KOMEDO GELATIN
32544,DAUN MONSTERA pelengkap HIJANG/SEGIp
32545,BUKU TEMATIK KELAS 3 SD TEMA 8 EDISI 2018 PRAJA MUDA KARANA
32546,LAMEILA EYESHADOW 10 COLORS FASHION
32547,Aveeno Baby Daily Moisturizing Lotion 227gr
32548,lampu led ecolink 6watt 6 watt 6w 6 w / led ecolink / lampu led garansi SNI
32549,CD Seamless Tanpa Jahitan Anti Nyeplak Fashion Es Sutra Celana Dalam Wanita
32550,Kacang arab 500gr
32551,Abe Food Popcorn For Kids 80gr - Snack Anak
32552,PAKET LENSA PHOTOCROMIC Frame Kacamata Minus Kacamata Antiradiasi Kacamata Fashion Wanita
32553,FACIAL WASH NORMAL THERASKIN
32554,SEMPROTAN BOTOL TANAMAN 500ML  / SEMPROTAN BURUNG / SPRAYER BOTTLE / BOTOL SEMPROTAN SERBAGUNA
32555,CUSSONS BABY CREAM 50GR
32556,Green Laser Pointer 303 / Laser Jarak Jauh
32557,Gery Krekers Beras Asin isi 10 x 5.6G
32558,JILBAB MASKER
32559,Wardah Lightening Liquid Foundation 25 ml | Concealer Lightening 7 gr
32560,Oxy Deep Wash 100 gr
32561,Vitamin B1 liqunox 100 ML
32562,"b""Sprei King 180 Dirumah Aja Kids Edition Kintakun D'luxe Microtex 5in1 B2 20cm"""
