tid,title
4903,Pelindung Pintu Mobil Slim Door Guard Protector Universal 8 pcs HT-001
4904,Teflon 12cm Kecil Goreng Telur Maxim Valentino Frypan 12 cm Kuali Mini
4905,ELBINA SET //GAMIS + OUTHER
4906,Cat Milk / Susu Kucing GROWSSY 20 Gram
4907,I7s TWS Apple Airpods Android Nirkabel Bluetooth Headset Earphone Hitam Ready Stock
4908,PIYAMA 3IN1 EMBOS FIT XL . XXL / PANJAMAS 3 IN 1 CP
4909,Sedotan Stainless SILVER Set Isi 3 + Sikat + Pouch Cantik - Stainless Straw
4910,124 Geneva Jam Tangan Wanita Fashion watch Jam Tangan Cewek Jamtangan Jam tangan Murah Jam Cewe
4911,MUNAFIE 50GRAM -55 GRAM / MUNAFIE TIPIS IMPORT 50GR
4912,HANDUK MANDI POLOS MUTIA JUMBO TEBAL KUALITAS HOTEL UK. 70X140 CM MURAH [GROSIR / ECER] BESTSELLER
4913,Mak Urut
4914,SPREI KINTAKUN DLUXE 120x200x20 CM MOTIF MEIKO - SCARLET - TIANA - CASEY
4915,Rak Buku Serbaguna | Rak Portable
4916,Mikrotik Router Board RB750gr3 (HEX)
4917,SELANG PU 6MM (4 X 6MM) PNEUMATIC POLYURETHANE SPRAYER KABUT KANDANG JAMUR GRENHOUSE
4918,Sweety Comford Gold NB52 S50 M48 L44 perekat tape anak bayi new born baru lahir newborn new baby
4919,OXONE STAINLESS STEEL KITCHEN TOOL SPATULA SUTIL SET OX-963
4920,[ Promo Cuci Gudang ] Sally tunik | S M L XL | Atasan muslim best seller
4921,ROBOT IRONMAN DANCE HERO AVENGER BUMBLEBEE SPIDERMAN DANCING ROBOT MUSIK
4922,Hanasui serum rich nutrition / bright up / propolis  25ml
4923,Bendera
4924,Tempered Glass 9D Full Cover Untuk Samsung Galaxy A51 / Galaxy A71
4925,[LAKU BANGET] FOR IPHONE 6 7 8 X XS SE 11 Pro Max SLIM HYBRID FULL LENS COVER CAMERA PROTECTION CASE
4926,TASBIH KAYU 33 BUTIR / OLEH OLEH HAJI / SOUVENIR HAJI UMROH MURAH
4927,ID BOLA KARET BASKET 5016 - MAINAN BOLA BASKET
4928,Parfum Eau De Toilette Garuda Indonesia 60ml
4929,GOON Smile Baby Pants Wonderline Single Pack S1
4930,PREMIUM AMORA PANTS
4931,TERMURAH TALI SEPATU PIPIH
4932,Purbasari Ultra Smooth Brow liner
4933,[ GROSIR ] Geneva Strap Leather - Jam Tangan Pria dan Wanita ( Group ) - TPT
4934,Yazole 318 Jam Tangan Pria Original Business Quartz Watches watch
4935,ABC1055 SHABBY MAP wallsticker wall sticker stiker dinding
4936,ASI BOOSTER AMPUH- Lactamond 200 gram *Pro ASI Eksklusif
4937,Terry Palmer Handuk ALVERO BAMBOO uk 70 x135 cm
4938,paket hemat sukulen 30pcs
4939,pt.yangguangtrading - blueray168 - Gantungan H06 Kunci Bentuk Kipas Bintang Lucu untuk Sekolah
4940,MINI SPEEDY CHOPPER/ BLENDER TARIK MANUAL/PEMOTONG PENCACAH SERBAGUNA SAYUR BUAH DAN DAGING
4941,DAF11 SLIP SANDALS
4942,Easy Touch 3in1 GCU / Easy Touch 3 in 1 gula darah & asam urat & koleterol
4943,Shahih Bukhari Muslim
4944,Tas Paha Tas selempang tas touring motor Tas pinggang merk Ozone Tipe2
4945,Filter Udara Ninja 250 FI Saringan Udara N250FI Air Filter Ninja 250FI
4946,Case Anticrack Soft TPU Realme 3 & Realme 3 Pro
4947,Kurma Shoidi Premium 1 Kg
4948,Celana Jeans Pria Pensil Skinny Biru Muda 27 - 38
4949,Sendok Makan Hitam isi 25 Pcs / Sendok Plastik / Sendok Termurah / Sendok Transparan
4950,Pinset lurus aquascape
4951,Selang Air Cuci 15Meter Mobil Motor Expandable Panjang 50feet Magic Xhose 15 Meter X Hose 15M
4952,Miranda Keratin Smoothing Spray 50ml
4953,KONICARE MINYAK TELON PLUS 30ML
4954,Mainan Go Fishing Duckling Series - Pancing Duck Ikan Anak Edukatif
4955,QM LIGHTENING SOAP ORIGINAL BPOM-SABUN QM BPOM
4956,Mc Lewis Tomato Sauce Sachet - 25x9g
4957,Bra / BH Scalen 0286
4958,[1 SACHET] MAMABEAR MAMA BEAR Zoya Mix Kedelai Minuman Pelancar Asi Booster ZoyaMix Soya Mix Coklat
4959,Cuci Gudang Laurier Pantyliner Cleanfresh 20S Perfume
4960,[COD] Sepatu Wakai New Limited Edition
4961,Jack n Jill Toothpaste / Pasta Gigi Odol Anak Jack n Jill
4962,Juhi Cumi SEDAPKO
4963,Softlens Living Color Adore / Softlense LC
4964,Ecolink LED 8 Watt Lampu Bohlam Cool Day Light (Putih)
4965,MASKER WAJAH PREMIUM OAT BUBUK OHMYSKIN 65gr
4966,BPOM Ovomaltine 380gr / Ovomaltine crunchy 380gram / 380 /Ovomaltine 680gram /680grm
4967,"TRIPOD HANPHONE,BISA BUAT KAMERA,TRIPOD 3110/3120  (BISA COD)"
4968,Kaos Polos Cotton Combed Oneck 30s Size S
4969,CHARGER BRANDED VOOC FAST CHARGING SAMSUNG XIAOMI OPPO VIVO ASUS LENOVO 2.A 2Ampere 2USB Ori 99%
4970,NYONYOR NOODLES Level 1 (Kinda Hot)
4971,Promoo !!!! Sepatu slip on pria kickers casual slop formal kerja kantor kulit suede santai kuliah
4972,Rem v brake sepeda anak BMX MTB pacific setengah alloy
4973,RK FLATSHOES LARICHI
4974,Sandal Jepit GC kotak Bungkus
4975,[1KG 20PCS] \xe2\x9d\xa4 MiniMamy \xe2\x9d\xa4 TOPI KUPLUK BAYI / TOPI ANAK UNISEX LUCU
4976,Harga PROMO ( exp 01/2022 ) CAIRAN SOLUTION COMPLETE 360ML
4977,Studio Tropik Balance Priming Water 30ml
4978,Waterproof Phone Pouch Glow in the Dark Wadah Tempat HP Ponsel Anti Air Pouch / water proof
4979,Mitochiba Chopper Food CH100 Resmi
4980,LONG OVERALL VENDETA ROK PANJANG JEANS PREMIUM
4981,Gamepad Android X3 Bluetooth Wireless Controller Stik bluetooth android Stik Android
4982,Importir.Fashion Sepatu Sneakers Korea Wanita Fashion Import SYRA FREE KOTAK & KAOSKAKI - SHG065
4983,"""Wilo"" \xec\x9c\x84\xeb\xa1\x9c Sleepwear"
4984,"Faster Ballpoint /Pulpen C600 , 0.7mm isi 12 pcs - black, blue & red"
4985,Maspion Power Fan / Kipas Angin PW-1802 RC 18
4986,Exp 2021 Kurma date crown khalas 1kg/date crown khalas termurah/kurma oleh oleh haji
4987,Scarlett Whitening Facial Wash
4988,Sobaso Tepung Pengenyal Bakso 32 Grx10
4989,FRISIAN FLAG SUSU KENTAL MANIS COKLAT 560gr
4990,Kojie San Face Lightening Cream 30G
4991,Pot Tawon 15 cm Warna Putih / Coklat Merk Wanky (Nanas) Harga Grosir Murah Se INDONESIA
4992,ACNES POINT CLEAR
4993,Sandal Slip Jelly 0912 Balance Impor
4994,Kabel LAN/UTP 25 Meter Cat5E Siap Pakai Kabel LAN dengan Kepala Konek
4995,"b""Wenela Couple Syar'i SET GAMIS + KHIMAR KEMEJA MAYRA CP TERLARIS VH1"""
4996,Meja Kopi Bulat Meja Teras Kuat dan Kokoh Tahan Air DC011S BONUS Taplak BERAT HANYA 1 KILO
4997,HADA LABO GOKUJYUN STARTER PACK (isi 3 pcs)
4998,DINNY- Piyama SIZE 11 usia 9 s/d 10 tahun
4999,COD TERLARIS!!!BONEKA PANDA JUMBO 85cm
5000,Masker kain tali panjang masker katun tali pisah sambung hijab hidung mulut anti virus
5001,Casing Soft Case TPU Silikon Matte Transparan untuk iPhone x / 11 / 11pro / 11promax / X / xsmax / xsmax Cover
5002,Charger HP VIVO Fast Charging V11 V15 Y17 V3 V5 MAX V7 V9 Y53 Y55 Y55S Y65 Y69 Y71 Y83 Carger Casan
5003,Set Alat Makan Portable Bahan Jerami Praktis Ramah Lingkungan Wheat Straw Set Sendok Garpu Sumpit
5004,Madu Anak Ratu Lebah Junior DHA GOLD
5005,KERTAS HVS A4 75 gr PP lite support by gosend dan grab instan min order 1 dos(5riem)
5006,GOLDFOX MASKING TAPE 1CM / LAKBAN KERTAS UKURAN 1CM
5007,BARU!! Konektor Pengait Tali Masker Random
5008,Baju Muslim Koko Adam 1 - 5 Tahun MAXKENZO Zilvia Store Setelan Baju Muslim BerKualitas
5009,BAWAHAN WANITA ROK PLISKET MAXI PLEATED TERLARIS
5010,Kojic Soap Thailand Super Whitening Original Inport Thailand New Pack (Khusus Grosir) m
5011,Chil Kid platinum vanila / madu 800gr
5012,Lampu Lemari Otomatis (LED Automatic closet light)
5013,Panci Elektrik Mini18cm  - Multifunctional Electric Fry Pan - Panci+Kukus Listrik
5014,Kacamata Bulat Design Korea Pria Dan Wanita TIKTOK Boboho
5015,"Dompet wanita, Dompet kartu pendek, dompet kartu card Dompet pendek"
5016,SAFI AGE DEFY GOLD WATER ESSENCE 30ml
5017,KNOT HAT (Topi Bayi)
5018,Bracket amplop
5019,Ovomaltine 240gram / Ovomaltine Crunchy 240gr / Ovomaltine 240
5020,COLLAR BOMBER JACKET
5021,Menjaga Bayi Dari Gigitan Nyamuk - Bugs Away (Cessa Natural Essential Oil) by ayusw1996
5022,PRB - Parutan Bawang Alat Press Penghalus Bumbu Dapur Mini Serbaguna
5023,Alat Pemeras Jeruk Nipis Jeruk Lemon Perasan Jeruk Lemon Pemeras Lemon Bahan Stainless Steel Orange
5024,Alat Pengupas Buah Praktis - Peeler/Fruit Slicer Murah
5025,Clipper Alat mesin cukur 3in sonar 5802 rambut jenggot bulu hidung
5026,Lampu Bohlam LED PHILIPS 4 Watt Warm White KUNING 3000K E27 Garansi Resmi 4Watt 4 W 4W
5027,Celemek Apron Masak Karakter Waterproof Anti Air  Plastik Dapur
5028,250 Gram GULA HALUS / DONAT
5029,Cover Pelindung Pakaian Anti Debu Transparan Dustproof Organizer
5030,VACUUM KOMEDO ALAT PEMBERSIH KOMEDO DAN JERAWAT PEMBERSIH PORI PORI KOMEDO ELEKTRONIK-GOODFELLAS
5031,\xe2\x98\x85 Cayman \xe2\x98\x85 Cermin Kaca Bulat Kecil Dandan Rias Motif Kartun Lucu Murah Kaca Make Up Kosmetik HL005
5032,PARFUM SWITSAL / SWITSBABY CERRY BLOSSOM PINK 35ML + BOX ORIGINAL BONUS POUCH / MASKER
5033,FREE BUBLE ATAU DUS DISPENSER SABUN CAIR DOUBLE 2 TABUNG
5034,IMBOOST FORCE - 1 LEMBAR 10 KAPLET
5035,Shampo pantene anti lepek  exp 2022
5036,BANTING HARGA Meja Lipat Portable / Meja Kerja Meja Lipat Serbaguna Uk 120cm x 60cm Model Kaki Bulat
5037,(50 Lembar) Kertas Art Paper Carton Karton A4 210 Gsm Gram Putih 2 Sisi Glossy Tebal
5038,Jawara Saus Sambal Hot 120 ml
5039,Iphone X Xs MAX XR Back Change Iphone 11 11Pro 11ProMAX Carbon Fiber Protective Film Photo Frame Upgrade Iphone 11 Case
5040,Strap Nilon Pengganti untuk for Apple Watch 6 se 5 Band 44mm 40mm
5041,ORGANIC SHIITAKE MUSHROOM POWDER 25GR
5042,TERMURAH !! WALLPAPER STICKER DINDING GH  45cm x 10mtr SHABBY CHIC (BUNGA BUNGA)
5043,Kaos Distro Lengan Panjang Bandung
5044,Habbatussauda Extra Propolis Trigona 200 Kapsul UMS | Habatussauda
5045,Double Tape Nano Gel Bening Tahan Air Lebar 30mm Super Kuat Bisa Cuci
5046,Olay White Radiance Intensive Lotion - 30ml [P&G]
5047,CELANA PENDEK FUTSAL ADIDAS CELANA SAKU RUNNING OLAHRAGA
5048,ORI Cream RK Glow by ANJ / RK Glow Premium / RK Glow Acne / Kosmetik Viral / zamzam / beauty Lotion
5049,Anti-peep Magnetic double sided Tempered Glass case Protector Bumper for iPhone 8/7p/8p/X/XR/XS MXS
5050,Powerbank fan kipas portable ROBOT RT-BF07 BF07 2000 mAh
5051,BANDANA RAMBUT / HANDUK FACIAL / BANDO MANDI
5052,CR CMS005 Mainan Buku Gambar Bisa Dihapus 6 Halaman dan 4 Pensil Warna
5053,TRIPOD MINI SPIDER HOLDER U TRIPOD HP GO ACTION TRIPOD FLEXIBLE AUTOPUS PHONE STAND SPIDERMAN
5054,BPOM Benton Snail Bee High Content Essence 60ml
5055,Plastik Rea Kemasan Baju Tanpa Plong HD 35x50cm
5056,1KG BISA 7PCS | GEYSA PANTS / CELANA STRADI / CELANA SALUR SELEBGRAM
5057,Koko Syubbanul Muslimin Koko Azzahir Koko Baju
5058,PIGEON BABY LOTION 100ML
5059,"Wiper Frameless  New  Avanza Clear Advantage 21"" & 14"" -62188 62184"
5060,Case Autofocus Softcase Oppo F9 A5S A7 A12 Silikon case Lembut Hitam
5061,PARFUM MOBIL AROMA KOPI BALI
5062,Juz amma saku PN
5063,Jumpsuit Sweety uk Bayi 3-12 Bulan / Baju Anak Perempuan Overall Kensi Baby Cewek Adem Born Import
5064,Alat Pijat Kepala / Relaksasi Kepala / Head Massager (murah)
5065,Promina Rusk Kacang Hijau 130 g x 1 Pcs
5066,iPhone 6S - Smartphone Apple Bergaransi Termurah
5067,Kaos pria Oneck
5068,AONEZ 4Pcs Jerami gandum Wheat straw Alat Makan Sendok Garpu Sumpit /Set Travel Cutlery 4 colors
5069,Bubble wrap
5070,Dasar-dasar akuntansi jilid1
5071,Everwhite Hi Collagen Drink 20 Sachet
5072,Plain Maxy Bahan cerruty Busui Full furing
5073,Plossa
5074,Mentega Blueband   500gr
5075,Bra Model Off Shoulder & Slim dengan Tali Silang
5076,Case iPhone 11 Pro Max / 11 Pro / 11 Spigen Rugged Crystal Softcase Transparant Clear Casing
5077,SASIMI LIP TIN ALOE VERA 99% LIP GLOSS S721 - Sasimi aloevera lip gloss liptint aloevera
5078,Oreo Biskuit Krim Cokelat 28.5 gr [1 Box Isi 12 pak]
5079,PENGGEMUK BADAN ORIGINAL 100% UNTUK 30 HARI
5080,BEST SELLER! SAMBAL PETIS BOYYA KHAS SURABAYA 270 GRAM
5081,Tshirt mickey square ukuran all size over size
5082,PAVITA MAXY / VICTORIA MAXY / CLAUDIA MAXY JEANS PREMIUM /NIRMALA MAXY / AENI DRESS RC
5083,Huki Nipple Dot Silicone Reguler Toples / Dot Nipple Silikon Huki Reguler
5084,Kemeja dewasa XL muraah
5085,\xe3\x80\x90Bayar di Tempat\xe3\x80\x91 Kitchen Tool Gadget Convenient Egg Yolk Separator Divider Holder Sieve White FCT
5086,SUKRO POLONG 140gr
5087,ALKOHOL SWAB ALKOHOLSWAB BOX
5088,MUKENA ANAK KATUN KATUN UNICOREN PINK DAN BIRU  SIZE XS-XXL USIA 3-12 THN
5089,Cetakan Martabak Mini 7 Lubang
5090,Sandal jepit hello summer AA
5091,[Bayar Di Tempat]Casing Soft Case TPU Silikon Transparan untuk iPhone 6 / 6S / 8 / 7 Plus / X / X
5092,Naturein Sanitizing Water 100ml | pembersih antiseptik bayi alami serbaguna
5093,HIJAB DENAY KW CANTIK TERMURAH / ARMY BUNGA
5094,Butter Hollmann   500gr
5095,Friskies Party Mix - Snack Kucing
5096,Tricks Snack Baked Crips Kentang - Rasa BBQ- 1 Box 10 Pcs
5097,PHILIPS Lampu Emergency Lamp Rechargeable LedBulb 7W 6500K Putih
5098,Wardah Renew You Anti Aging Facial Wash 100ml
5099,Makarizo Hair Energy Scentsations Hair Fragrance White Musk 100 mL Parfum Rambut / Hair Parfume
5100,Baju Wanita Murah Kekinian Grosir Cewek Shinta Pj Navi Bhn Katun Rayon Fit To L Ld 105 Pj 140 Polos
5101,( READY ) LAZEL GLUTA PURE BY SKINEST CLINIC LACHEL SUPLEMEN PEMUTIH 100% ORI
5102,NA BOLDE Kain Refill Spray Mop Microfiber / Alat Pel
5103,JAM TANGAN WANITA IMPORT RANTAI MAGNET
5104,Spatula Set Stainless Steel 6 In 1 Kitchen Ware Set - Stainless Steel
5105,JEGGING ANAK SIZE 2 / GROSIR JEGGING ANAK / JEGGING TERMURAH / LEGGING JEANS STRECH
5106,SEPATU SNEAKERS KELSEY GS102
5107,3M Double Tape Foam 24 mm PE I Isolasi Solasi Bolak Balik Spon Busa 1600TG Daya Rekat Kuat Original
5108,BLUE BAND Rice Mix / Campuran Nasi [45 g]
5109,kondom sutra merah isi 12 buah kontrasepsi KB kesehatan pria wanita
5110,"Emina Sugar Rush Lip Scrub, Emina Lip Mask"
5111,Rifle Scope - Teleskop Bushnell 4x20 - Teleskop Senapan Angin Berkualitas
5112,Sosis Sapi Horeca Bernardi 1kg
5113,2020 Iwo 15 Smartwatch Seri W26 Layar Sentuh 1.75inci Dengan Bluetooth+Monitor Detak Jantung+Ecg Ppg
5114,Celana Chino Original Trondheim
5115,MAYBELLINE SUPERSTAY INK CRAYON 1.2 g
5116,"Unit Rak Dinding/ Rak Dekorasi 60x70 cm, putih serbaguna LRBRG"
5117,Kaos JUMBO ukuran XXL-XXXL KAOS boombogie termurah
5118,JILBAB MASKER SHANIA NIQAB LENGAN / KHIMAR / CADAR TALI PREMIUM / KHIMAR JUMBO / SYARI
5119,Sepatubandung_ AERY - Tas Selempang Wanita
5120,kasih fashion piyama tidur - AND bear - konveksi tanahabang
5121,GAMIS POCKINA DRESS MOSCREPE PREMIUM
5122,Flucat obat flu pilek kucing
5123,Milo cube/ cokelat
5124,4A Micro USB Kabel Cable Data Charger Quick Charger Fast Charger Ori
5125,Tempelan Rambut / Penahan Poni Isi 2 Pcs
5126,"b""[QURAN-MODERN] Enmac ALQURAN PQ 15 Al-Quran Pen Murah Quran Digital PQ-15 T'rbaik."""
5127,Kurma Sukari 1kg Lembut dan Basah
5128,TERMURAH - KUNCI L SET BINTANG PANJANG KOMBINASI HDT 9 PCS
5129,Hanasui Anti Aging Peel Off Mask Gold
5130,wallpaper dinding sticker  45cmx10m
5131,Musk By Lilian Ashley Eau de Toilette Black 70ml
5132,PURBASARI Lulur mandi 125gr / 235gr
5133,SEPATU WANITA PANTOFEL FARADELA HEELS F02-05.7 TERMURAH BERGARANSI
5134,KEJU WINCHEEZ 250gr / Keju Cheddar Winchees / Keju Winchiz BEST SELLER
5135,Ikat Pinggang Kulit Imitasi Aksen Lubang Tali Ganda dengan Rantai Adjustable untuk Wanita Gaya Punk Fashion Import
5136,GANTUNGAN BAJU / HANGER KAWAT JUPITERS ISI 10 (80425005)
5137,Anticrack Vivo Y91 Vivo Y93 Vivo Y95 Y91C Silikon Case Softcase Jelly Bening Lembut Transparan New
5138,SMST Celana Chino Motz Reguler
5139,Animal Farm Piano Mainan Piano dengan aneka musik ceria - A003
5140,RAK HANDUK JEMURAN HANDUK VINODA/NAGOYA 75CM
5141,Rain Cover Bag Consina 60 Liter 60L
5142,Sikat pembersih sedotan stainless Brush pembersih sedotan besi
5143,Kertas lakmus 80 pcs suncare ph paper 80 strip blue red litmus paper cek tes air ketuban [PH80]
5144,Spidol 12 Warna
5145,Dompet kartu motif slot 20
5146,karpet bulu 100x150x2cm ANTI SLIP
5147,Koko anak rayya syawal 1-5 tahun GUDANG.CLODI
5148,Wardah Lightening BB Cream Light 30 ml
5149,bubblewrap 50 meter x 30 cm plastik bubble tebal pekat lentur (ekspedisi 1 roll/per check out)
5150,Pigeon Baby Compact Powder 45gr Paraben Free
5151,MUKENA LED NYALA KARAKTER / MUKENA ANAK LUCU MURAH
5152,Mic 3.5mm Microphone with Clip for Smartphone Laptop Tablet PC Camera
5153,Wardah Everyday Fruity Sheer Lip Balm Strawberry 4g
5154,#COD# Espio Collagen Soap ORIGINAL
5155,Nu Amoorea Beauty Plus bar stemcell 15 gram dijamin ori
5156,SENDOK SET PELENGKAPAN MAKAN  / SENDOK GARPU SUMPIT  TRAVEL SET OUTDOOR
5157,Cone Mangkuk Alat Olahraga Latihan Kun Mangkok Marker Sport 005-1
5158,Party popper /confetti (khusus wil. Jawa timur)
5159,Rii Mini i8 Keyboard Wireless Touchpad RC with 3 COLOR Backlight
5160,Flashlight Earpick / Korek Kuping nyala LED
5161,NYU Creme Hair Colour Natural Brown
5162,Storage Decorative Rack Shabby chic rak kosmetik hp remote
5163,SET KOKO SUPER KATUN BORDIR DANIS BORDIR 2-12THN / SETELAN KOKO ANAK
5164,\xe2\x9c\xa8STAR\xe2\x9c\xa8 Herborist Minyak Zaitun Uk. 75 ml
5165,Zara Suede Vinyl Mule Heels
5166,Casa di Oliva - Olive Oil - Evoo
5167,VELVET JUNIOR Masker Anak dan Dewasa Hijab Nyaman Digunakan Masker kain 2 Lapis SBC
5168,Madame Gie Total Cover BB Two Way Cake - Bedak Padat
5169,Jacquelle Blur Effect Foundation
5170,SETELAN JOGGER PEREMPUAN / SETELAN SWEATER 1 - 8 Tahun SIBUYA
5171,PERFETTO keju mozarella cheese 250gr
5172,Beras Premium Slyp Super Eunak 4 Kg - SMG (Harga + Ongkir)
5173,Samsung A10s bisa gosend
5174,Garnier Light Complete Booster Serum 30 ml
5175,[7 - 10 Tahun] Kaos Anak Karakter Laki-laki Crane Pemadam Dinosaurus Spiderman Superman Cars
5176,Hair oil pappermint tumbuhlab
5177,BOLA VOLI VOLLEY PROTEAM ELEGANCE ORIGINAL
5178,NA Gunting Kuku Karakter / Cartoon Nail Clipper / Nail Clipper
5179,Celana Panjang Chinos Pria Original Premium
5180,Pixy UV Whitening BB Cream 30ml
5181,Wallpaper Stiker Dinding Motif Batik Bunga Ungu Size 45cm x 10m
5182,Tempered Glass Anker GlassGuard for iPad mini 4 Clear - A7400
5183,COUPLE ARON 4WARNA
5184,KUKE LS-01 Timbangan Gantung Digital 50kg / Timbangan Digital / Timbangan koper / Timbangan Travel
5185,Pembukaan Cincin Mutiara Ukuran Disesuaikan Berbentuk U
5186,Powerbank Fast Charging ACMIC Slim F10 Pro Quick Charge 3.0 With Digital Display
5187,Nova Pengering Rambut Lipat Hair Dryer
5188,(KK) SABUK GESPER TACTICAL MILITARY
5189,SIMPLE Kind to Skin Soothing Facial Toner 200ml
5190,Masker organik by Poupeepou 25g[ FREE KUAS PEMBELIAN 5 PCS ]
5191,[KKS] Celemek Masak Bahan Tebal Bisa Lap Tangan / Apron Celemek Tahan Air
5192,Lampu Stop Proji Rainbow
5193,PRIME PRIMEROSE JOJU COLLAGEN 33 TABLET ORIGINAL DISTRIBUTOR RESMI/ UPDATE DARI CL COLLAGEN 12TH
5194,PHILIPS Setrika Uap Listrik - GC1418 Steam Iron
5195,Enblanc indipink 20S wipes tissue basah premium korea
5196,Hada Labo Gokujyun Ultimate Moisturizing Face Wash
5197,TIMBANGAN DIGITAL DAPUR 10 KG
5198,MMTOYS MB135 Mainan Anak Marble Run 105pcs / Mainan Jalur Kelereng / Block Kelereng Mainan Edukasi
5199,(3pcs1kg) Jaket Rajut Twoton Areil Noah Unisex | Jaket Rajut Twoton Ariel Noah Premium Murah
5200,Kunci L Set Tools 10pcs / 10in1
5201,"Siliwangi Lada Bubuk 1,5 gr x 12"
5202,Marcks Teens Micellar Water 250 ml
5203,KAOS KAKI PANJANG BOLA FUTSAL NIKE POLOS GRADE ORI
5204,Selang Air Taman Magic Hose 30 Meter / Semprotan Air Fleksibel / Selang Air Ajaib 100FT SG-30
5205,KMJ KOKO AMMAR JC KOKO DEWASA Baju KOKO PRIA KOKO COWOK KEKINIAN KOKO MURAH KOKO MUSLIM MURAH
5206,PENGANTAR TEORI EKONOMI BY SUHERMAN ROSIDI
5207,Morinaga BMT gold 200gr
5208,MASKER KAIN AMERICAN DRILL TALI
5209,UTICON ST118 Stop Kontak 1 Lubang - TANPA KABEL
5210,Dilmah Exceptional Berry Sensation Tea - Teh Celup
5211,Whitelab Brightening Face Toner
5212,Ekstra Bubble Wrap
5213,Tempat Pensil Kapasitas Besar Motif Kaktus Gaya Korea
5214,PELENTIK BULU MATA VINY TERMURAH !!
5215,"Cussons Gift Bag Mini / Cussons Baby Mini Bag , Gift Set Bag"
5216,Alat pasang bulumata magnet/magnetic eyelash applicator/penjepit bulu mata magnet/alat bantu magnet
5217,Pakaian Olahraga Wanita Sport Bra Yoga Wanita Tanpa Kawat Murah Produk Import
5218,311 Pensil Alis JustMiss Oren PENDEK Pencil Eyebrow Just Miss Brown--g.k--
5219,Sepatu Mizuno Wave Lighting Sneakers Casual Pria Running Jogging Sporty Sekolah
5220,TERMURAH MIC KABEL SONY M100
5221,Kaos Anak LAKI - LAKI ULTRAMAN - 64 FullPrint 3D
5222,DASTER BALI SIZE XL
5223,Kaos Training Nyke ( G-RIS ) / Baju Olahraga / Baju Running Ukr M~L~XL
5224,BAJU RACING
5225,Sophie Paris Talinia Bag Tas Wanita Maroon (T5310M2)
5226,Scarlett Whitening By Felicya Angelista!!
5227,READY STOCK BEST SELLER !!! ISLAMIC PARENTING [HC]
5228,Celana Bahan COMBED M - XL Celana Bahan Basic Kantor Kerja Girl Wanita Jumbo Big Size
5229,Obeng Set 31in1 - Obeng Set Telur - Obeng Mini Service Elektronik HP
5230,PREMIUM MINI KHIMAR by daffahijab
5231,WHY SECRETARY KIM 2
5232,Warasa bumbu jepang non msg
5233,Eagle Eucalyptus Disinfectan Spray 280ml ( Caplang ) Free Bubble Wrap
5234,HERBORIST LULUR TRADISIONAL  EXTRACT + BRIGHTENING 100 GR
5235,TGB Vakum Sisir Kutu Elektrik / Vacum Penghilang Kutu / V Comb Vaccum Kutu
5236,BYDAY Emery - Spaghetti Straps Tanktop / Tube Top / Tanktop Kemben / Square Tank
5237,ZERNII SARINGAN FILTER KERAN AIR ZERNII
5238,Jamu double strong
5239,{Lav- F540} Sepatu Flat Shoes Karet Wanita
5240,COD DNM Eyebrow Pencil Pensil Alis Anti Air Dengan 2 Pilihan Warna Kecantikan Kosmetik Mata
5241,NM582 Daun Rambat 1Pcs / Daun Pot Gantung Bunga Plastik
5242,SOLOGROSIR(COD)IKAT PINGGANG MINI BELT GAMIS WANITA
5243,Masker Sensa Earloop 3ply
5244,Giotto Acquerelli Mini Watercolor WaterColour Cake Cat Air Pocket 36
5245,KIMBO Sosis Lauk Rasa Ayam Bakar 75 gr
5246,Acnes Sealing Jell 100% Original
5247,Kacamata safety/kacamata APD Tony Stark
5248,BABYPOTATO - Premium Baby Sleepsuit Motif Dandelion
5249,GAMIS POLOS JUMBO/ GAMIS BALOTELI/GAMIS SERENA BY RISMATRIE
5250,Mainan Koleksi Sylvanian Families Red Roof Cosy Cottage
5251,JERSEY MANCHESTER. UNITED HOME 2019/2020 GRADE ORI
5252,Celana Jeans cewek skinny/celana jeans skinny wanita
5253,Thermometer Hygrometer Digital LCD With Probe Humidity Temperature
5254,Container Box Spark CB 30 Liter Shinpo Dengan Roda / Box Container / Box Kontainer Plastik
5255,MOBIL TAIO THE LITTLE BUS ISI 4
5256,Balon PVC transfaran / PVC balloon 24inch high Quality
5257,Gembok alarm
5258,How To Win Friends And Influence People Oleh Dale Carnegie (cover baru 2019)
5259,FREE BUBBLE - HELM T1 MODEL INK CX22 DOUBLE VISOR MURAH RESELER COCOK PRIA WANITA  DROPSHIP RESELER
5260,Jam Dinding Shabby
5261,( MIKA ) Sponge Beauty blender Gucci Mika/spons gucci mika
5262,Noosy Adaptor Sim Card - Nano Micro Standart + Reject Tray
5263,SEIN TEMPEL LED GMA OVAL UNIVERSAL MOTOR FAIRING
5264,Consina Waist Bag Coda
5265,Mukena Flanel Ransel Melody Doti Lavender
5266,LADIESBAG - 2FUNGSI RANSEL DAN TAS SELEMPANG HANDBAG BAG WANITA CEWEK FASHION MURAH IMPORT
5267,DD373 (1KG=65PCS) COD Kaos Kaki Bayi Karakter Hewan Lucu Kaos Kaki Bayi ala Korea Lucu Anti Slip Mrh
5268,Hitori Mask - Masker Kain Bahan Scuba Tebal dan Nyaman by FEMINE
5269,1kg-3pcs Buku Gambar / Chalk Doodle Book
5270,KINGS- T581 Topi Rambut Kepang Dua / Baby Hat Wig / Topi Bayi Kepang / Topi Kupluk Bayi / Topi Rajut
5271,Nutrinidrink Powder 400gr Vanilla Susu Untuk Anak Usia 1 -12 Tahun
5272,"DB GAMIS GHANIA(C2) BABYTERRY HALUS & KANTONG KIRI, KANAN"
5273,Set Rice Molding - HK/Bunny/Bear Bento Tools - Cetakan nasi
5274,Casing Bahan Tpu Motif Star Wars Untuk Iphone 11 7plus 8plus 7 8 Iphone 6 6s Plus Xr X Xs Max 11pro Max Se 2020
5275,Bantal set cinta karaker(80cm)
5276,Headset Earphone Samsung Galaxy S7 Original Black
5277,long dress JUMBO wanita CERIA CERIA
5278,Panci Listrik Elektrik Multifungsi Panci Multifungsi Elektrik Alat Masak Travel Q2 8518 / Q2-8518
5279,"b""[BPOM] MARCK'S Marcks Active Bedak Tabur Beauty Powder 20g"""
5280,Bebelove 2 gold 700g
5281,Herbilogy Breastfeeding Capsule / ASI Booster (60 Capsule)
5282,JAM TANGAN SPORT COUPLE LED Digital GLOW Strap KARET MURAH IMPORT
5283,KIPAS ANGIN MINI PORTABLE / MINI FAN USB / KIPAS ANGIN USB
5284,NHTID Tali Kur Nilon untuk Jaring/Teralis/Jala Tanaman Rambat di Kebun
5285,MI BONCABE KOBE LEVEL 15 RASA MIE GORENG 105 GR
5286,BANDO KAWAT MOTIF - BANDANA RAMBUT KOREA - AKSESORIS HAIRBAND BUNNY
5287,Dompet Lipat IMPOR Pria Fuerdanni Exclusive Cowo Leather Mens Wallet Kulit
5288,Helm karakter bogo/retro kulit sepatu
5289,Spidol Ban TOYO PUTIH - Paint Marker Toyo Kualitas Terbaik
5290,Masker Scuba Anak Full Printing
5291,Selection facial cotton kapas
5292,Topi  bayi / face shield baby / topi bayi visor
5293,Buavita Orange 250 ml
5294,GAMIS RUFFLE BAWAH DOUBLE
5295,Pixy Waterproof Mascara
5296,Pureco Liquid Fruit Veggie and Salad Wash
5297,CS003 Gantungan hp strap phone tali leher motif karakter kartun brand all type hp
5298,Tudung Saji Kotak Lipat Penutup Makanan Sayur Alumunium Foil Tahan Panas
5299,Maura dress/maxy
5300,GOON SMILE BABY PANTS  S40 M34 L30 XL26 | S 40 M 34 L 30 XL 26
5301,New Basic Shirt Part 2
5302,OSM - P185 Popok Kain Berkancing / Popok / Popok Bayi / Bisa Dicuci & Pakai Lagi
5303,[220gr] H015 | Keset Cendol Mikrofiber Premium Quality
5304,Jessen Cooler Bag GABAG Single Infinite Series / Tas Asi + Free 1 ice gel
5305,Kabel Charger Fast Charging USB Tipe C 5A Quick Charge QC 3.0 untuk Handphone
5306,5M Balloon Strip Connect Chain Balloon Arch Decor Plastic DIY Tape Party Supply\xe2\x98\x86
5307,Somethinc Niacinamide + Moisture Beet Serum - 20ml / 40ml
5308,Tas Kosmetik Monopoly Travel Make Up Wanita Bag in Bags Traveling Organizer
5309,[ MZ 26 ] Baju Olahraga Jersey Sepak Bola Kaos Setelan Futsal / Volly / Voli / Badminton
5310,Long top tunik polos
5311,Unifood tepung BAKSO goreng 200 gram
5312,Lampu Agustusan Warna warni
5313,"Celana panjang pria cargo cream, cargo casual. celanacargo pria D34"
5314,Biji pinus / hiasan dekor cantik
5315,sandal Wudhu Masjid Musholla Sedekah Wakaf Murah - Sandal Jepit SWM 10
5316,Piring makan set karakter mickey/tempat makan anak/ mangkok mickey pita set
5317,[BPOM] MISSHA Airy Fit Sheet Mask
5318,Headphone MDR XB 450 / XB450 / XB-450 / EXTRA BASS KABEL
5319,Hukum acara perdata by Prof Sudikno mertokusumo
5320,Pembersih Kerak
5321,Kabel Konektor Splitter 3.5mm audio Mic & Headset Microphone & Headphone
5322,Bestway 54005 Kolam Renang Karet Anak Keluarga Besar 201 cm Rectangular Family Pool [201x150 x51cm]
5323,Bosh arm Vixion bosh fork vixion
5324,Xamthone Plus | Xamthon | Juice Ekstrak Kulit Manggis Original
5325,Cosmos Rice Cooker Harmond CRJ-6368 - 2L
