tid,title
16330,LVN COLLAGEN LVN STROBERI ORIGINAL 100% 1BOX ISI 10 SACHET
16331,TU88 Pouch Kosmetik Bunny POMPOM Bahan Bulu Travel Pouch Cosmetic Organizer Kelinci - PBN
16332,Vivo Y50 Y30 Y30i X50 S1 Pro Flip Mirror Sarung Case Clear View Standing Book Cover
16333,Souvenir pernikahan sendok garpu tile bonus kartu ucapan terima kasih
16334,Dari JAKARTA - Bisa COD \xe2\x98\x85 CAYMAN \xe2\x98\x85 Geneva Jam Tangan Wanita Jelly Rubber Women Silicon Watch SW101
16335,Earphone 4 Units Heavy Bass HiFi  In-Ear Dual Driver Bass Sport
16336,SHANNEN LIPSTICK CLP
16337,Pulpen Lilin Murah Bolpenku Bolpen Lilin Murah Bolpenku
16338,Blueband cake&cookies 2kg(kaleng)
16339,Mini Microphone Clip On Mic U Shape Audio Splitter
16340,JS_Tas Selempang GNEI/Tas Selempang Termurah/Tas Selempang Cewek/Tas Selempang Elmo
16341,CHARGER CASAN VIVO V5 V7 V7PLUS V9 Y71 Y83 FAST CHARGING ORIGINAL
16342,Masker Telur Hanasui Bpom / Egg White Peel Off Mask Hanasui [ GROSIRKU ]
16343,Talenan 9 in 1 Multifungsi Baskom Pisau Parutan Serbaguna
16344,SWEETY COMFORT GOLD TAPE (PEREKAT) NB52 / S50 / M48 KEMASAN BARU
16345,[TOTAL HADIAH 11JT] OPPO A31 4GB/128GB [4230 mAh 12 MP Triple Camera]
16346,CATOK HAIDI MINI TERMURAH !!
16347,Case Flip cover Canvas Samsung Galaxy V J1ace J12016 J5 J6 J4 J5pro J7 J7Core J2Core J4+
16348,PELINDUNG DADA KULIT UNTUK PENGENDARA MOTOR
16349,Sticky Notes Emoji Sticky Note Memo Lucu Unik Simple GH 301254
16350,Koko Kurta Bordir Warna List kotak / Kurta Warna List Kotak-kotak
16351,Rexona Deodorant Dry Serum Whitening Fresh Sakura 50ml Anti Bakteri
16352,Mangkok Masker Set Mangkok Masker Mangkuk Masker
16353,"[24 potong] Kuku palsu baru / stiker kuku tahan air / 24 potong kotak, lem gratis"
16354,Midi Dress Flower Etnik Long Tunik Tunic Zara Import Bangkok
16355,Hard Case Bahan Karet Silikon Matte Warna Kontras Untuk Iphone X Xs Max Xr 11 Pro Max 6 6s 7 8 Plus
16356,MASKER HIJAB DAN NON HIJAB BAHAN  MOUSCREPE
16357,Mainan Bola balon Basket karet
16358,Kue Bulan Ny Lauw (lauw kim wie) / tiong ciu phia
16359,Cotton Mask By Little Palmerhaus Maker Katun Non Medis
16360,{Lav - J169} Jam Tangan Band Watch / Jam Tangan LED / Arloji/ Jam Tangan Unisex / Jam Tangan Digital
16361,DREAM LAUNCH PROJECT (Renita Nozaria) + Bonus
16362,017 LAP TANGAN HANDUK MOTIF APEL
16363,Erigo Chino Pants Jacob Dark Grey
16364,(27AN.ID)Jam Tangan JT15 LED jam tangan Pria&Wanita jam tangan Sport Wrist Band import B2
16365,( 100 gr )Herborist Aloevera Gel Tube - Herborist Aloe Vera Gel Tube 92%
16366,Slip Sandal Daff 11 Pataya
16367,COD - Easy Touch GCU 3 in 1 / Easytouch Alat test Gula Kolesterol Asam Urat
16368,Anti crack case REALME C11 C15 C3 XT 5 5i 5s 5PRO PRO X REAL ME C1 C2 2 3 6 PRO anticrack cases
16369,Fasahaya Hiasan Dinding Poster Kayu Leaf Dekorasi Rumah 15x30 LF34
16370,KONEKTOR MASKER / PENGAIT MASKER / TALI MASKER HIJAB
16371,CELANA MANSET BASELAYER 3/4 GRADE ORI
16372,Jilbab serut polos kombinasi haiget / Promo serut polos kombinasi
16373,Lampu Kolong Truk Bis 24 Volt 9 titik Led Modul cob
16374,Celana kulot TD rayon bali
16375,Gelas Ukur 500ml / Takaran Air / Takar / Measuring Cup / Plastik
16376,Ear Candle Original Indian / Lilin Pembersih Telinga / Terapi Telinga / Terapi Kuping (1Set=2pcs)
16377,"b""Kubur Berkubah (Dead Man's Folly) - Cover baru - 617185011"""
16378,LINPINK X2 Kids camera Kamera Mini anak / camera anak / camera kids
16379,CEPAT SAMPAI !!!  Karpet Refleksi (Karpet Pijat alas Kaki)
16380,RECTANGULAR 180ML LOCK&LOCK (HPL-805)
16381,PACKING TAMBAHAN UNTUK ORDER DI CLOVER LYNN STORE DUS DAN BUBBLE buble wrap
16382,Josh&Joe Sandal Pria Kulit Keren - 07 JHTM
16383,LIPCREAM EMINA
16384,Kunci Ring Pas set 11 pcs Diamond Ring Pas 8-22mm / ring pas set 11 pcs
16385,Elisabeth dress BU
16386,handsfree  Xiaomi piston 2 #FJ019
16387,WARDAH INSTAPERFECT Mattecentric Lip Crayon
16388,Tissue See U Hand Towels promo
16389,"[PERPACK] Amplop Coklat Ukuran Folio WPS ( 23,5 x 34,5 cm )"
16390,Outer Brokat Serut Rempel Lakulla
16391,Sedapko Juhi Kecil 25 gr
16392,SHINZUI UME BODY SCRUB 200GR / LULUR MANDI SHINZUI UKURAN BESAR SHINZUI LULUR LULUR SHINZUI 200 GR
16393,Brush 12 Set In Tube Kuas Tabung Rias Make Up 12 Set Kuas Make Up
16394,Sprei Lady Rose 180x200 King terlaris Doraemon
16395,Salep hl Pi kang Wang bkw Bayer dihon 20g besar salep kulit gatal
16396,Talenan baskom multifungsi
16397,Exquisite Clear Acrylic Square Gold Hand Cranked Gurdy 18 Note Music Box Play Castle in the Sky
16398,Warm Plush Mask Earmuffs Earmuffs Two In One Korean Version of The Child Bear Cartoon Mask
16399,RD FASHION DASTER MANOHARA POLOS BAHAN WOLFIS FIT L
16400,Cincin Titanium Keren Simpel Elegan Ring Black Silver Gold Couple
16401,LKM028 16-34 [1KG 28PCS] | LITTLE KUMA TOPI KUPLUK BAYI / TOPI ANAK UNISEX LUCU
16402,Studio Tropik BB Size Flawless Priming Water
16403,Mustela Stelatopia - Emollient Cream
16404,BERGO LENGAN AZIZAH / BERGO SYARI PAD BUSA ANTEM BERLENGAN BAHAN JERSEY ZOYA
16405,Alvin.store123 BAJU TIDUR PIYAMA Hp EMBOS PREMIUM 3W
16406,AHDAVASHOP Panci Elektrik Panci Listrik Multifungsi C-18
16407,FS Beras Long Grain 2.5 Kg
16408,Sabun cloris men pembersih wajah untuk pria cowok jerawat berjerawat clorismen soap acne original
16409,holder hp gurita/gurita hp/holder tempel gurita
16410,Realme C15 C11 C12 6 Oppo A92 Vivo Y50 Y30 Y30i  Casing Soft Case Silikon Motif We Bare Bears wbb untuk iPhone 6 7 8 7P 8P  x XS 11 11Pro Oppo A52 A72 A91 Reno3 wbb wbb
16411,"b""JOHNSON'S Active Kids Bath Clean & Fresh 200ml"""
16412,100% ORIGINAL Mane N Tail Herbal Growth Shampoo 355 ml/ Shampo Kuda / Rambut / Mengurangi Rontok
16413,Animal Farm Piano
16414,Casing Akrilik Silikon iPhone 11 11 Pro 11 Pro Max Shockpoof Warna Permen
16415,Fashioncase #21595 for iphone oppo vivo samsung xiaomi realme
16416,Wardah Eyebrow Pencil Brown 1.14[SKB]
16417,PALING TERLARIS !!! Samsan Couple | Baju Couple Muslim TERMURAH
16418,HAJAR - JAHANAM ASLI 5ML ORIGINAL MESIR
16419,Pharmaskin skincare Paket Whitening Glow
16420,CAR CHARGER BASEUS 30W TYPE-C PD3.0+USB QUICK CHARGE 4.0
16421,paket super kinclong lengkap
16422,MAMA LEMON JERUK NIPIS REFILL 780ML
16423,ring basket single untuk bola basket size 7
16424,Kaos kaki jempol telapak hitam warna warni Grosir
16425,Selimut Bulu Polos Vallery Quincy Halus Lembut Panjang Ukuran 160x200 Dewasa Murah - IJN COLLECTION
16426,Pancake durian mika ekonomis isi 8
16427,Cussons Baby Wipes 50 s Beli 1 Gratis 1 Tisu Basah - Promo Harga Special
16428,bracket behel amplop
16429,Sepatu KOREA JINTU 2020
16430,Sarung Jok Sepeda Busa Sadel Jok Sepeda
16431,RECCI GRACETONE Earphone with Mics REW-H01 Earbuds Emas/Biru/Merah
16432,1697 AOLIKES Pelindung Penyangga Cidera Bahu Pundak Adjustable Shoulder Fitness GymPosture Corrector
16433,Speedy- Blender Manual blender tarik alat potong speedy chopper manual
16434,"NOWHERE (Pinkishdelight) Bonus 3 Pin Up, 3 Photocard + 1 Poster NCT"
16435,buuble wrap packing plastik gelembung plastik pack tambahan
16436,oppo a71 a83 a7 a5s a3s k3 k5 a1k Flip Cover Mirror Standing Case Smart View
16437,Alat Pel Q2-103 Busa Keras Berkualitas
16438,Tempat Sabun Cair 2 Tabung - SoaTp Dispenser Double 2 in 1
16439,PANTENE SHAMPO ANTI DANDRUFF  900ML EXP  2023
16440,"Ready chino pants anak no.1-8 size 2,3,4,5,6Y"
16441,Nongshim korean Sweet Potato Snack
16442,ORIGINAL STRAIT SISTER ORI - BH SISTER / BRA SISTER / BH BRUKAT / BH Tanpa Kawat Tanpa Busa
16443,Back Pack Double Decker_Tas Ransel Anak_Lol_Unicorn_Superhero_Paw Patrol_Shopkins Fashion Cewek W5Q3
16444,case iPhone X / XS / XR / XSMax replaces iPhone 11 / 11Pro / 11ProMax lens integrated film
16445,[FREE FACE CLEANSING BRUSH] DAISY ORGANIC MILK FULLSIZE
16446,Keranjang Laundry bag lipat / keranjang baju kotor lipat / hamper baju / laundry basket
16447,Miranda Keratin Protein Treatment
16448,Ruler / Penggaris Joyko RL-P30 / 30 cm
16449,RK glow premium
16450,Casing Case Full Cover 360 \xc2\xb0 Bahan Metal + Tempered Glass untuk iPhone 6 / 6S / 7 / 8 Plus/ XSMAX /X
16451,Papan Dart Target Tembak untuk Nerf N-Strike Elite Series Target WOW
16452,Beng beng chocolate reguler 20gram
16453,Facial bandana mandi / bando make up
16454,GOGO CMS005 Mainan Buku Gambar Bisa Dihapus 6 Halaman dan 4 Pensil Warna
16455,TALI SEPATU CHECKERBOARD
16456,Garnier Micellar Cleansing Water 125ml
16457,Gillette Simply Venus Basic Pisau Cukur Wanita isi 2 Pcs
16458,JILBAB ANAK BANDO TILA
16459,MAKANAN KUCING OMEGA CAT SEAFOOD 1 KG REPACK
16460,Mamypoko Pants Extra Dry S38 / M32 / L30/ XL26/ XXL22 mamypoko extradry
16461,Juz Amma Doa dan Asmaul Husna Ukuran Medium Kertas HVS
16462,MFK Maison Francis Kurkdjian Baccarat Rouge 540 EDP Extrait 70mL
16463,PROMO PAKET ISI 2BH - BANTAL DAN GULING BRENDIS / BANTAL GULING HOTEL SILICON
16464,"b""Pond's Angel Face Natural Mattifying Powder 50gr"""
16465,Kabel data VEGER V101 2.4a micro usb ( 1toples isi 50)
16466,Promina Baby Rusk Biskuit Bayi
16467,A Court of Thorns and Roses
16468,JF AntiAcne Facial Foam
16469,Zambuk Obat Luar 25gr
16470,PACKING TAMBAHAN BUBBLE WRAPPING
16471,"b""Charm Pembalut Extra Maxi Non Wing 30's"""
16472,Dispenser Odol dan tempat sikat gigi
16473,DOMPET SAPHIRE CHANNEL DOMPET WANITA CHANEL KULIT BORDIR
16474,STP sarung tangan plastik sepasang
16475,Catok 2in1 Gemmini ( pelurus & pengeriting rambut ) catokan curly lurus 2 in 1 gemini
16476,Simpel Pet Tali ||| HIJAB JILBAB KHIMAR INSTAN
16477,HUKI NIPPLE DOT SILICONE REGULER TOPLES / DOT NIPPLE SILIKON (SML)
16478,Sendok pemisah putih & kuning telur praktis/ egg separator/
16479,Sandal Flat Wanita Stude Mules AM
16480,Rak Sepatu Panci Dapur Multifungsi Serbaguna Lemari 2 Susun Kitchen Tempat Bumbu Panjangin Flexible
16481,SALE JUAL MUKENA ANAK  KATUN TAS SAJADAH UNICORN
16482,ZINC PICOLINATE 30 / 60 CAPSUL BOTOL
16483,SPECIAL EDITION DISNEY Vol 1 & Vol 2 ( BACA CAPTION SEBELUM ORDER )
16484,NESTL\xc3\x89 MILO ACTIV-GO Minuman Serbuk Cokelat Paduan dengan Malt Pouch 800g
16485,[ GARANSI TERMURAH ] Masker Kain Tali Bahan Tebal Dan Halus [1KG=120PCS]
16486,Paket hemat (3 in 1) kaos + legging + celana pendek / Futsal olahraga sepakbola jogging
16487,Couple Zaki Zakia l Couple Lebaran Terlaris
16488,KAOS RAJUT COWOK TURTLE NECK / TURTLE NECK MAN
16489,BPOM MISSHA Premium Cica Aloe shooting gel
16490,BUSA FILTER RADOTS SUPER / BUSA FILTER AIR
16491,TERMURAH MANSET HANDSOCK RAJUT JEMPOL Rp.5.500 bila beli 36 Bisa ECERAN DAN GROSIRAN
16492,Little Palmerhaus Tottori Baby Towel
16493,SOS Hand Sanitizer Antiseptic Botol Spray 100ml
16494,FROZEN DETOX 60 KAPSUL FROZEN COLLAGEN
16495,Makarizo Hair Energy Scensations White Musk 100ml
16496,HUKI MINYAK KAYU PUTIH 60 ML
16497,Grosir Jegging Bayi size 2 size S Jegging anak termurah / jegging bayi termurah / Legging Jeans Anak
16498,Dress malone II / dress panjang
16499,Blue Band/ Blueband Rice Mix
16500,Emina Sugar Rush Lip Scrub 4.2 g
16501,(1kg=18pcs) bendera merah putih 80x120cm - bendera Indonesia - bendera agustusan - bendera upacara
16502,Kain katun jepang toyobo ori japan RM - Seri 1
16503,PROSAMURA Obat Asam Urat Nyeri Sendi
16504,[KHUSUS Gosend /Grab] BAYCLIN pemutih pakaian 1000 ml
16505,CREATION TEASE ME EYESHADOW (PROMO) Beauty CREATION TEASE ME eyeshadow palette Palet Eyeshadow
16506,Meizu C9
16507,[LOKAL] DOMMO - D1180 AERY - Tas Selempang Wanita MORYMONY
16508,KABEL DATA CHARGER POWERBANK ULTRA PENDEK
16509,Alat cukur  elektr1k portable
16510,"ELSHESKIN Skin Serum (Radiant Skin, Sebum Reducer, Anti Aging, Vitamin C, Smoothing)"
16511,GOGO Celemek Dapur/Masak Waterproof Anti Air Karakter Lucu
16512,Ayunan Per 2 + Kelambu Joeyi
16513,Keranjang Baju Kotor / tempat baju kotor  Motif Lucu
16514,Hanasui Gold Peel Off Mask BPOM Original - Naturgo Gold
16515,Tea Tree Facial Wash 250 ML / 400 ML The Body Shop  / TEA TREE OIL
16516,MASKER SENSI KIDS ANAK (ISI 5 PCS)
16517,BAYAR DITEMPAT (COD) KAOS KAKI AVO AVS R1 FUTSAL SEPAKBOLA PANJANG SAMPAI ATAS LUTUT ORIGINAL AVO
16518,JUAL MUKENA ANAK KATUN LOLLA   S PINK (TAS RANSEL)
16519,JAKET HARRINGTON OUTDOOR WATERPROOF
16520,NESCAFE Classic 2gr 1 Renceng isi 10 pcs...!!!Dalgona
16521,0-1th Rok Dress Baju Bayi terusan Perempuan TRS-05001 baru lahir 0 3 6 bulan 1 tahun lucu murah
16522,OSM - F521 Ikat Rambut 18 in 1 / Jepit Rambut / Aksesoris Rambut / Ikat Rambut Fashion Wanita
16523,Baseus Apple iPhone Lightning Cable 23cm / Kabel Data Charger Powerbank iPhone 23cm Nimble
16524,Baterai Asus A46CA A46CB A46CM A46C A46 K46CA K46CB K46CM A31-K56OEM
16525,Pita Kotak 2.5cm (1 inch) per Roll
16526,Parfume Thailand 35ml
16527,715 Amore Signature Dress
16528,Rak Jemuran Handuk Merk Dragon / Rak Handuk Dragon
16529,VIVA LULUR MANDI WHITENING & MOISTURIZING Bengkuang avocado
16530,Sweater twist milky
16531,New Summer Baby Girls Sleeveless Flower Dress Sweet Casual Cotton Princess Dress
16532,Nugget Ayam Sedap So Nice 1 kg - Nugget Ayam Berbumbu Lezat Bergizi dan Ekonomis
16533,Safi Age Defy Cream Cleanser Deep Moisturer 150ml
16534,Penumbuh Rambut Paket Bio Herbal 2 in 1 : Ginseng Shampoo + Hair Tonic Original BPOM
16535,CORONG AIR MINYAK PORTABLE
16536,CS - Kaftan Falda Free Belt
16537,"DOMPET KARTU MOTIF FRUITS ,UNICORN , FLAMINGO DAN PINK PANTHER"
16538,Jok Baby Walker Family 136 | 2211 | 2218 | 3312 Original Family Asli
16539,6 in 1 Korean Travel Bag in Bag  isi 6 pcs  organizer
16540,Wardah Lightening BB Cream 30ml
16541,Pigeon Bedak Padat Bayi - Baby Compact Powder Cake Chamomile White 45 Gr original
16542,Kaos polos PRIa Vneck bahaan spandek/murah
16543,3.5mm Microphone with Clip for Smartphone HP Laptop Tablet PC mic plug Jepit mikrophon komputer
16544,Mitu Baby Cologne Pink Spray 100 ml
16545,WARDAH Everyday Fruity Sheer Lip Balm
16546,Tepung Bumbu Serbaguna Cap Citra Putri 250 gram
16547,Cone Mangkuk Alat Olahraga Latihan Kun Mangkok Marker Sport 005-1
16548,"Motor dc 3V sampai 5.8V , motor dinamo dvd project elektro"
16549,Benton Aloe BHA Skin Toner
16550,Handgrip Foam Alat Latih Otot Tangan Hand Grip Original SPEEDS
16551,[BIG SALE] Cognition cards puzzle 2 - mainan edukasi anak
16552,Daster Black Cat / Dora Awan / Lebah / Mickey / Teddy Love / FILA Baju Tidur Katun Jepang
16553,Shining Peel Off Charcoal Mask - Masker Muka
16554,Paket Tabita 40Gr Exclusive Barcode + Exp Date Original
16555,OTG Micro USB
16556,JAKARTA WCHD - SANDAL SENDAL  WANITA BAN 3 HITAM COKLAT PUTIH
16557,[RESMI][FREE SPATULA] BPOM \xe2\x9c\x85 20 GRAM FACE MASK LEA GLORIA / MASKER BUBUK BY LEA GLORIA
16558,Pixy Uv Whitening Bb Cream 03 - Beige (4 Beauty Benefit)
16559,KINOKI GOLD BOX GINGER SALT
16560,HERBORIST MINYAK ZAITUN 75ML
16561,RAK SEPATU GANTUNG KARAKTER HSO
16562,"Jas Hujan Axio Karet Rubber 298 like GMA 0,21mm"
16563,Kertas Canson Montval A3 - 220g 5 lembar
16564,SETELAN PONY MAROON
16565,HOT HAIRDINI / HAIR DINI / ALAT CEPOL DONAT SPON IKAT RAMBUT CPR BIG SALE
16566,Serba Grosir Murah Sarung Tangan Cendol Microfiber Lap Tangan Serbaguna
16567,GARNIER LIGHT COMPLETE BOOSTER SERUM 30ml
16568,Vidoran Xmart 1+ 1000g ( Madu / Vanilla )
16569,\xe3\x80\x90COD\xe3\x80\x91Penyangga Masker / Mask Bracket Support Penahan Anti Pengap
16570,Helm anak sinchan karakter lucu - cip pst
16571,"Karet elastis  4mm, 5mm dan 1cm/ karet baby /meter , tali elastis bulat"
16572,Tumbuh Lab Hair Oil Tumbuhlab Original (Kemasan Baru)
16573,MID YEAR SALE SEPATU VANS SK 8 HIGH BLACK WHITE
16574,Celana pendek pria / wanita santai NK
16575,Pdro click structured croco wallet qualityori
16576,Gamis Monalisa Summer Rose Wolfis XL dan XXL Jumbo
16577,Glulagen
16578,COUPLE ARON MUSLIM TERBARU CP ARON VH1
16579,Bibit alpukat markus super jumbo cepat berbuah
16580,Parutan Mini / Parutan Penghalus Bawang / Garlic Grinder
16581,Simple Soothing Facial Toner 200ml
16582,ACNES Creamy Wash 50g / 100g
16583,Cermin Portabel Mini Bentuk Bulat Motif Kartun
16584,(Beli 10 Free kuas) Poupeepou Organik Mask
16585,Shamira top / fit to xl / mat wolfis
16586,Evergreen Reed Diffuser 30ml Set / Refill (Pengharum Ruangan)
16587,Keju Prochiz Quick Melt 170 gr
16588,Fashion Masker Anti Debu yang Dapat Dicuci Untuk Anak-Anak masker anti virus anak corona MCS
16589,PROMO NEW JOJU COLLAGEN by CL COLLAGEN ISI 33 Kapsul Original Lampung
16590,"Digital Thermostat, Temperature Controller, XH-W3001, 220V AC"
16591,Buf masker Kain Hitam google mask slayer bandana Balaclava Motor Helm
16592,\xe2\x9d\xa4 BELIA \xe2\x9d\xa4 Mustika Ratu Hair Tonic | Minyak Zaitun Olive | Oil Cemceman | Shampoo Bayam 75 / 175 ml
16593,ENBLANC INDIPINK Baby Wipes 20pcs tissue basah
16594,Mixer / Hand Mixer Miyako 620 5 Kecepatan Garansi Resmi
16595,Shinar Glamour Ansania Square  - Jilbab Hijab Kerudung Segiempat Sinar
16596,NESTLE NAN pH Pro Optipro Susu Pertumbuhan 1-3 Tahun Kaleng 800 gr
16597,GASOL Organik Tepung Beras Merah 200Gr / 200 Gr / Makanan Bayi
16598,[300g] Timbangan Dapur Digital SF-400 10 KG Kapasitas Kitchen Scale SF400 10KG
16599,Heavy Chiffon Pashmina / Arabian Pashmina Premium Quality Chiffon hijab Import Hijab Mayalsian
16600,SanDisk Ultra 100MBps microSDXC Card Class 10 - 64GB - QUNR
16601,Jigsaw Puzzle / Puzzle 60 Keping Lucu
16602,Tinta Sublim Epson Diamond Ink Best Quality Ink
16603,Termurah !!! Mainan Puzzle Kayu / Wooden Puzzle Knob - Toys Center Jakarta
16604,HC Aksesoris Boneka Bergoyang LED+NYALA SPRING DOLL Tempelan Mobil Karakter Emoji Emoticon
16605,DNatural Bawang merah(1000gr )
16606,Jessen Tresno Joyo Minyak Telon 100ml get Free 30ml (EXP 2021)
16607,BC Seen Cairan Pembersih Softlens 80ml & 120ml
16608,Selang Air Taman Magic Hose 30 Meter / Semprotan Air Fleksibel / Selang Air Ajaib 100FT SG-30
16609,HP / GPS CAR HOLDER AC / TEMPAT HP ATAU GPS DIKAITKAN DI AC MOBIL
16610,Selai Nanas Strawberry PINACO DONNY ROYAL EDNA 500gr Untuk Isian Nastar Roti
16611,Kojiesan Cleanser + Toner 60ml
16612,(\xe2\x9c\x93BISA COD) WARDAH EXCLUSIVE MATTE LIPCREAM | LIPCREAM TERLARIS DENGAN 18 VARIAN WARNA
16613,Women Korean Solid Elegant Big Hair Claws Clips /Fashion Frosted Acrylic Shower Crab Clamps Shark Clip/Chic Girls Hair Accessories
16614,minyak goreng kemasan Siptop 1000 ml bonus penutup debu
16615,HC LAMPU TUMBLER /LAMPU HIAS NATAL /LAMPU TUMBLR 10 METER 50 LED DEKORASI ADA SAMBUNGAN FEMALE
16616,Wajan enamel anti lengket 34
16617,Lyra Kneadable Eraser / Penghapus Uli
16618,Rasa Thyme Leaves - Daun Timi 20gr
16619,"Desain Foto Mozaik + Cetak Papan MDF 20x30cm Kado Wisuda, Ulang Tahun, Hiasan Pajangan Dinding"
16620,Sustagen Kid Madu 800gr
16621,[BPOM] Cussons Gift Bag Set / Cussons Mini Bag & Cussons Medium Bag / MY MOM
16622,sandal kokop mika ban dua
16623,[ Refill ] Esenses Skin Perfecting Cushion Color Control Cream
16624,JACK N JILL Knots Choco Biskuit Pretzel 55 gr
16625,Samsung Galaxy S6 S7 Edge S8 S9 S10 S20 Plus Ultra S10E Note 20 FE Ultra 8 9 10 Pro Lite Full Curved Tempered Glass Film
16626,COD Fashion Wanita: Set G-String Transparan Sexy dengan Renda/Sexy Transparent G-String Set with
16627,Baju Running/Olahraga/Training NB 01
16628,LAMPU LED STRIP SELANG 3528 2835 10M 220v 10 M METER 5050 OUTDOOR RGB
16629,PENYANGGA PUNGGUNG BABAKA TANPA DUS uk S-XXXL
16630,Sepatu Sneakers dengan Bahan Kulit PU dan Lampu LED Warna Warni Bergaya Sporty
16631,BLUETOOTH RECEIVER MUSIC USB WIRELESS BLUETOOTH STEREO AUDIO VEHICLE WARNA HITAM
16632,KLAIRS Trial Set Sachet 3ml - Klairs Sample
16633,Madame gie concealer
16634,Obeng Set Multi 31 in 1 Screwdriver Handphone Elektronik HP Laptop
16635,Tenda Mainan Anak Bentuk Castle Praktis Bisa Dibawa Kemana Saja
16636,BAYAR DI TEMPAT KAOS DISTRO SCREAMOUS / KAOS SCREAMOUS / KAOS DISTRO PRIA
16637,Ring Light 26cm + Light Stand Tripod 2M Selfie Vlogger Livestreamer
16638,NIVEA Body Serum Extra White Anti Age 180 ml
16639,Zoya Masker Only Brown and White
16640,Mitochiba Chopper CH 200 (Baru & Bergaransi Resmi)
16641,Spion beat twotone honda yamaha beat vario scoopy
16642,Senar gitar Ernieball elektrik
16643,[ 100gr ] HERBORIST TRADISIONAL LULUR BALI / LULUR MANDI
16644,Sisir Kutu Rambut Elektrik V-comb Vacum Vacuum Terbaru Licetec
16645,[ ZERNII ] SARINGAN FILTER KERAN AIR
16646,JAM TANGAN  WATCH IPHONE RUBBER HITAM TOUCH SCREEN CASE WARNA
16647,Baterai Lenovo A7000 A 7000 K3 Note BL243 BL 243 Double Power Batre Batrai
16648,SKINNY BELT WANITA
16649,KODOMO Foam Orange Pump 250ml
16650,BIG HEAD PLATINUM HEAD HUNTER 100GR 100 GRAM OKIKO PAKAN PELLET PELET MAKANAN IKAN LOUHAN
16651,snap n grip kunci pas inggris serbaguna universal wrench baut mur keran air pipa pengganti tang
16652,Sunlight Jeruk Nipis 100 750ml Botol || Pencuci Piring
16653,WALLPAPER DINDING Wallsticker Walpaper 45 cm x 10 M TEMA PINK SALUR GARIS BATIK VINTAGE BINTANG
16654,Buku The Best Drilling Tes Masuk Kampus Ikatan Dinas 2021 + CD
16655,"Cream leher dosting whitening arbutin,cream leher dosis tinggi,cream leher original"
16656,BERAS SUMO  Premium 10 kg 10kg
16657,SEPATU BOOTS PRIA SAFETY CLADICO LION LOW ORIGINAL
16658,[300gr] H027 | HANDUK BAJU DEWASA | HANDUK BAJU KARAKTER | WEARABLE TOWEL | HANDUK KIMONO
16659,Kokoku Beras Merah 2 kg
16660,LEM PERANGKAP TIKUS PAGODA LEM KUALITAS JEPANG - Lem Tikus - Rat Trap
16661,MOBIL TAAYO ISI 4 PCS PULL BACK / BUS TAAYO
16662,JAM TANGAN GST 8600
16663,Kertas - Paper one - A4 80Gsm - PO
16664,SAJADAH BUSA QUILTING IMPORT TEBAL
16665,Exstra Lentik dan Tebal Bulu mata tanam Knot Free Eyelash exstension [COD]
16666,"(Bisa cod)DISKON,.. !!!Hammock beban max 150kg/hamock beban max +150kg /Ayunan gantung singel"
16667,BRASOV 50 Ml Original Parfum BPOM
16668,Buku Papan Tulis Hijau Anak Erasable Book Buku Gambar Bisa Dihapus / Buku Menggambar Anak
16669,SHINAR GLAMOUR LASER CUT Gliter Hijab Segi empat Polos Premium || DISKON PROMO GROSIR Part 2
16670,Nutrinidrink rasa vanila (READY STOCK)
16671,SH Bento 3pcs Rice Mold
16672,CELANA PENDEK PRIA CHINOS PREMIUM
16673,Chilkid PHP 800gr  Chil Kid PHP 800 gr Chil Kid P-HP 800 gr
16674,Bantex Collector Pocket PP (10 sheets) #2159 08
16675,Zwitsal Baby Bath Natural Rich Honey 300ml
16676,Sajiku Bumbu Nasi Goreng 20gr
16677,Baju Sauna / Sauna Suit / Pakaian Olaharaga Sauna Suit Unistar
16678,MBELLASHOP - 16PC=1KG NEW STYLE 2020 MAGIC WATER BOOK - BUKU GAMBAR MEWARNAI ANAK - PB 180 - EDUKASI
16679,New Asi Booster Herbilogy Breastfeeding Capsule
16680,GK13 Kresek Bola Lampu Hitam Jumbo 40 x 02 x 60 Kantong Plastik Murah
16681,Marshwillow Nail Boom Nail Polis Playfull Series (set) by Natasha Wilona
16682,AK66 Enam Jari Tombol Pengendali Game Mobile Joystick Gamepad Trigger untuk PUBG
16683,Ultima II Delicate Translucent Powder
16684,Teropong Monokular 16x52 Focus Zoom Adjustable Teles
16685,KAOS KAKI KOREA BAYI MOTIF ANIMALS / KAOS KAKI BAYI DAN ANAK.
16686,MINYAK BALUR
16687,Pembersih Telinga LED Korek Kuping LED Ear pick
16688,[ BISA COD ] DOMPET PITA LIPAT / DOMPET MINI ALEESHA
16689,Nu Green Tea Edisi NCT 127
16690,Helm bogo Retro Kulit dan Glossy Motif Sepatu Hitam Putih Kaca Bubble halfface
16691,ORIGINAL ALAT REPAIR SEPEDA KOMPLIT 1 SET TOOLKIT BIKE SAHOO POMPA TAMBAL BAN KUNCI dll
16692,Masker Anak Scuba Printed
16693,ONE-K13 Kotak Kosmetik Arylic Rak Tempat Kapas Kotak Perhiasan Multi Fungsi Kapas & Cotton Bud
16694,ELBER HL0076 TUDUNG SAJI LIPAT LAPISAN ALUMINIUM FOIL SIZE BESAR PERALATAN DAPUR MURAH BATAM IMPORT
16695,RUMANA KIDS SYARI GAMIS ANAK SET KERUDUNG TERLARIS
16696,TAS IMPORT FASHION SELEMPANG 93120
16697,CANDA DRESS / DRESS REMPEL BAWAH SUSUN
16698,Pixy Waterproof Mascara Blue
16699,"Pureco Home Liquid Fruit, Vegetable & Salad Wash 500ml"
16700,Tempat Sampah Injak Bulat 10 Ltr C11 Lion Star (Step On Dustbin)
16701,Atasan Wanita - YESSI TOP Atasan ABG Kekinian Atasan Wanita Muslim Atasan Blouse Wanita Terbaru
16702,Blacksoap
16703,CUCI GUDANG SEPATU VANS MERAH  PRIA TERMURAH TERLARIS KULIAH SEKOLAH SANTAI HENGOUT
16704,GOON Smile Baby Pants S40 / M34 / L30 / XL26 / XXL24
16705,Vania tunik
16706,"Masker Motif Kotak ""BALI"""
16707,GRATIS BUBBLE WRAP + DUS - Jam Dinding Kantor Rumah Classic Polos Klasik Putih Minimalis [750 GRAM]
16708,visor beat F1 beat injeksi model TGP 2014
16709,WAISTBAG NISYA SABYAN/WAISTBAG MURAH/TAS PINGGANG/TAS KOREA/TAS MURAH/WAISTBAG HITS
16710,Willsen Ninio F-338 Training Cup 3 in 1
16711,Fast Charger LED Light Micro USB / Type-C QC 3.0 Charging Cable iPhone Cable
16712,Belt  fashion
16713,R8 1822 Backlight Keyboard Gaming - Black
16714,TINTA / CATRIDGE HP 680 BLACK / COLOR ORIGINAL 100%
16715,Vitacimin Vicee vitamin C 500 mg (100tablet/box)
16716,"b""WINSOR&NEWTON COTMAN WATER COLOURS SKETCHERS' POCKET BOX - 12 HALF PAN"""
16717,Gratis ongkir SMARTWATCH  DZ09 / DZ 09 U9 + BOX SMART WATCH JAM TANGAN PINTAR HP ANDROID GSM
16718,SIMPLE REFRESHING FACIAL WASH 150ML
16719,PROMO TAHUN BARU!!! Tas Selempang Wanita FUNNY
16720,MISSHA Airy Fit Sheet Mask Masker Wajah Sekali Pakai [BPOM]
16721,Headphone Bando EXTRA BASS MDR-XB450AP + Mic
16722,Barefood \xe2\x80\x93 Pota Sweet Potato Chips Himalayan Salt 50 g | Keripik Ubi
16723,Sandra gamis Busui Armani silk size S-XL
16724,BPOM HALAL HERBAL Asi Booster MOM UUNG Pelancar Asi / 60 Kapsul kelorcap kelor kapsul
16725,Pigeon Bottle And Nipple Brush
16726,Fishing Reel 6000/4000 One Way Aluminium Body & Rotor Iron Pioneer AE6000 / AE4000
16727,NYX Professional MakeUp 3 Steps to Sculpt - Face Sculpting Palette Make
16728,Stool Bangku Bakso dengan berbagai pilihan warna 32 CM tinggi 45 cm MRS
16729,GAMIS JUMBO - NOVA DRESS - BIGSIZE SAMPAI LD 140
16730,Pakaian kucing/Baju Kucing/ Pakaian Kostum anjing Kucing
16731,BISA BAYAR COD Kuas Cat Tembok Roller Pintar Facil Kuas Cat Rol Cat Tembok Rol Cat Pintar Kuas Rol
16732,Famela Maxi Gamis Remaja Terbaru Dress Muslim Wanita Termurah
16733,Blender Capsule 4 Pisau Tajam ANTI KARAT Capsule Cutter Quarte Blender Kapsul Blander Belender
16734,Topi Korea baseball cap YOUTH style humble Korea Rafel Ory
16735,"JARUM PENTUL PIRING BULAT MUTIARA PREMIUM UKURAN 1,25 INCH / 1,5 INCH (3CM / 3,5CM) TAJAM"
16736,BAJU BASEBALL TERBARU TERLARIS
16737,Jam Elegant Full Varian
16738,Sarung Tangan Plastik masak sarung plastik stp hand glove cleany kharisma stp
16739,Nike zoom
16740,KINGS - 421 Boneka Bantal Pillow KPOP  / Mang Van Tata Chimmy RJ Cooky Shooky Koya
