tid,title
30926,[ORIGINAL] LVN COLLAGEN / POMEGLOW COLLAGEN 1 BOX ISI 10 SACHET / GLOWING/ PEMUTIH WAJAH BADAN
30927,Tali rami
30928,Karet Jepang Tabung
30929,PYRAM - ELBINA SET GAMIS PLUS OUTER PLUS JILBAB
30930,Avione Liquified Longwear Lipstick Miranda 4 Gram
30931,120ml Botol Kaca Silinder Bulat 120ml BOTOL Jar 120ml botol jar Beling 120 ml DAN TUTUP BARU
30932,"b""KAOS RAGLAN MERAH PUTIH POLOS Dewasa dan anak lengan 7/8 EDISI 17'AN harga ecer"""
30933,Tenda Anak Terowongan Tenda Anak 3in1 Bisa Dilipat Portable Tenda Main Anak Tenda Anak Mandi Bola
30934,FOCALLURE CONCEALER LIQUID / CAIR FA-52 /Rajamarket
30935,Jam tangan cewek J 253
30936,Sarung Kasur Busa Monalisa 120x200 Tinggi 15 cm dan 20 cm Paling Terbaru - Resleting
30937,Pulpen lilin
30938,Mamypoko Pants Royal Soft Boys and Girl M42 / L34 / XL30 / XXL24h
30939,Sweety Bronze pants Jumbo S64/M58/L52/XL42/XXL34
30940,(27AN.ID) COD Gelang H18 gelang Paku Besi  gelang paku Aksesoris tangan Cantik Murah gelang B14
30941,Mobil jadi robot Transsformer Biru
30942,The Body Shop Tea Tree Face Lotion 50ml
30943,Glossy Photo Paper / Kertas Foto A4 230 gr Combo
30944,BELIA SKIRT // ROK PLISKET PREMIUM // BELIA PLEATED SKIRT
30945,Hanasui egg white masker putih telur peel off
30946,PROMO Sweety Gold Comfort NB/S/M
30947,HANASUI INTENSE TREATMENT SERUM 25ml |Rich Nutrition | Bright Up | Propolis
30948,Original Navy Club EEHH Tas Selempang Travel Tahan Air Waterproof GBH 728
30949,FYG OSM TALI PENGIKAT EMPENG / RANTAI PENGIKAT EMPENG / TALI DOT / TALI KLIP EMPENG
30950,Warung Shiha - Madu Murni Multiflora JSR
30951,Somethinc Niacinamide + Moisture Beet Serum 20ml/40ml NEW PACKAGING
30952,Sepatu Pria Crocodile Morisey Zipper Safety Boots Tracking Kerja Lapangan - Proyek
30953,PAKAI RESLETING TOTEBAG/TOTE BAG
30954,Aurabright Whitening Serum for acne
30955,headset handsfree earphone bluetooth i7 TWS iphone 7 8 / i7s wireless android
30956,Elhababy Tempat Tidur Bayi Set Kasur Bayi Lipat Kelambu Kado Bayi Baru Lahir
30957,BOLA KARET BASKET 5016 - MAINAN BOLA BASKET
30958,rak lerberg besar
30959,TERMURAH Tempat Susu NINIO Travel / Milk Powder Container / Dispenser Susu Bayi BY-607
30960,LIMITED STOCK!!! PUMA Warmwear Multifungsi - Black O Neck PUMA2609-KL
30961,kuncir rambut korea / kuncir rambut jepang / ikat rambut chibi
30962,Singlet / Singlet Anak / Kaos Dalam Anak / Singlet Bayi / Kaos Dalam Bayi / Gambar Warna
30963,Acnes Spot Care 12 gr
30964,STIKER DINDING PETA DUNIA KEREN WALL STICKER SD024
30965,Pompa Udara Elektrik Tiup Vakum Electric Air POMPA ANGIN LISTRIK
30966,Lipcream Maybelline Super Stay Matte Ink Seri Barcode Satuan
30967,Anti Crack Case redmi 6x Redmi Note 5pro MI A2 Vivo Y69 V7 Zenfone 4 Max MI MIX J5 Pro J5 2017 J3Pro
30968,Lampu Neon USB Strip LED 22 cm Ruang Belajar Kerja Tidur Dapur Meja Rumah 22cm
30969,CELANA LEGGING MANSET BASELAYER 3/4 GRADE ORI
30970,Dar Masker Wajah Ekstrak Rumput Laut Berat 15g Untuk Melembabkan/Memutihkan/Menutrisi Kulit
30971,Miranda Keratin Protein Hair Conditioner 100 ml
30972,Miranda Keratin Smoothing Spray 50ml / Vitamin Rambut
30973,Konicare Minyak Telon Plus 30 ml
30974,3.5mm 3.5 mm Microphone Youtuber With Clip ON Mic 2 garis Vlogger Vlog NEW
30975,Natur Hair Tonic Gingseng 90 ML
30976,Celana Kulot Bali Lilit Dyedye
30977,RICISESTORE | BRA TANPA KAWAT RENDA FASHION WANITA / BRA RENDA IMPORT MURAH / BRA LACE / BRA301
30978,[Per Batang] Lipcream NYX Negara 8802 Box Cream
30979,Sahira KVA Mimi Spray BPOM
30980,ARCTIC AIR COOLER FAN Mini Kipas AC Portable USB Air cooler Ultra 2-16
30981,Per SACHET MAMABEAR Soyamix 20gr - Minuman Pelancar Asi  SoyaMix Mama Bear ECER
30982,Loose Leaf Isi 50 Isi Kertas File Joyko A5
30983,Tas Selempang Wanita Mini CHAOMFIRFN K25 Terlaris Bisa Bayar Di Tempat
30984,New Cool Sugar Wax
30985,Instaperfect MATTECENTRIC Lip Crayon 04. JOY 3 g
30986,Lakban Ekatape murah bisa campur coklat bening
30987,TUNIK STAY BUSUI ADA KANTONG KIRI KANAN
30988,Progas Kompor Portable 2 In 1 Gas Kaleng /Gas Elpiji 3 Kg & 12Kg 2in1 plus tas traveling
30989,SHINZUI BODY SCRUB 200 GR
30990,Kacamata TaffSPORT BOLLFO & Mask Motor Retro Trail Cross - Paintball Airsoft Gun Mask
30991,NEW..!! KUAS TABUNG MAKE UP ISI 12PCS / BRUSH MAKEUP
30992,KAOS 3SECOND THREE SECOND 3SCO DISTRO TERLARIS TERMURAH
30993,Kaos Polos Anak Combed Oneck 30s Size 2
30994,MP-ASI & Mom Sharing Hits di Instagram      Devi Aprianti
30995,\xe2\xad\x90BAGUS\xe2\xad\x90 BEDAK IMPLORA 320 3in1 SUELUTTU COMPACT POWDER  / BEDAK IMPLORA 320 / BEDAK SULUTU
30996,Sarung Wadimor Motif Padang
30997,ALquran AISYAH kecil A6 Hc/terjemahan/untuk wanita
30998,"b""PROCHIZ Keju Slice 10'S 170Gr"""
30999,CHARGER XIAOMI ORIGINAL FAST CHARGING QC 3.0 5V 2.5A / 9V 2A
31000,Camera Case Slide Protect Cover Lens Protection Case For iphone 7 8 Plus X XR XS MAX 11 Pro Max
31001,BEBELOVE 1 200GR (HIQ-EQ)
31002,Laki-laki Perempuan Kacamata poligon Logam Cermin Datar Bingkai kacamata optik
31003,Lion Star Bruno Tempat Saus / Sauce Keeper 550 mL (TS-55)
31004,Baso aci original
31005,SEPATU CT II warna HITAM ukuran 37 38 39 40 41 42 43
31006,Baru Exp 2021 Kurma Date crown khalas 1kg/khalas/date crown khalas/khalas 1kg
31007,Scarlett Whitening Facial Wash
31008,Keyboard Case Touchpad Wireless Bluetooth iOS Android Windows
31009,Masker non medis sritex
31010,FRISIAN FLAG SUSU KENTAL MANIS POUCH 560GR
31011,10gr MASKER GELATIN BY PICNIC.ID
31012,xiaomi miband 4 original global version new 100% original
31013,Implora Deep Black Mascara Original BPOM
31014,KABEL LAN 25 METER TERPASANG RJ45
31015,"b""Qur'an Saku Madinah | HAWARIY STORE"""
31016,PIYAMA ANAK JUNIOR SIZE 6-10 TAHUN
31017,Yang Belum Usai : Kenapa Manusia Punya Luka Batin?
31018,BETASON N CREAM 5 GR KIMIA FARMA
31019,Wardah Eyebrow Pencil Brown 1.14
31020,Madu Anak Ratu Lebah Junior DHA GOLD
31021,OSM JKT H719 Wallpaper Dinding Foam 3D / Motif Batu Bata / Motif Batik/Motif Kayu/Sticker Dinding
31022,CR CMK012 Xylophone/Alat Musik Ketukan Kayu Mainan Edukasi Anak
31023,Power Bank 20000mah Original Powerbank VIVAN VPB-H20S Dual USB VIVAN 3 Output & 3 Input 22.5W
31024,Purbasari Hand Gel 50ml
31025,STAR CAM SC 23M Regulator Kompor Gas dengan Meter
31026,Chil kid platinum 800gr madu/vanila
31027,Obat ikan cupang adu betta medicine calcium tonic
31028,Koko lis hedlong baju koko lis simple lengan 3/4 four one  kurta pakistan
31029,Senar GITAR AKUSTIK string tx620 tx630 tx640 IMPORT TERMURAH
31030,Sepeda anak mainan MB21 Scooter Otoped Anak Roda 3 KUMBANG Skuter Bisa Lipat LED Di Roda  T8F0
31031,Medisoft Cotton Ball (Biasa)
31032,Porto Sandal Anak Laki-Laki 1028B Size 30-35
31033,Mama Lemon Pouch 780ml
31034,Lifebuoy Hand Wash Botol 200 mL Pump / REFILL 180ml HandWash Sabun Cuci Tangan Cair Hand
31035,[BISA COD] Handuk microfiber Motif Beruang gramasi 30x70 / Handuk Mandi Lembut
31036,BRACKET BEHEL AMPLOP
31037,Globalmarket.id Sepatu Sneakers Fashion Wanita Korea Import SYRA ORI [FREE KAOSKAKI & DUS] - SHG008
31038,PERASAN LEMON / PERASAN JERUK / ALAT PEMERAS STAINLESS STEEL
31039,Peeler Buah / Fruit Slicer
31040,Anker Powerbank Powercore select 10000mAh -A1223. New. White. Garansi resmi 1th.
31041,Gula Tabur Donat Claris 250 Gram
31042,JOLIECOLLECTIONS SARUNG TANGAN OVEN MICROWAVE ANTI PANAS / KITCHEN SET GLOVE / SARUNG TANGAN MASAK
31043,Mesin Penyedot Komedo RT-8080 / Alat Penyedot Jerawat / Mesin Pembersih Pori Pori / MY MOM
31044,oppo a71 a83 a7 a5s a3s k3 k5 a1k Flip Cover Mirror Standing Case Smart View
31045,Baju tidur anak / Piyama anak 5-10 tahun
31046,TOUCH SOAP DISPENSER SABUN CAIR 2 TABUNG / DOUBLE #EH067
31047,Quantum Selang & Regulator QRL032 Silver
31048,Niacinamide Serum
31049,IMBOOST FORCE TABLET
31050,Sosis Ayam Champ 375gr isi 15 Pcs Termurah Halal
31051,\xe2\x99\xa5BUNDA\xe2\x99\xa5 SPEEDY CHOPPER ALAT POTONG SAYUR BUAH DAGING BAWANG MULTIFUNGSI
31052,(BISA COD 28-34) Celana Panjang Karet Cutbray Jeans Cewek Wanita JSK JEANS  /Jeanswanita/Celanajeans
31053,Soft Case All type hp phone  Candy Color Ultra-thin Solid Matte
31054,[ Besar ] Safi Age Defy Gold Water Essence 100ml
31055,[FREE TANPA MIN. PEMBELIAN] DAISY ORGANIC MASK FULL SIZE 60GR
31056,NIVEA MEN Creme Moisturizer - 30 ml
31057,TERMURAH !! WALLPAPER STICKER DINDING GH PREMIUM QUALITY 45cm x 10mtr SHABBY CHIC (BUNGA BUNGA)
31058,MAKE OVER RICHE GLOW FACE HIGHLIGHTER
31059,Dacco Mama Nipple Wipes Isi 25 Sachet
31060,My Bottle + Pouch Warna Infused Water 500ml - Botol Minum 1kg 10Pc
31061,Casing Pelindung Full Body 360 \xc2\xb0 Bahan Metal + Tempered Glass Anti Spy untuk iPhone 6 / 7 / 8 / X
31062,DC114 Flash Light Earpick / Alat Pembersih Telinga / Alat Korek Telinga Kuping Lampu LED
31063,"Piring untuk makan dengan aneka warna, warna pastel 6pcs 19 cm KLS"
31064,BENG-BENG
31065,45Pcs Stiker Kertas Motif Print untuk Dekorasi Album / Scrapbook DIY
31066,"b""JOHNSON'S Baby Powder Blossom 300 gr"""
31067,Tripod mini spider Holder u
31068,SPIDOL PERMANENT SEKOLAH IMPORT / SPIDOL ALAT TULIS SEKOLAH ANAK
31069,Legging Jegging soft jeans baby anak keren
31070,CRAYON STATIONARY SET 86 PC ALAT TULIS MENGGAMBAR PENSIL WARNA ART SET
31071,Xiaomi Redmi 8 Ram 4 GB Internal 64 GB garansi Resmi
31072,HC Kacamata Thug Life Double Mosaic Sunglasses Kaca mata Hitam Wanita Pria Unisex Import#Bisa COD
31073,PARFUM KOPI BALI / PARFUM MOBIL
31074,Receiver Parabola KVISION BROMO C2000 K Vision HYBRID C BAND DAN KU BAND
31075,ELBER ACC136 JEPIT RAMBUT FASHION WANITA JEPIT RAMBUT MODEL X SILANG JEPIT RAMBUT MURAH BATAM IMPORT
31076,Alat Pijat / Relaksasi Kepala Bokoma
31077,SWEATER BASIC HITAM M-XXL
31078,iphone 6s 64 GB Baru Asli Original Garansi 1 Tahun Distri Apple
31079,Terry Palmer Premium Handuk Dewasa 70x140 Lembut - Tebal - Antibacterial - Sangat Menyerap
31080,Indonesia Fresh Sari Lemon (500ml)
31081,GOOGLE HOME MINI SMART SPEAKER ORIGINAL minus dus penyok / robek
31082,PLASTIK BUBBLE(PENGAMAN PAKET)
31083,PLAIN MAXY BAHAN CERRUTY FULL FURING ORIGINAL BY RS
31084,DS BRA-308 BRA WANITA TANPA KAWAT BRA SPORT WANITA BRA FASHION WANITA
31085,Habbatussauda Ajwa 210
31086,DOMPET CHANNEL SAPHIRE SUPER DOMPET WANITA CHANEL FLIP
31087,WET N WILD Color Icon Eyeshadow Quad
31088,Dot Silicone SML Huki
31089,mukena anak unicorn pink sejadah
31090,PEMISAH KUNING TELUR - SENDOK SARINGAN
31091,Alat Mesin Cukur Rambut atau kumis Portable Sonar SN 5802 / 6020
31092,HIJAB DENAY KW MOTIF CANTIK/MOTIF ROMETRIA 3
31093,Penghilang Baret Lecet Mobil Compound Body Poles Kompon
31094,( HARGA TERMURAH ) Cp Zaki Zakia / Couple Lebaran
31095,Ennwen PF10 MAP Iconic Solid color A4 Stationery File Folder
31096,TALANG AC KESEHATAN / AC REFREKTOR merk TALACUS / PENGHADANG HEMBUSAN AC 0.5 - 2 PK (MAX 108CM)
31097,Natasha by dr Fredi Setyawan Facial Wash Oily
31098,KAOS RAJUT TURTLE NECK MAN
31099,Lem Korea Handsome Serbaguna / Lem Korea Cair Power Glue Lem Korea Serbaguna / Lem Korea Handsome
31100,Miranda Hair Mask Tube - Aloe Vera 160gr
31101,Wardah Renew You Anti Aging Facial Wash 100ml
31102,SOS HAND SANITIZER ANTISEPTIC SPRAY 100 ML  / ANTISEPTIK
31103,Frozen detox
31104,Nice Tissue Wajah Soft Pack 250 Sheets 
31105,Jaket Jeans Pria Wanita  M - L - XL - Jumbo (bisa COD)
31106,PYUNKANG YUL Essence Toner 100ml
31107,DOUBLE TAPE BUSA 3M Pe Foam Tape 24mm x 4M ORIGINAL
31108,Catyzole Drop 30ml - Obat Cacing Kucing Obat Cacing Untuk Kucing
31109,ULEKAN BUMBU DAPUR STAINLESS
31110,Emina Sugar Rush Lip Scrub 4.2 g
31111,KACA FLAT INJAK HITAM CLEAR
31112,Madame Gie Daily Care Face Mask - Masker Anti Droplet 5 Pcs
31113,Hijab Niqab Aminah Khimar Purdah ^ Jilbab Niqob Cadar Ceruty Murah Terbaru Fashion Muslim Wanita
31114,BIJIAN 80 x 120 bendera Indonesia - bendera merah-putih - bemdera Agustusan - bendera kemerdekaan
31115,DRINK PHONE GRIP Motif Bobba Bubble Tea Sbucks Coca Cola Pepsi Griptok Phone Holder Grip Glitter
31116,Masker KN95 Hitam Katup Filter Earloop Surgical Mask 3D Respirator Original Anti Virus Medis N95 ORI
31117,BAYCLIN 500ML PUTIH PAKAIAN
31118,"b""Baju Muslim Anak Perempuan Gamis Syar'i - Millo"""
31119,[Neogen] Real Fresh Foam Cleanser 4 Option/Olive Young/Get It Beauty/Sebum/Pore Care/Step Cos
31120,Khimar Syari Cadar Lengan Khania 4in1 by Vazya
31121,Aseptic Gel Hand Sanitizer 250ml OneMed
31122,CUCI GUDANG | Ara dress mo
31123,"[KKS] Penahan Poni, Tempelan Rambut, Hair Velcro, Jepiptan Poni"
31124,Kaos anak laki laki termurah 1-9 th
31125,0026 Keranjang Multifungsi bisa untuk tempat pakaian dan mainan anak - white flaminggo
31126,Official Original Silicone Real Liquid Case Samsung Galaxy S8 Plus Cover Samsung S8 S8+ Casing
31127,Wing Needle Needle Wing Onemed no 23
31128,Fan casing imperion Kipas Gaming Imperion FA-G12-04 Orbit 120mm Ring RGB
31129,Pakaian Dalam Cewek Wings Bra  Bra Tempel Seamless  Push Up Bra  BH Wanita IMPORT
31130,"Bahan kain sprei disperse per 0,5 meter"
31131,\xe2\xad\x90\xe2\xad\x90\xe2\xad\x90\xe2\xad\x90\xe2\xad\x90Kaos Kaki Avo panjang diatas lutut
31132,Nescafe Clasic Sashet - Netto 10 bks x 2 gr
31133,Giorgio TALI PINGGANG DOUBLE G BELT WANITA BELT FASHION SABUK KULIT BUATAN POLYURETHANE IMPORT
31134,LAMPU T10 JELLY 8 LED 2 WARNA SENJA SEIN STROBO
31135,[1KG=30 PCS] MGM 84 COD Tas Kosmetik Polos Wanita Pouch Wanita Import / Tas Makeup / Pouch Organizer
31136,EYE KIDS SWEATER RAJUT ANAK / Baju Rajut Anak / Kaos Rajut Anak / Sweater Rajut Anak Laki Laki
31137,Celana Chino Original Motz Khaki / Abu Muda / Cream / Hitam / Abu Tua
31138,Lampu Taman Lampu Solar 30 Led Lampu Tenaga Surya Murah
31139,Jarum nano jarum 12 pin jarum 36 pin 1 pin 3 pin buat bb glow mts sulam alis bibir
31140,Voucher Smartfren 4GB
31141,DUDUKAN PONSEL LIPAT
31142,Mybaby Dress Princess Katun Bayi Perempuan Tanpa Lengan untuk Musim Panas
31143,Rexona Women Anti- Perspirant Deodorant Roll on Shower Clean 45ml
31144,Has dalem babi special
31145,Sikat Pembersih Sedotan Stainless Steel Straw Bush Cleaner
31146,Terry Palmer Handuk Mandi Morning Whistle DENTA BAMBOO  uk 70x135 cm
31147,Sedotan sendok stainless/sendok teh kopi / spoon straw hx128
31148,BONEKA PANDA XL 65CM TERLARIS
31149,Bio Herbal Hair Tonic Herbal 250ml Bpom ( Hair Herbal Hair)
31150,Stretch Mark Minimizing Cream
31151,istanatoys.com Tenda KERUCUT Castle Istana Anak Jumbo Warna
31152,Gantungan Tempat Sampah Attach A Trash
31153,Sipulen 10kg  all variant
31154,pepsodent siwak action 123 190 gram
31155,Niceday Gantungan belakang pintu 6 kaitan Gantungan pakaian tas GB880
31156,JUBAH KERAH + PECI ANAK USIA 0-3 TAHUN
31157,JOK ORI FAMILY TYPE 136 / Jok Baby Walker Family 136
31158,PIGEON Bedak Padat Bayi - Baby Compact Powder Cake Chamomile White 45 Gr - Paraben Free
31159,Emina Sun Protection SPF30
31160,Madu Sarang Honey Comb Fresh Honey 250 gram
31161,SABUN TANAMU TANAMI SOAP KEMASAN BARU ORIGINAL 100% ASLI SABUN KUTUS KUTUS TAMBA WARAS TAMANU OIL
31162,[11.11 SALE] Marelow - Sepatu Sneakers Pria Casual Import - SNK7036
31163,JJ Royal Coffee Java Monk Robusta Ground Bag 200gr
31164,Alat Semprotan Air / model Pistol Semprot Taman / Hose Nozzle type 506
31165,Cone Mangkuk bola kaki futsal training Latihan Kun Mangkok Marker speeds 005-01
31166,Power Bank VEGER Ultimate X10 PRO 10.000Mah LED Display Qualcom 3.0A Original
31167,DNM Lip Gloss Glitter Shimmer Warna Warni Anti Air
31168,DOODLE Exclusive Telon Oil - Minyak Telon Aroma GreenTea - 60ml Travel Size
31169,Natural Brown Flaxseed 250Gr
31170,Pixy Uv Whitening BB cream / Perlengkapan Make Up
31171,BOOSTER SEAT Sugar Baby KURSI MAKAN BAYI SIT ON ME FOLDING SEAT Bouncer sugarbaby
31172,Keju Cheese Prochiz Gold Cheddar 170gr Processed Cheddar Cheese
31173,JAM TANGAN LED SPORT DIGITAL FASHION WANITA/PRIA JAM TANGAN MURAH IMPORT LED WATCH STRAP RUBBER
31174,B3B568 mainan edukasi mini lapptop 4 bahasa ada layar
31175,Ready Stock Velvet Masker Kain masker motif Dewasa/ Masker Anak motif Velvet Masker NonMedis
31176,FREE ONGKIR Sepeda Dorong Tempat Duduk Putar Hadap Depan dan Belakang Sincan Canopy Putar
31177,SONGKOK NASIONAL/PECI POLOS TINGGI 9
31178,Natur Miracle Calming Face Serum : Cica & Witch Hazel 30 ml
31179,Milly Shirt Nara Button Dress Edith Outer Felicia Set Print Series by Gelsey Rooms Official
31180,Okiko platinum
31181,Miranda Hair Vitamin Blister - Olive Oil 6x1ml
31182,Samsung A10s 2/32GB
31183,SANGKAR KANDANG BESI MINI UNTUK UNTULAN BAWA BURUNG LOVEBIRD SUGAR GLIDER HAMSTER LANDAK SMINI
31184,Lap Fiber mobil - kain Lap cendol - Lap sarung Tangan microfiber F139
31185,Habbatussauda Serbuk HNU 210kpsl - Habbats Jinten Hitam Murni - Habbatussauda Serbuk
31186,Hair Oil Original Tumbuh Lab - Minyak Rambut
31187,PAYUNG LIPAT 3 MOTIF KOTAK CANTIK
31188,Gunting Kuku Karakter Mini Imut-Imut / Mini Nail Clipper Lucu
31189,HADA LABO GOKUJYUN ULTIMATE MOISTURIZING LIGHT LOTION 100ml (GARIS HIJAU)
31190,Silica gel blue isi 100 sachet penyerap lembab dan bau pengawet elektronik
31191,Timbangan Gantung Digital Portable Electronic Scale 50 KG
31192,Cincin Model Terbuka Aksen Mutiara Imitasi Adjustable Untuk Wanita
31193,Parutan Mini / Parutan Penghalus Bawang / Garlic Grinder - X302
31194,Koko Qurta Trimuji Pakistan Ready 3 Ukuran - Maroon
31195,cover sepatu  / sarung  sepatu anti air  cover shoes model tribal
31196,Senter tangan tenteng senter multipungsi village 5720 cod
31197,Prochiz quick melt (170gr)
31198,Minyak bulus putih Papua ~Original 100% ada exp di bawah
31199,JOJU COLLAGEN DIPEPTIDE 1.000mg PENGGANTI CL COLLAGEN ORIGINAL
31200,Kompor Gas Kaca SUGGO 2 Tungku SG-208
31201,AIR SOFTLENS NICE LOOK 60ML / CAIRAN SOFTLENS / AIR CUCI SOFLEN
31202,Kain Tabung/Masker Serba Guna
31203,Enblanc Indipink Korea - Tissue basah Korea - Baby wipes. SAFE utk Newborn babies
31204,SPIN CUTTER - Blender Tangan Pemotong Daging Buah Sayur
31205,Buku Mengenal Abjad dan Mengenal Angka Untuk TK PAUD
31206,Timbangan Digital Kitchen
31207,Painting knives set 5 Pisau palet
31208,Sandisk MicroSD Ultra 64GB UP TO 100MB/S Class 10 non Adapter
31209,WOODEN KNOB / mainan puzzle knob murah/ puzzle background puzzle kayu
31210,KIWI Express Shine Neutral 7 ml
31211,Baseus Velcro Cable Strap Pengikat Perekat Kabel 1M
31212,minyak goreng kemasan Siptop 1000ml pouch dan botol
31213,KRS - Kardigan Knit Stardy / Kardigan Crop Kancing / Kardigan Rajut Crop
31214,metanol 5 liter / alkohol 70% / disinfektan
31215,"Masagi kemasan 215gr - Perbaiki Pangkreasnya Maka Gula Darah Akan Stabil, Herbal Diabetes,"
31216,MAIZENAKU TEPUNG JAGUNG 100gr - CORN STARCH MAIZENA TEPUNG PATI JAGUNG
31217,Sarung Tangan Karet Palm Fit Glove CG 805 BK
31218,Cussons Baby Mini Bag Gift Set Bayi Cussons Set Bedak Bayi Cussons
31219,SPEAKER BLUETOOTH MINI JB-5002/JB-5001 SPEAKER WIRELESS USB/TF CARD/MP3 PLAYER SPEAKER MINI
31220,Ringlight Selfie Lamp 16cm Plus Tripod Ring Selfie LED Lampu Selfie 16 cm
31221,Bonibol Cokelat
31222,PULPEN KAPSUL / VITAMIN / PULPEN TERMURAH SOUVENIR PERNIKAHAN / pena kapsul
31223,YOU Golden Age Revitalizing Night Cream 18g [ Overnight Skin Reviving Complex]
31224,DIALOGUE Alat Bantu Jalan Bayi Owl Series | Dialogue Baby Walker Assist Tool (DGA 4203)
31225,Kaos Training Amor ( KTK ) / Baju Olahraga / Baju Running All Size
31226,Lampu LED strip Selang RGB 2835 SMD Rope Light warna warni
31227,Scarlett Whitening By Felicya Angelista
31228,KLAIRS Sample isi 3ml
31229,"Vitamin c, C 1000 sidomuncul"
31230,BAYAR DI TEMPAT KAOS DISTRO SCREAMOUS / KAOS SCREAMOUS / KAOS PRIA / KAOS DISTRO PRIA
31231,Sorex Cd Wanita Brukat Renda Flower Lace CD 30096 Semi Transparan Freesize (Setara L-EL)
31232,Baju Kaos Katun Pria Tie Dye Abstrak Lengan Pendek
31233,GULA AREN PADAT 1 KG MURNI NIRA AREN ATAU ENAU DESA SILURAH GULA MERAH GULA AREN
31234,NEW RIB Turtle neck (Premium) Ribb kerah Berdiri/ turtle nex full catton  terlaris
31235,Novel Why Secretary Kim 2 by  Jeong Gyeong Yun
31236,Celana Jeans Levis Pensil Skinny Pria Ukuran Besar 27 - 38
31237,Isi Binder Titik Titik & Kotak Kotak by Atas Meja Pack 50
31238,Kerupuk Babi (tanpa label untuk reseller) 125gr
31239,LCD Jangka Sorong Digital Caliper Vernier Sigmat Kaliper
31240,Sarung Wadimor Gerimis 777
31241,Hippo PowerBank ILO F1 7500mAh - Garansi Resmi
31242,Sisir Kutu Rambut Elektrik V-comb Vacum Vacuum Terbaru Licetec
31243,Mika Lampu Stop Nmax NEMO/ Kaca Mika StopLamp Rem Belakang Smoke Yamaha NMAX
31244,NEW - CELO SLIMMING JAMU DOUBLE BOOSTER
31245,AONEZ Holder pen rak pensil 4 tingkat multifungsi 20*5*9cm
31246,Osm - F540 Sepatu Flatshoes Karet Wanita Termurah
31247,Promo Baru Ready 5 Warna Jam Tangan Pria Apple Touch Screen Digital Rubber AP15
31248,GFS MT BELT BROWN KULIT SINTETIS
31249,Giotto Acquerelli Mini Watercolor 36 WaterColour Cake Cat Air Pocket
31250,Xiaomi Redmi 7A
31251,Sarung Tangan Plastik Strawberry isi 100pcs
31252,Baju Handuk / Wearable Towel / Handuk Multifungsi Kimono 135-70S
31253,Shinpo 110 CB 30 Container Spark Box Plastik 30 Liter Dengan Roda CB30 Kotak Kontainer
31254,Makanan kucing Savvy kitten 800gr
31255,Double Dispenser sabun /dispenser sabun kamar mandi
31256,GST 8600 - 115rb
31257,Sambal Ijo Bu Rudy
31258,Jual HELM DEWASA MUMER T1 SUPER DOBEL VISOR 2 KACA READY STOK Berkualitas
31259,ORI CAT Kitten 500gr pakan kucing
31260,Jam Meja Unik / Jam Kayu Untuk Kado Shabby Chic Tema Burung - Sweep Movement
31261,LOLA TUNIK KOMBINASI / NINDYATUNIK / OCHA TUNIK MOSCREPE PREMIUM
31262,Mamypoko extradry M72/mamypoko extrasoft M72/mamypoko tape M72/mamypoko extradry tape M72
31263,BEST SELLER PUSAT GROSIR MUKENA ANAK MY MELODY FLANEL (TAS RANSEL)
31264,bubblewrap plastik bubble 10 meter x 30 cm bubble wrap
31265,Kaos Kaki Anak Bayi CUTE ANIMAL 3D Impor.
31266,[TU] 6pcs Gantungan Dinding Serbaguna / Gantungan Hook - HW0056
31267,PARFUM BRASOV EAU DE PARFUME / PARFUM HALAL BRASOV
31268,Buku Papan Tulis Hijau Anak / Erasable Book Buku Gambar Bisa Dihapus Buku Menggambar Anak
31269,Gamis anak Azarein premium ori assyabiya
31270,Kuru Walking Assistant Belt Belajar Jalan Bayi
31271,SS COLLECTION - Topi Rambut Kepang / Baby Hat Wig / Topi Bayi Rambut Kepang
31272,NUTRICIA NUTRINIDRINK 400GR
31273,Merries good skin M34
31274,Cetaphil Gentle Skin Cleanser 59 ML
31275,Neck Ring Bayi / Pelampung Renang Anak / Ban Leher Baby Neckring
31276,Toples Plastik Tempat Penyimpanan Makanan Wadah Bumbu Toples Kulkas Freezer Safe Bambang SH 22 pcs
31277,KOKO Baju Ayah Qonnoq Branded Panjang Pendek
31278,"Batu Potong WD 4"" ASLI Tipis dan Tajam"
31279,Sepatu sneakers kelasik grade ori-
31280,KSIECNALB HOODIE SWEATER PRIA WANITA TERMURAH
31281,kuas dan spatula masker 2 in 1
31282,Ariul 7Days Mask - Pomegranate
31283,Kalkulator CITIZEN 12 Digit - Calculator CITIZEN TYPE CT-212J
31284,HORDENG KOLONG DAPUR
31285,Headband chiby bandana kawat chiby bando chiby
31286,Softex Hello Kitty 911 First Period Kit
31287,Laneige Lip Sleeping Mask Mini Size
31288,Kitoderm Facial Soap Acne Tea Tree Oil (Hijau)  - sabun muka berjerawat
31289,Renu fresh multi-purpose solution 60ml
31290,Peci Songkok NU | Peci Bordir | peci Nu
31291,Masker scuba anak-anak gramasi 280 motif  hello kitty
31292,(COD)SEPATU ADIDAS GAZELLE OLD TRAFFORD GRADE  ORI/ sepatu basket/ sepatu senam/ sepatu gowes/voly
31293,BEST SELLER Almom Booster Milk Powder Yummy Pelancar ASI Booster Sari Almond Susu Lemom Tea Granule
31294,READY STOCK!!! Tempat Kapas Acrylic Bahan Tebal Best Quality 100%
31295,Speaker Bluetooth 5.0 VIVAN VS1 Outdoor Waterproof Support SD Card
31296,JOLIECOLLECTIONS KARET IKAT RAMBUT POLOS KOREA / KARET JEPANG SIMPLE ELEGAN / KUNCIR RAMBUT
31297,MUKENA TERUSAN PRADA KRISDAYANTI SEMI JUMBO By Khadijah Label
31298,BESS - Sweater Crop Murah Wanita / Sweater Crop RAINBOW
31299,PREWALKER BAYI PREMIUM IMPORT / KAOS KAKI ANTI SLIP(prewalker 1)
31300,SEPATU SNEAKERS PRIA DAN WANITA AUTHENTIC ERA MARON CASUAL KETS SEKOLAH ( TANPA BOX )
31301,3Pcs Celana panjang bayi Size S
31302,GOON SMILE PANT S40/M34/L30/XL26/XXL24/karisma.susu
31303,VAVL VIGHTNE Blemish Serum by Virginy Valentine (vivalentine)
31304,Keset Kaki Mikrofiber / Keset Kaki Cendol
31305,BISA BAYAR COD Rekatan Plastik Sealer Mini Generasi Gen 2 / seal snack makanan kecil / hand segel
31306,5A Kabel Data Micro USB / Type C Fast Charger Cable Dengan LED untik iPhone Huawei / Xiaomi /Samsung
31307,TISSU LIVI FACIAL REFFIL 554 GR MURAH
31308,Farma Wdc 3in1 SPC 10%
31309,Tinta HP 680 Black / 680 Color HP680 HP680B / HP680C Original Ink Advantage Cartridge
31310,SWEETY SILVER PANTS S66 / M60 / L54 / XL44 / XXL36
31311,TAS PRIA RANSEL PUNGGUNG MURAH I1Q5 TUMI Alpha Bravo Kelley Sling Blac sling bag leba TERMURAH F8B6
31312,Sandal Red Apple AS 2613 Original Thailand Bangkok
31313,Timbangan Perhiasan dengan Digital LCD Stainless Steel 500g 0.1g Electronic LCD Pocket Weight Scale
31314,bluelans\xe2\x99\x98Anting Tusuk Gantung Wanita Bentuk Geometri Persegi Hollow Ganda untuk Pesta / Hadiah
31315,Jarum Pentul Mini / Jarum Pentul Hijab
31316,sandal jepit spon pria owen murah
31317,Custom Nama Pajangan Huruf A - T Sekilo=24pcs
31318,[ Nude & Matte ] Maybelline Color Sensational Liquid Matte Lip Cream
31319,Lifree Popok Celana
31320,VIVA Queen Eye Cream Revitalizing 15 gr
31321,100% ORIGINAL EMINA
31322,Ft. SKMEI AD 1016 Jam Tangan Pria Original Quartz Analog Digital LED Anti Air Water Resist Watch
31323,LIP TINT 3CE VELVET / 3CE VELVEL LIP TINT (BEST SELLER)
31324,Samsung Buds - Silver
31325,HelloMaster - 665 - Tas Handbag Wanita KOREA FASHION IMPORT
31326,Lampu tembak LED Bar CREE sorot kabut 6 mata titik worklight Offroad
31327,Mainan Anak Mobil Robot Transformer Mecha Ares Light and Music Murah
31328,CS - Kemeja Jeans Wanita Fringe Rawis
31329,[BPOM] MISSHA Airy Fit Sheet Mask | Original
31330,OTIN FASHION baju tidur wanita PAW PAW konveksi murah tanah abang
31331,BUKU ZIKIR AKHIR ZAMAN ABU FATIAH AL-ADANI MENYAMBUT KIAMAT DENGAN DZIKIR
31332,ECERAN Indomie Goreng Reguler Mi Instan Goreng Lengkap Bawang Goreng & Saus Cabe Halal MUI - 85gr
31333,Celana Chino Hitam Trust Denim Cult Black  Original
31334,FMD [Bayar Di Tempat]1 Mister Humidifier Pembuat Kabut Buih Ultrasonik Untuk Kolam Air Mancur
31335,Kabel Splitter Jack 3.5mm 2in1 Headset + Mic External Murah
