tid,title
16741,CELANA JOGGER CARGO // JOGGER PANTS CARGO AMERICAN DRILL
16742,CUP KERTAS 9.5 ISI 100LBR - KAP KERTAS - BAKING PAPER LINER - CUPCAKE LINER - CUP MUFFIN - CUP BOLU
16743,SELSUN GOLD WITH DOUBLE CONDITIONER
16744,Spons Sponge beauty Blender spons egg/sponge telur Makeup Bentuk Tetes
16745,"[3 pcs] Fluffy Paket Celana 3/4 Grey Series Size S,M,L,1,2,3"
16746,Spons Beauty Blender - Makeup Powder Puff - Beauty Sponge Kosmetik
16747,sepatu ax2
16748,Holder Handphone Jepitan Handphone Holder Tripod
16749,Kupluk bayi
16750,Laneige Perfect Renew Eye Serum 14ml Perpanjangan Sempurna Serum mata \xe2\x98\x85Shipping From Korea (Pengiriman Dari Korea)\xe2\x98\x85
16751,\xe2\x9a\xa0\xef\xb8\x8f[ PROMO ]\xe2\x9a\xa0\xef\xb8\x8fALL TYPE TEMPERED GLASS ANTI BLUELIGHT 10D XIAOMI / OPPO / VIVO SAMSUNG REALME / IPHONE
16752,Cosmos Rice Cooker Harmond SPEKTRUM CRJ-6288 - 2 L
16753,KELFI BAJU KAOS BAYI / ANAK PEREMPUAN - TANGAN BALON MOTIF
16754,Sabrina amanda double kerut BALI TERBARU!! Cailyn top
16755,Lcd Touchscreen Samsung Galaxy J1 Ace J110 J110H Original New
16756,GLOW 1 ( CREAM MALAM ) THERASKIN
16757,MINISO Tas Selempang Wanita Mini silinder Sling Bag Kecil Bulat Boston Fashion Lucu
16758,[COD] Cable Kabel Data charger iPhone Lightning Original iphone 5 5s 6 6+ 7+ 8+ X XR XS XSMax
16759,"b""Pond's White Beauty Clay Mask/ Masker Wajah 8 Gram"""
16760,MIYAKO HAND MIXER HM-620
16761,PROMO CATOKAN RAMBUT MINI HAIDI TOPSONIC HAIR CARE HD768 BLOW CATOK SISIR BLOW HAIR DRYER SISIR
16762,Dettol Pouch Skincare Body Wash [450 mL]
16763,(COD)Dompet Wanita D61 Dompet Panjang Wanita dompet murah real pic
16764,[ Refill ] Wardah Instaperfect Matte Fit Powder Foundation 13gr
16765,Madu Uray - Raw Honey 450 gr (330 ml) - Madu Murni Sehat - Madu Hutan - Madu Asli - Jagapati
16766,Acnes Natural Care Milk Cleanser Oil Control 110 ml
16767,Dompet Kartu / Dompet ATM Emoney Card Clip
16768,"Trigger Gaming, Joystick Game Pad Kontroller Gen 3 R1 / L1 Game Pad"
16769,Sorex Cd Mini Basic 1227 Katun Mix
16770,VEGER ROCKET / kabel data VEGER ROCKET bulat 2.4a FAST
16771,(ECER) Liptint Sasimi Hello Kitty Panjang
16772,Micoe Rak Kamar Tidur Dapur Troli Kamar Mandi Removable Rak Penyimpanan 5 tingkat Putih
16773,SERBET RAHAYU WARNA
16774,SABUN BPOM BIBIT PEMUTIH BY SYB ASLI
16775,HIJAB TALITA SYRIA RUFFLE REMPEL TALI BERGO NON PED ANTEM WOLFIS PREMIUM
16776,Gula Semut Organik | Gula Aren Organik Sertifikat Halal 1000 gram 1 kg
16777,Royal Canin Kitten 36 400gr
16778,Bra (bh) Tally 985 (kawat tanpa busa 36-42)
16779,La Tulipe Acne Soothing Mist
16780,LAMPU TUMBLR (10 METER )
16781,[PART1] Sarung Batik Halus Motif Wayang Gunungan - Warna Kuning -MACAN -VESPA-NAGA Gus Azmi Gus Tuin
16782,Pigeon Tall Straw Bottle
16783,Mic Clip On Youtubers -Prankters
16784,"Buffy Aqua Antiseptik 50ml [ Penghilang Bau Badan, Ketiak, Bau Kaki ]"
16785,Segiempat Swedia Hijab Square Voal saudia
16786,Dove Body Cream Intensive Nourishing 75 Ml
16787,Sweety Silver Pants S66 M60 L54 XL44  XXL36
16788,CHOKI CHOKI STICK COKI COKI STIK COKLAT POKEMON
16789,Masker Ateja Mask Kain Non Medis 3 Lapis / Ply Model Earloop Headloop Hijab Ukuran Dewasa Anak SNI
16790,Sarung Tangan Jersey Hawa | Bisa Touch Screen | Wedding Gloves - Sarung Tangan Panjang Sampai Siku
16791,Tas Ransel Sport Unisex Wanita Sport Backpack Punggung Olahraga Daypack Travel Bag Quechua ARPENAZ
16792,OVERSIZED KANTONG (Jumper Anak-Romper Anak)
16793,Lilin Kecil Pembakar Minyak Aromaterapi - Glimma Candle - Candlelight Candle
16794,grosir daster midi solo termurah
16795,"ZAHIRA DRES,,SERUT RENDA 3 SUSUN"
16796,FYG OSM GUNTING KUKU LUCU/ JEPIT KUKU KARAKTER UNIK LUCU/ CUTE NAIL CLIPPERS
16797,[innisfree] Vivid Cotton Ink (Blur) 01 4G
16798,Masih Ingatkah Kau Jalan Pulang - Sapardi Djoko Damono & Rintik Sedu
16799,Kitchen Set Koper 3 In 1 Little Chef Mainan Edukasi masak masakan
16800,(2KG) SHENAR RAK BUKU 3D 1X5 SUSUN ZAMAN NOW
16801,BACKPACK KALIBRE BALFOUR ORIGINAL TAS RANSEL PRIA WANITA
16802,Garpu Makan Polos Stainless silver ISI 12 PCS
16803,SanDisk Ultra Dual Drive OTG USB Type-C USB 3.1 Up To 130MBps - 16GB
16804,MG 279 Stiker BT21 3D / Sticker Tata Chimmy Koya Cooky Shooky RJ Mang Van / Stiker BT21
16805,Stroller Bayi Labeille KK7 Kereta Bayi Light & Low Price
16806,Baterai Original Samsung Galaxy Grand Prime J5 J2 Prime J2 Pro J3 J320 G530 G532 Battery Batre OEM
16807,Fitmee mie instan shirataki  Halal / Fitmee shirataki / Mie shirataki instan / fitmee carbonara
16808,KRAN ANGSA PVC . Kran angsa cuci piring plastik PVC . Kran Dapur BIRU
16809,Lakban Bening 100 yard CALLISTA Star tape
16810,Nahda Skincare Paket Normal/Acne
16811,Lactogrow 3 Vanila 750g
16812,Sepatu Ventela Public Low Black Natural / Dark Yellow / Dark Green / Navy / Maroon Original
16813,Mooi Kaos Anak Pocket Bordir SNI / Pocket tee
16814,Kraft 165 gr
16815,LIFECAT MAKANAN KUCING LIFE CAT POUCH KITTEN SALMON / CHICKEN / TUNA 85GR
16816,Cetaphil baby daily body lotion with shea butter 400ml
16817,Card holder dompet kartu Lipat Transparan korean style Wanita Import 2630
16818,Jam tangan anak karakter magnet miniso adventure time
16819,TERLARIS!! Mengusir Bau Badan Deodorant spray SR12
16820,BOLDe Super Cook Less Sugar
16821,Blackmores Calcimag Multi (60)
16822,Kopi 7 Elemen SEVEL HPAI HNI isi 20 sachet
16823,COD Face shield nagita import asli (ANTI FROG EMBUN)
16824,KIRANAOFFICIAL - ( COD ) celana jeans wanita casual  ( B22 / AB02 )
16825,Rafael Salgado Extra Light Olive Oil 500ml
16826,Alas Rolling Pemotong Adonan Kue Fondant Bahan Silikon
16827,Topi caddy golf lebar topi lapangan
16828,DENORA MAXI -  NONIHIJAB / SALENONIHIJAB / DRES MURAH / GAMIS MURAH / DRES MUSLIM / GROSIR BAJU
16829,Garnier Serum Mask Green Tea Skin Care x 3 - Masker Wajah Untuk Kulit Berminyak Rentan Berjerawat
16830,Speaker Universal SPK-S080 Subwoofer Speaker 2.1 Channel Design Speaker Audio for PC / Laptop New
16831,FASH002 Lem Kuku Palsu | Nail Art Glue Adhesive Grosir
16832,Tas Hp Palazzo 39283 - Dompet Handphone/ Tas Pinggang Hp / Tas Selempang
16833,Puspita M Madu Besar 640ml
16834,Penyambung Keran Air Cuci Piring Sambungan Kran Pancuran Flexible Silicon / Water Filter Splash
16835,LEGGING BIG SIZE / LEGGING HAMIL STELLA PREMIUM BY MYJIVI
16836,Beras Premium Queensativa 5 Kg - YGK (Harga + Ongkir)
16837,ZUVIA TUNIK // TUNIK BUSUI MOSCREPE
16838,MH-528 Rak Kosmetik Desktop storage Bahan WPC Design by MEGAHOME
16839,Jetz Chocofiesta Cokelat Kiloan 250gram
16840,RAKET NYAMUK STARK HAMMER STK-005
16841,Silkoro Serum Vitamin Rambut 200ML (BESAR)
16842,Hannochs SONIC LED Bulb 3 Watt - Bola Lampu Bohlam LED 3 Watt
16843,KOKO QURTA ZIPPER PAKISTAN - ATASAN MUSLIM PRIA
16844,NIVEA EXTRA WHITE INSTANT GLOW BODY LOTION 200ML
16845,Kardusan & Eceran Max Tea Tarik Renceng (10 pcs x 25 gram)
16846,SIRWAL LAA ISBAL/SIRWAL TEMPUR DEWASA AL HANIF SIZE L
16847,LEM KUKU GEL 12 PCS PER SET untuk fake nails atau false nails stocker nail stiker kuku
16848,LANEIGE Lip Sleeping Mask Berry 3gr 100% Original Korea Pelembab Bibir
16849,[READY STOK ] MILO CUBE IMPORT MALAYSIA ISI 50 PCS KEMASAN ORIGINAL MURAH
16850,LIPSTIK SHANNEN LIPSTICK SHANEN LIMITED EDITION
16851,Hawaii Lugano Keranjang Dengan Tutup (S)
16852,ADS make up set
16853,( ORIGINAL ) Xiaomi AirDots TWS Bluetooth Earphone Xiaomi Redmi Airdots Like airpod
16854,Azarine Eyeluminate Firming Serum 15ml C White
16855,Memory Card MicroSD MIcro SD Sandisk Ultra Class 10 32GB 32 GB A1 98MB/S
16856,Storage Bag Selimut Baju Lipat / Foldable Box Cloth Organizer PENDEK
16857,Lada putih 1kg kopepoe koepoe
16858,1Pc Tas Ziplock Anti Air untuk Travel
16859,Mixer V8 Soundcard External Audio Live Broadcast - Hitam
16860,[BIG SALE] Timbangan Dapur Digital Kitchen Scale SF-400 Murah
16861,Jam Tangan Anak Anak Cewek Perempuan Unik Bentuk Bunga Original SKMEI 1144
16862,Goto Kasa Rak Sepatu Kain Portable Susun Shoes Rack Lemari Serbaguna
16863,ST| Xiaomi Redmi 8 4A 4X 5 5A 5 Plus 6 6A 7A 8A Pro Note 4 4X 5 6 7 8 Pro Soft Enjoy Your Moring Smile Case
16864,Minoxidil From Kirkland ORIGINAL 100% COSTCO USA
16865,Cetakan Telur Rebus Unik / Silicone Egg Boil / Alat Masak Telur Rebus
16866,[748gr] G21 (ADA PISAU) Sendok Set Polkadot 24 Pcs Peralatan Makan Dapur
16867,Harry Potter#7: Harry Potter dan Relikui Kematian by J.k. Rowling
16868,">>TERMURAH !!<<  Kuas Masker Wajah (tidak bisa pilih warna , dikirim sesuai stok yg ada)"
16869,Sobaso Tepung Adonan Untuk Bakso 250 gr
16870,Snowman Brush Pen - Spidol Colour
16871,AF711 - Kaos Cowo Terbaru dan Terlaris
16872,ALQURAN SAMSIA UKURAN A5 KHOT USTMANI 15 BARIS
16873,Dudukan Plat Nomor Carbon Racing - Tatakan Cover Logo Model JDM
16874,Sadewi Set Muslim Wanita Setelan Baju Remaja Terlaris
16875,Lazy neck / Universal Holder / Holder Handphone / Holder Hp / Stand Hp
16876,Bantal Boneka Korea BT21 Kpop BTS Unofficial/Tata Chimmy Cooky
16877,Auto Focus Redmi 5X Xiaomi Mi A1 5.5 inchi Leather SoftCase AutoFocus
16878,Rolled Oat Australia 1 kg
16879,PEMBESAR LAYAR HP / ENLARGE SCREEN MAGNIFIER STAND
16880,Cover plat nomor HONDA original AHM set depan belakang
16881,SEPATU SNEAKER CASUAL PRIA CONVERSE ALL STAR LOW CHUCK TAYLOR CLASSIC PREMIUM 2
16882,Buku Anak - Belajar Bahasa Inggris Untuk TK
16883,Jilbab bayi mahkota mutiara
16884,Kacamata Anti Radiasi (Design Korea) Pria dan Wanita Hijab - HM449 ( Group )
16885,Bioderma Sensibio H2O Micellar Water 500ml with Pump
16886,SOMETHINC Niacinamide || SomethinC AHA BHA Peeling || Somethinc HYALuronic B5 || LEVEL 1% RETINOL
16887,SP.SEPATU PRIA Xv (39-43)
16888,MUKENA YASMIN TYARA REMPEL JERSEY PREMIUM
16889,TAFFWARE AIR HUMIDIFIER OIL DIFFUSER AROMATHERAPY RGB NIGHT LIGHT 1000ML
16890,Bantal pijat massage pillow mobil Bantal Pijat Leher Punggung Portable 202-1
16891,[READY] DOMPET DISIPLIN KEUANGAN BULANAN / WALLET ORGANIZER / DOMPET KEUANGAN
16892,POPSOCKET 3D TIMBUL BTS POP SOCKET BT21
16893,ROUND Peva Taplak Meja Anti Air Bulat
16894,Philips Avent Replacement Straw Set 12m+ - SCF797/00
16895,WIRASHA MAXI LIGHTGREY
16896,Tinta Epson L100 L110 L120 L200 L210 L220 L300 L310 664 Original
16897,LADYBUG TOOTH BRUSH / Tooth Brush Holder Motif Kumbang
16898,Pemimpi(n) Uncensored - Wildan Alamsyah *Edisi ttd penulis
16899,"b""MARCKS' Teens Compact Powder 12gr"""
16900,Scuba Culot White (1)
16901,Homyped Pandawa 01 Sandal Gunung Anak Hitam
16902,Al Quran Asy Syifa A4 Tajwid Perkata Latin - Alfatih
16903,Ramayana x The Sandals Sneaker Wanita Tanpa Tali (RLTN-1737-PUTIH)
16904,Diosys Hair Color EE-ZY 100ml
16905,LEMONILO MIE INSTANT / MIE GORENG LEMONILO 70 GR
16906,ESKULIN KIDS mist cologne 60 ml
16907,Lakban BENING XOZIE Original ISOLASI 12mm Grosir Isolasi Xozie Solasi 24mm Selotip Solatip Murah
16908,Bantal sofa pure silicone ukuran 40x40 isi 5 pcs
16909,Somethinc AHA BHA PHA Peeling Solution [READY STOCK]
16910,Soft Casing Silikon Matte Frosted Ultra Tipis untuk Apple iPhone 6 / 6 Plus / 6s Plus / 7 / 7 Plus / 8 Plus SE 2020 XS XR MAX/ iPhone 11 Pro MAX
16911,SERUM TABITA GLOW ORIGINAL(VITAMIN E)
16912,TALI HP GANTUNGAN HP MOTIF SUPREME BORDIR UNIVERSAL
16913,Polymailer Plastik Packing Olshop Tebal Putih 25x35 cm (100pcs)
16914,Empeng buah / Dot buah untuk bayi
16915,PIGEON PERISTALTIC NIPPLE ISI 3 Slim neck /standart neck / NIPPLE PIGEON / DOT BAYI
16916,MASKER YOURA ORGANIK OAT PREMIUM [ DISTRIBUTOR RESMI BALI ]
16917,MOOI SETELAN KAOS ANAK TSHIRT RETRO SET 0-3 Tahun
16918,Ottogi Sesame Oil 320ml*
16919,Lucas Papaw ointment 25g ORIGINAL AUSTRALIA/lucas pawpaw
16920,Temepered Glass oppo A33/Neo 7
16921,Sendal wanita balance CMS 1605-8
16922,AKU Saus Teriyaki - BB 340 ml
16923,MUKENA BORDIR BELINDA JUMBO By Khadijah Label
16924,Earphone Handsfree Headset PHILIPS AT-036 FULL BASS
16925,VASELINE REPAIRING JELLY 100% PURE ORIGINAL
16926,MASKER SHIELD ANAK LIFE MASK SHIELD MASKER ANAK MASKER KAIN ANAK FACE MASK SHIELD ANAK MASKER MURAH
16927,Philips Avent Bottle Natural 260ml/9oz
16928,Kuas Masker Kuas Makeup Brushes Kosmetik Pink
16929,Focallure Blush On Powder Mineral Pigment 11 Warna FA25
16930,Termurah - Selang Air Magic Hose
16931,Kasus Shockproof Kasing Telepon Trunk Soft Case iPhone 11 Pro Max XS XR X 6 6s 7 8 Plus
16932,DoubleStick Kayu Nunchaku Kayu Tongkat Alat Bela Diri Olahraga LX001-1
16933,Belfoods Uenaaak Nugget Ayam Stick 500 gr
16934,Masker organik Poupeepou
16935,KAOS ZOLAQU 100% ORIGINAL TERBARU TERLARIS HIJAU DAN NAVY
16936,Softlens Sky Soul Baby Eyes 15mm NORMAL / Softlense / soflen
16937,Usb Hub Saklar 4 Port On Off
16938,Celana dalam pria Gtman 704 BW | 704 B | Pakaian Dalam GT man | CD Pria RPG 704BW 704B
16939,"Best Seller AYO, BELAJAR HIJAIYAH! AUGMENTED REALITY 4D - Bord Book / Magic Books/ Original/Segel"
16940,Cutter Blade Refill Isi Pisau Pemotong Joyko A-100 1 Tube 5 Pcs
16941,Focallure Lip Tint Cair Velvet Lembut untuk Plump Kosmetik Bibir Lipstik Lipstick Cair FA86
16942,Boneka Hello Kitty Topi SNI
16943,Sprei Kendra Polos Jacquard Single Ukuran 100x200 & 120x200 Tinggi 25cm
16944,Shampo Kucing Anjing Anti Jamur dan Kutu  Kill Bact Flea & Tick Sulfur 250ml
16945,MASKER KAIN BAHAN SCUBA PREMIUM QUALITY
16946,Abaca magic beads AQUAbeads 1500 lebih beads
16947,TAS RANSEL BTS PITA FASHION KOREA / TAS SEKOLAH / Backpack Korea Stylish
16948,Sabun Bidara plus VCO 20 gram BPOM
16949,[Bayar Di Tempat]FY Cover Pelindung Handle Rem Universal Bahan Silikon Gel untuk Sepeda Gunung
16950,bnb Nivea Extra White Body Serum Night Nourish 180ml nivea hand body serum night nourish sidoarjo
16951,SUNNERSTA Wadah gantung 12x11 cm
16952,Totole Kaldu Rasa  Ayam Jamur HALAL MUI
16953,FACE SHIELD KACAMATA ANAK KARAKTER
16954,Timbangan Digital SF-400 Kitchen Scale 10 Kg
16955,"b""LOREAL L'OREAL PARIS REVITALIFT PRO - YOUTH FACE MASK - BRIGHTENING ESSENCE PLUMPING ESSENCE"""
16956,Holder Botol Minum Bahan Aluminium Ringan untuk Sepeda MTB
16957,TJ BAJU MUSLIM KOKO QURTA AGAM PAKISTAN TERBARU
16958,\xe2\x9d\xa4\xef\xb8\x8fGTB\xe2\x9d\xa4\xef\xb8\x8f E006 Lampu Natal Model Bintang Warna Warni Hias Natal 10 Meter Tahan Air Import Batam COD
16959,daster polos bali
16960,Pen Gel Zebra Kokoro Pulpen Kokoro Zebra Gel 0.5mm
16961,Bubble wrapp tambahan packingan
16962,Mizzle 225-17 Power Grip Ban Luar (Non Tubeless)
16963,CHILKID REGULER  - 800gr - VANILA / MADU
16964,Lion Star Jepitan Baju / Laundry Clip / Jepit Jemuran / Capit Jemuran 1 set isi 20 pcs
16965,NEW STRINGBAG KPOP / EXO / BTS / SEVENTEEN / WANNAONE / TAS SERUT [BAYAR DI TEMPAT] POLOS DRILL
16966,Air softlens / CAIRAN SOFTLENS A PLUS 100ML
16967,Blackmatte custom back print lebih rapi
16968,Herborist Facial Mask
16969,Em4 Pupuk Organik Cair Perikanan dan Tambak (Efective Micro Organisme)
16970,READY! Lemona Gyeol Collagen / korea nano collagen from fish + vitamin c
16971,Kintakun Selimut Luxury Lembut & Mewah 190x210cm Colourfull
16972,KAFTAN POLOS
16973,Jeans Anak Pendek 468/141618
16974,HIROKI GT 920 gas torch multiple portable burner pematik api barbeque
16975,KACA HELM BOGO MURAH FLAT DAN CEMBUNG KACA BOGO MURAH
16976,TAS TALI SELEMPANG STRAP PANJANG SLING LONGSTRAPFASHION
16977,BONEKA BAYI SUSAN BISA NYANYI /LOVELY BABY SINGER DOLL/Happy Baby Perfume Doll
16978,Celana Panjang Jeans Denim Casual Lembut Bayi Laki-laki untuk Musim Panas
16979,Balon Latex Metalik Chrome / Metalic Balloon Chrome 12inch ( 10pc)
16980,DOMP051 Tempat Pensil Little Unicorn 35gr
16981,LACTOGROW 3 Madu/Vanila/Plain 750 grm
16982,Carabiner NATUREHIKE  6cm NH15A005-H
16983,46pcs/box Stiker Lucu Gaya Jepang Untuk Dekorasi Diary/Scrapbook
16984,Keset Anyam Keset Rajut Murah isi 1pcs
16985,NADA MUNDUR ATRET 3 SUARA 12 -24 V
16986,Hoodie Pria aesthetic ANCE STUDIOS Beludru PanasMusim Gugur Berkerudung Dingin Remaja VersiKoreaTren
16987,PRENAGEN JUICE POME GRAPE/FRUIT&VEGGIE
16988,"b""Puritan's Pride Ultra Mega Biotin 10000 mcg - 100 softgel"""
16989,Clean Face Micellar Water 3in1 For Oily Skin
16990,Jamu Jestham
16991,Mobeo Sarung Setir Kulit Mobil PU Leather Steering Cover Universal 37 cm
16992,Paket Bedcover Bayi Plus Kasur Bayi Perahu Berkelambu Motif Polka Navy and Archerry | CBNK 029 PLUS
16993,Jilbab Pashmina Sabyan Diamond
16994,(skic) Sepatu Sneakers Bayi Laki-Laki / Perempuan Bahan Rajut Breathable Sol Lembut Warna Polos
16995,MARKS & SPENCER HAND & BODY LOTION /250ML /CHINA BLUE
16996,Jessen Pigeon Cotton Swab Small Tip / Cotton Buds Baby 100s - Refill
16997,Kotak Tempat Menyimpan Dalam Model Sekat Pakaian Storage bag livinghall.id
16998,(bisa COD) Rak gantung tumblr
16999,Mc Lewis Saos Sambal Extra Hot 1 kg
17000,BEDAK LOTONG ZHAFIRA 100 GRAM
17001,Headphone JBL MDR EXTRABASS Headphone Bagus Headphone Original
17002,Acnes Pore Strip (3 Sheets)
17003,Origami Sinar Dunia 16x16
17004,Scotch Brite Sabut Jaring Motif Tidak Menggores (ID-601)
17005,Hampers Lebaran By Orangeshopz
17006,Glowing Facewash BPOM - Skinsena
17007,gorden smokring embos
17008,Rachet Tie Down 1 5M Webbing Cargo Lashing Belt 5 M
17009,Blackmores Pregnancy & Breastfeeding isi 60 kapsul BPOM
17010,Keset AntiSlip Motif Import Murah / Keset Bulu Karakter / Keset Bihun AntiSlip Import Termurah
17011,CLAY DAS MODELLING CLAY 500GR / AIR DRYING MODELLING CLAY / TANAH LIAT
17012,DAZLING WHITE / DAZZLING WHITE / PEMUTIH GIGI INSTAN
17013,Penjepit bulu mata/ Eyelash Curler
17014,Samyunwan Wisdom Original Bercode - Samyun Wan
17015,VIVO Y53 2017 Y71 Y83 Y81 Y91 Y95 Y93 Y91C / ANTI CRACK FUZE BENING VIVO / FIBER / AKRILIK
17016,"Dispad  Vixion mio / Kampas Rem Depan Vixion, Mio New, Mio J, Soul GT lama, N-Max DISPAD YAMAHA 3C1"
17017,Tudung Saji Penahan Panas U50CM  ukuran large 50X50X20CM
17018,COD POS 808 Sepatu Sneakers Wedges Wanita Sport Fashion Wanita Korea
17019,Fresh Care Minyak Angin Aromatherapy Roll On 10ml
17020,Erigo Coach Jacket The Weekend Black
17021,Masker anak/masker motif/masker libby velvet
17022,BABY LEON PREMIUM BEDONG BAYI 4 PCS JUMBO 97 cm x 76 cm / Bedong Kain Motif HA BC-206
17023,Hawaii Lugano Keranjang Dengan Tutup (L)
17024,"Jahe Merah Super Mix Kencono Sari 250gr Racikan Jahe Merah Mix, Langsung Seduh ORIGINAL"
17025,Folamil Genio / Gold @30 Soft Capsule Vitamin Ibu hamil & Menyusui
17026,Plester Rolltape Micropore Refill for Eyelash Ekstension / Plester Selotip untuk sambung bulu mata
17027,BEST SELLER Sepatu Wanita  Zelyne SDS301
17028,TAS SOURDIERE CREAM PROMO SOPHIE PARIS
17029,USAGI - 1 PC CELANA PENDEK KAOS ANAK LUCU 2-4 TAHUN
17030,Infinix S5 Lite 4/64 (GARANSI RESMI)
17031,Yoqueen beauty Rose Water
17032,Legging Rok Lapis Miring Sport 960 Panjang
17033,Masker MASKR Filter Karbon Aktif SHORT - Anti Debu Polusi Asap
17034,Zara Splend ^
17035,PISAU BUAH STAINLESS STEEL TERMURAH !! [50]
17036,Soffell Bengkoang Lotion Anti Nyamuk Botol 80g
17037,Reusable Piano Key Sticker Keyboard Stickers 37/49/54/61/88 Piano Stave Name Note Sticker
17038,ROREC Facial Milk / Susu Mask Masker Korea Goat Milk Goats | Sapi | Natto
17039,Botol minum 2 liter - Seliya - Bejorejoshop
17040,TURBAN ANAK 3 BUNGA
17041,KACA HELM BOGO RETRO CEMBUNG BUBBLE VISOR MURAH
17042,Handuk bayi lembut mantap uk.60x100
17043,Fisher Price Busy Activity Walker - Mainan Belajar Jalan Anak Bayi
17044,Mainan Anak Avenger Iron Man Smart Dance Robot Super Hero LD155A
17045,BUFF MASKER MULUT BANDANA MULTIFUNGSI PENUTUP MUKA MOTOR IMPORT BUFF MOTOR PENUTUP MULUT MULTIFUNGSI
17046,100 gram Himalaya Salt - Garam Himalaya 100gr
17047,Paketan klt hijau  Gratis Bubble Wrap
17048,10 pcs / set boneka jari bentuk hewan kartun bahan plush velvet shp33.
17049,Vixal Pembersih Porselen Kamar Mandi Ekstra Kuat 780 ml - Karbol Porselen Lantai Keramik Kamar Mandi
17050,Etude House Eyebrow Drawing Original
17051,Balon foil huruf 40cm abjad warna silver gold biru pink motif chrome ballon alphabet
17052,ACNE LOTION / OBAT JERAWAT LARISSA
17053,Tas Selempang Wanita Import 7033 2984 92984 B313417 EL249 VC88030 LT1577 BQ2540
17054,"Sabun nuvo family 80 gram , nuvo family soap, sabun mandi batangan"
17055,Sekai Kipas Angin Meja / Dinding DFN 906 (2 In 1)
17056,BAJU KOKO PRIA MUSLIM BATIK HENDRIK 05
17057,Bibit tanaman obat salam daun salam (Syzygium polyanthum)
17058,Paket Lengkap Skin Care Perawatan Wajah Cream HN Original 15gr Plus Serum Gold Hanasui
17059,Sweety bronze comfort perekat M40 / Toko Makmur Online
17060,(Share) AXIS-Y Cleanser Toner Dark Spot Ampoule Duo Cream Sunscreen Mugwort
17061,Ventela Public Low Maroon
17062,"Asepso Sabun 80 gr Original - Kulit, Antiseptik, Gatal, Alergi"
17063,Pakan Kucing CAT CHOIZE 800gr
17064,PIYAMA SATIN EMBOS PP XL
17065,Souvenir gantungan kunci wayang rama sinta / souvenir pernikahan
17066,Baseus Car Vacuum Cleaner Portable Penghisap Debu Mobil
17067,OPPO A5 A9 2020 A53 A52 A92 A3s A5s A7 2018 A12 A1K Realme C15 C12 C11 C2 C1 C3 2 3 5 Pro 5i 5s X K3 F11 F9 F5 Youth F1s A71 A83 Doraemon Scoket Case Cartoon Phone Cover + Strap
17068,Mancis Gas Korek Gas Torch Flame Korek Api Bara Jet Unik Outdoor EDC HMR452
17069,Yummy Bites Cereal (NEW!!!)
17070,Totole Kaldu Jamur 80g
17071,Buku Anak - Cerita Binatang - Dongeng Edukasi Islami - Penerbit Jabal
17072,(COD) TAS JELLY GLOSSY SIZE 18 CM RANTAI HITAM | TAS SLEMPANG BATAM
17073,GRATIS ONGKIR !! Sappun heels Mika batam wanita terbaru - Duomo
17074,[BS] BISA COD KPOP BTS BT21 Sticker Warna Warni Cooky Tata Stiker
17075,dancow 3+ coklat 800gr
17076,TABITA GLOW PAKET TRIAL ORIGINAL / TABITA TRAVEL (glow) kecil
17077,MASKER POLOS KAIN SCUBA MURAH / MASKER KOREA SCUBA / MASKER KAIN
17078,Hand Sanitizer 1 Liter BPOM 70% Alkohol Denat
17079,Tas Bayi Medium Omiland Panda Series Abu Saku Print OBT4311
17080,NFS132 Gantungan Kait Tempel 6 pcs
17081,Musical Toys Nursery Merry Go Round / Gantungan Musik Untuk Bayi
17082,freemir Wheat Straw Snack Cup Tempat Makan Lunch Box
17083,Kodomo Pasta Gigi 45g
17084,LAKBAN YATTA TAPE BENING DAN COKLAT 45MM 70 YARD 50 MIC
17085,Dijual Tablet Pembersih Mesin Cuci isi 12 - Washer Deep Cleaning / Waching Machine
17086,Leedoo Tas Sepatu Kantong Serut Dan Tas Sandal Serut Travelling Shoes Bag TST02-A
17087,Celana Pendek Jeans Anak Rib Biru Muda 2-12 tahun...Termurah
17088,(3PCS) ORI JAPAN GENIE BRA / GENIE BRA ORIGINAL JAPAN WITH STIKER HIJAU ( SUMMER - CLASSIC - PASTEL)
17089,Bros jilbab Bros pin brooch Tombol Logam Jaket mutiara bros Aksesoris Fashion Untuk Wanita OM
17090,ZOLAQU BIKE SET (5 warna)-SC
17091,Zwitsal Kids Bath Active Blue Pump 280ml
17092,DASTER JUMBO  LD 120 RAYON SOLO HALUS TERMURAH
17093,Ransel Axelard Sophie Martin Paris
17094,Pisau okulasi best quality Produk LOKAL grafting sabit ukir  shaping knife Grafting
17095,SANDAL WEDGES SPON KN 02 SILANG
17096,Sepatu futsal specs accelerator lightspeed II ELITE in
17097,Handsfree Headset Bando XB-450 Bass
17098,MOOIMOM Breathable Hipseat Carrier Gendongan Bayi
17099,hb E5 KAOS POLOS ANAK ADEM NYAMAN BAHAN KATUN COMBED 30S KAOS ANAK MURAH 1-4 TAHUN
17100,STICKER REFLECTIVE WARNING SIGN MOBIL TRUK GLOW IN THE DARK RED WHITE
17101,COD \xe2\x9c\x94 COUPLE KATAKITA / CP KATAKITA MUSLIM
17102,\xe2\x9d\xa4 BELIA \xe2\x9d\xa4 EMINA Creamy Tint NEW 1-5 3.6g | lip tint creammy emina creamytint
17103,(BISA COD) TIKAP HIJAB Masker Original Cantika Hijab
17104,TBIG [COD] Sneaker Sepatu Tali Sepatu Korea Style Sepatu Santai Wanita
17105,Tas ikat pinggang olahraga lari
17106,SAJADAH / SAJADAH BULU / SAJADAH TURKI / ALIF / OLEH HAJI
17107,TAS  FASHION IMPORT GL182 GT120421 GQ2600 GO FASHION JAKARTA TAS SELEMPANG  SLING BAG TERMURAH
17108,Sabun Cair Kesehatan Zen 500mL Antiseptik Anti Bacterial Body Wash Pump 99% Bunuh Kuman
17109,PURBASARI HIMATTE LIP CREAM - LIP CREAM PURBASARI ORIGINAL - PURBASARI LIP CREAM
17110,Degra Simba Obat WC Mampet - Ecer dan Grosir
17111,M231 Kemeja Pria Koko Panjang Warna Abu 1279
17112,[500gr] Sarang Madu Mellifera/Melifera Madu Asli Murni Madu Sarang Asli COD Murah
17113,Mainan Keyboard Piano Musik Organ Karaoke Anak Little Musician Medium
17114,Emina Creamatte (Cream Matte) Lip Cream
17115,HC DFY-1000 Dompet Wanita Panjang Forever Young Korea Import
17116,Sendok makan stainless stell 12 pcs
17117,NOTA LIVE 100k
17118,"VR TSEL 2,5 JABAR 5H"
17119,Waistbag BASIC (Tas Pinggang basic)
17120,Teh Celup Black Tea @25 (Amplop)
17121,GAMIS WOLFIS SLETING BATIQ 108
17122,Tokojustin Mainan Edukasi Anak Edukatif Nail susun paku Puzzle
17123,Somethinc Niacinamide + Moisture Beet Serum
17124,DETTOL ANTISEPTIK CAIR 45 ML
17125,SIKAT KERAMAS
17126,"b""Al-Qur'an Al Hufaz Milenial (Terjemahan, Hafalan Mudah, Tajwid Warna, Full Colour, Original) CORDOBA"""
17127,Emina Masquerade Face Mask
17128,Cutting Mat Ukuran A1 - Double Sided Self Healing Cutting Mat A1
17129,Lampu Disco
17130,KAFTAN NAGITA/ GAMIS KAFTAN ORIGINAL BORDIR PAYET BAHAN MARBELA
17131,IKILOSHOP Dinosaurus Sendok Kuah Unik Besar Sayur Sup Sop Centong Berdiri
17132,drontal cat obat cacing untuk kucing ( per butir)
17133,"TEMPERED GLASS CERAMIC PREMIUM MATTE IPHONE,OPPO,SAMSUNG,VIVO,XIAOMI -TIPE ADA DIDESKRIPSI"
17134,ORICO USB2.0 HUB 4-Port - FL01
17135,"Kedaung Kukuruyuk Mangkuk Nasi / Rice Bowl 5"""
17136,Eyeshadow 12 Warna Tahan Lama Anti Air untuk Makeup
17137,Troley troli lipat bawa aqua galon dan gas trolley barang serbaguna
17138,Sandal / Sendal Karet Unisex Jelly APLLAUSE KAWS
17139,Handset Headset Vivo Mh 133 / HF R11 Original Handsfree earphone
17140,[LESSON 3] PIGEON Baby Training Tooth Brush Toothbrush Lesson Tahap 3 Tiga Sikat Gigi Bayi Anak
17141,harmony.id KACA MATA RENANG ANAK
17142,Lerberg Rak Ikea putih/abu tua
17143,Playmat Premium Anak Bayi Lipat Tebal 1cm Double Pad ( Bonus Tas) [ Playmate / Tikar Busa ] - Pusat
17144,Empeng Huki Silicone Orthodontic 2pcs
17145,Similac GainPlus 850 g (1-3 tahun) Susu Pertumbuhan - Milk Powder
17146,LOYANG PIZZA BAHAN TEBAL TINGGI 2 CM 1 pcs
17147,Batre Baterai Xiaomi Redmi Note 2 / Note 2 Prime BM 45 Original / Batrei Battery Redmi Mi Note2 BM45
17148,TUTUP PENTIL LED 7WARNA /RAINBOW
17149,Konicare Minyak Telon Plus 125 ml
17150,Kodomo Sikat dan Pasta Gigi Anak
17151,Stiker Star Wall Sticker Wallpaper Dinding Bintang Salju Lampu Dekorasi Glow in the Dark DSB
17152,Termurah Serut Candy Serut List Jilbab Instan Jersi Original GJM
17153,Kertas Memo Sticky Note/Post-It Bulat Motif Planet untuk Sekolah/Kantor
